行政区,电子监管号,项目名称,项目位置,面积(公顷),土地来源,土地用途,供地方式,土地使用年限,行业分类,土地级别,成交价格(万元),土地使用权人,约定容积率下限,约定容积率上限,约定交地时间,约定开工时间,约定竣工时间,实际开工时间,实际竣工时间,批准单位,合同签订日期
中江县,5106232014B01817,仓山镇偏偏店村,仓山镇偏偏店村,0.007502,0.007502,中低价位、中小套型普通商品住房用地,协议出让,70,其他服务业,五级,1.0592,蒋光友,1.00,,2014年05月08日,1900年01月01日,1900年01月01日,,,中江县,2014年05月08日
柳州市本级,4502002014B01317,柳州市育才路9号2栋4-2室,柳州市育才路9号2栋4-2室,0.013350,0.001170,其他普通商品住房用地,协议出让,70,房地产业,四级,0.3063,谭龙竹,0.00,0.00,1900年01月01日,1900年01月01日,1900年01月01日,,,,2014年05月08日
庆元县,3311262014A00597,庆元县中小河流水文监测系统水文站建设项目,庆元县松源街道城东老大桥边,0.100000,0.100000,水工建筑用地,划拨,,水利管理业,十四等级,25.7900,,0.77,0.77,2014年07月07日,2014年11月07日,2015年11月07日,,,庆元县人民政府,2014年05月08日
资兴市,4310812014B03669,住宅,资兴市鲤鱼江大兴路,0.003710,0.001268,其他普通商品住房用地,协议出让,41,住宿业,三级,0.6961,陈茂良,0.00,0.00,2014年05月13日,1900年01月01日,1900年01月01日,,,资兴市,2014年05月08日
南昌县,3601212014A00427,江西省南昌至宁都高速公路冈上至宁都段（南昌县段）,南昌县冈上镇、广福镇境内,123.158600,0.000000,公路用地,划拨,,城市公共交通业,十二级,0.0000,,0.00,0.00,2014年07月08日,2015年01月08日,2017年01月08日,,,国土资源部,2014年05月08日
宁海县,3302262014A04440,新建西店14-23-2地块道路用地,西店镇滨海工业园区,0.409600,0.000000,公路用地,划拨,,国家机构,十三等级,49.2831,,,,2014年08月08日,2015年05月08日,2016年05月08日,,,宁海县人民政府,2014年05月08日
绍兴县,3306212014A00767,农民公寓,齐贤镇陶里居,0.323600,0.000000,经济适用住房用地,划拨,,社会福利业,二级,72.6035,,1.58,1.58,2014年06月21日,2014年10月21日,2016年04月21日,,,柯桥区人民政府,2014年05月08日
余杭区,3301102014A00796,良渚街道好运路南锦江路东区块绿化及河道,良渚街道管家塘村,1.052900,0.000000,公共设施用地,划拨,,公共设施管理业,八级,0.0000,,0.00,0.00,2014年05月08日,2015年05月08日,2016年05月08日,,,余杭区人民政府,2014年05月08日
惠城区,4413022014B02386,曾振达、曾丽清申请划拨土地使用权补出让,惠州市龙丰花园水西路18号,0.006700,0.006700,其他普通商品住房用地,协议出让,70,房地产业,三级,6.7214,曾振达、曾丽清,,,1900年01月01日,1900年01月01日,1900年01月01日,,,惠州市,2014年05月08日
金州区,2102132014B00766,元得食品,金州经济开发区高新园3号路南侧、高新园12号路东侧工业地块内,1.858200,1.858200,工业用地,挂牌出让,50,食品制造业,五级,655.0000,大连元得食品有限公司,1.00,1.50,2014年05月08日,2014年10月10日,2015年10月10日,,,大连市,2014年05月08日
兴城市,2114812014B00166,兴城市201409A宗地挂牌出让方案,兴城市羊安乡佟屯村,0.498581,0.000000,工业用地,挂牌出让,50,纺织服装、鞋、帽制造业,十级,94.0000,王宝纯,0.80,1.50,2014年05月09日,2015年05月08日,2018年05月08日,,,兴城市,2014年05月08日
中江县,5106232014B01808,辑庆镇前进北街114号,辑庆镇前进北街114号,0.007000,0.007000,中低价位、中小套型普通商品住房用地,协议出让,70,其他服务业,五级,0.8680,吴德旭,1.00,,2014年05月08日,1900年01月01日,1900年01月01日,,,中江县,2014年05月08日
惠城区,4413022014B02379,李温群申请划拨土地使用权补出让,桥东惠新中街53号,0.008590,0.008590,其他普通商品住房用地,协议出让,70,房地产业,三级,9.3499,李温群,,,1900年01月01日,1900年01月01日,1900年01月01日,,,惠州市,2014年05月08日
宁海县,3302262014A04457,新建西店14-22-4地块道路用地,西店镇滨海工业园区,0.355000,0.000000,公路用地,划拨,,国家机构,十三等级,42.7136,,,,2014年08月08日,2015年05月08日,2016年05月08日,,,宁海县人民政府,2014年05月08日
平果县,4510232014B01334,原南华糖厂厂区A地块,平果县原南华糖厂厂区A地块,3.000200,3.000200,其他普通商品住房用地,挂牌出让,其他普通商品住房用地70年; 批发零售用地40,房地产业,三级,7695.5130,广西平果宏庆房地产开发有限公司,1.00,5.00,2014年06月01日,2014年06月30日,2017年06月30日,,,平果县,2014年05月08日
宁海县,3302262014A04477,新建西店14-21-2地块道路用地,西店镇滨海工业园区,0.500200,0.000000,公路用地,划拨,,国家机构,十三等级,57.8041,,,,2014年05月08日,2015年05月08日,2016年05月08日,,,宁海县人民政府,2014年05月08日
范县,4109262014A00141,范县城关镇东区中心幼儿园,东至祥和路、西至柳行头北街用地、南至妇幼保健院、北至德政街,0.737850,0.278810,科教用地,划拨,,教育业,三级,,,,0.80,2014年05月12日,2014年06月12日,2017年05月12日,,,范县人民政府,2014年05月08日
宁海县,3302262014A04465,新建西店14-20-3地块道路用地,西店镇滨海工业园区,1.446600,0.411200,公路用地,划拨,,国家机构,十三等级,167.5736,,,,2014年08月08日,2015年05月08日,2016年05月08日,,,宁海县人民政府,2014年05月08日
荔蒲县,4503312014B00572,李泽林 张爱琼住宅用地,荔浦县荔城镇城西街荔柳路123号,0.001318,0.001318,其他普通商品住房用地,协议出让,70,住宿业,一级,3.1698,李泽林 张爱琼,0.00,0.00,1900年01月01日,1900年01月01日,1900年01月01日,,,荔浦县,2014年05月08日
开封县,4102242014A00021,开封县第一人民医院迁建配套综合设施,县医院东侧、新城路北侧,0.836333,0.000000,医卫慈善用地,划拨,,卫生,一级,0.0000,,0.00,1.50,2014年05月30日,2014年07月01日,2015年07月01日,,,开封县人民政府,2014年05月08日
清水河县,1501242014A00037,清水河县林业棚户区（危旧房）改造项目,清水河县国有南壕赖林场,1.098000,0.000000,经济适用住房用地,划拨,,国家机构,十五等级,0.0000,,1.00,1.60,2014年05月09日,2014年05月28日,2014年12月30日,,,清水河县人民政府,2014年05月08日
成武县,3717232014B00223,年产100吨二苄羟、600吨氨硫三氮唑生产项目,汶上集镇苗楼村,1.365400,0.000000,工业用地,挂牌出让,50,化学原料及化学制品制造业,二级,150.0000,山东成武泽大泛科化工有限公司,1.00,,2014年07月08日,2014年08月08日,2015年08月08日,,,成武县,2014年05月08日
惠城区,4413022014B02367,陈建宇申请划拨土地使用权补出让,惠州市下角新村二路8号菱湖花园美景阁5号楼B单元1层02号房,0.001130,0.001130,其他普通商品住房用地,协议出让,70,房地产业,五级,1.4238,陈建宇,,,1900年01月01日,1900年01月01日,1900年01月01日,,,惠州市,2014年05月08日
洮南市,2208812014B00164,商住综合用地,洮南市教育路北侧、社保住宅楼东侧,1.219600,1.219600,其他普通商品住房用地,挂牌出让,其他普通商品住房用地50年; 其他商服用地40,房地产业,四级,537.2704,洮南市金宇房地产开发有限公司,1.00,1.50,2014年06月27日,2015年04月08日,2017年04月08日,,,洮南市,2014年05月08日
鄞州区,3302122014B07709-1,宁波大甬照明电器有限公司,鄞州区姜山镇姜山头村,0.611900,0.000000,工业用地,挂牌出让,50,其它,六级,520.1150,宁波大甬照明电器有限公司,1.00,2.00,2014年08月15日,2015年07月30日,2016年04月30日,,,宁波市,2014年05月08日
泊头市,1309812014A00106,泊头市贺庄子35千伏变电站工程,泊头市文庙镇郭东村东,0.188000,0.000000,公共设施用地,划拨,,其它,十二级,,,,,2014年05月10日,2014年05月15日,2015年05月10日,,,泊头市国土资源局,2014年05月08日
监利县,4210232014B00256,湖北顺昌门智能科技有限公司,监利县红城横岭村、容城镇半路堤村,8.000000,0.000000,工业用地,挂牌出让,50,金属制品业,四级,792.0000,湖北顺昌门智能科技有限公司,0.70,,2014年06月24日,2014年07月24日,2015年07月24日,,,监利县,2014年05月08日
鄞州区,3302122014B07723-2,宁波亚峰风电设备制造有限公司,"鄞州区姜山镇王伯桥村,姜山头村",0.808700,0.000000,工业用地,挂牌出让,50,通用设备制造业,六级,675.8350,宁波亚峰风电设备制造有限公司,1.00,2.00,2014年08月15日,2015年10月31日,2016年04月30日,,,宁波市,2014年05月08日
梓潼县,5107252014B00684,制造、销售生物技术香料等,文昌镇青龙村,0.453937,0.453937,工业用地,挂牌出让,50,农副食品加工业,五级,54.0185,四川惠泉生物科技有限公司,1.40,,2014年02月28日,2015年02月28日,2017年02月28日,,,梓潼县,2014年05月08日
惠城区,4413022014B02470,杨祖贤、杨晶申请划拨土地使用权补出让,惠州市南坛北路6号401室,0.001820,0.001820,其他普通商品住房用地,协议出让,70,房地产业,一级,1.1499,杨祖贤、杨晶,,,1900年01月01日,1900年01月01日,1900年01月01日,,,惠州市,2014年05月08日
六安市本级,3415002014B00880,化工新材料,六安经济开发区纵四路以东、横一路以北,5.091400,0.000000,工业用地,挂牌出让,50,水泥、石灰和石膏的制造,三级,753.0000,安徽柏宏化工新材料有限公司,1.00,0.00,2014年05月31日,2014年07月29日,2015年07月31日,,,六安市,2014年05月08日
晴隆县,5223242014B00096,晴隆县国有建设用地使用权出让,晴隆县南街社区,4.922800,4.922800,其他普通商品住房用地,挂牌出让,其他商服用地40年; 其他普通商品住房用地70,房地产业,十五等级,2150.0000,晴隆县金桂缘房地产开发有限公司,1.00,1.50,2014年05月13日,2014年06月30日,2017年06月29日,,,黔西南州,2014年05月08日
惠城区,4413022014B02465,姚钦顺申请划拨土地使用权补出让,河南岸凉井水,0.012890,0.012890,其他普通商品住房用地,协议出让,70,房地产业,二级,27.7130,姚钦顺,,,1900年01月01日,1900年01月01日,1900年01月01日,,,惠州市,2014年05月08日
肥西县,3401232014B00208,合肥皖润润滑科技有限公司,花岗镇,0.999600,0.999600,工业用地,挂牌出让,50,通用设备制造业,十级,182.9268,合肥皖润润滑科技有限公司,1.00,0.00,2014年06月16日,2014年07月20日,2015年07月19日,,,安徽省肥西县,2014年05月08日
晴隆县,5223242014B00106,晴隆县国有建设用地使用权出让,晴隆县莲城镇南街社区,5.063700,5.063700,其他普通商品住房用地,挂牌出让,其他普通商品住房用地70年; 其他商服用地40,房地产业,十五等级,2410.0000,晴隆县金桂缘房地产开发有限公司,1.00,1.50,2014年05月13日,2014年06月30日,2017年06月29日,,,黔西南州,2014年05月08日
怀安县,1307282014B00039,家居广场,京包线铁路东、振兴大街北侧，原怀安县果脯厂南院,1.067700,1.067700,批发零售用地,协议出让,40,零售业,一级,29.0000,怀安县志凌家具厂,0.70,1.00,2014年12月15日,2014年12月30日,2016年12月30日,,,怀安县,2014年05月08日
宾川县,5329242014B01219,住宅用地,宾川县中医院东侧、全球通大道北侧,0.011550,0.011550,其他普通商品住房用地,协议出让,70,住宿业,二级,9.9215,杨家兵,,,1900年01月01日,1900年01月01日,1900年01月01日,,,宾川县,2014年05月08日
樊城区,4206062014B01894,襄阳厚载科技有限公司,高新区天籁大道,4.366170,0.000000,仓储用地,挂牌出让,50,其它,四级,1467.0331,襄阳厚载科技有限公司,0.70,2.50,2014年05月29日,2014年10月29日,2016年10月29日,,,襄阳市,2014年05月08日
惠城区,4413022014B02450,赵雪娇申请划拨土地使用权补出让,惠州市下角大观塘1栋401室,0.001390,0.001390,其他普通商品住房用地,协议出让,70,房地产业,二级,0.5279,赵雪娇,,,1900年01月01日,1900年01月01日,1900年01月01日,,,惠州市,2014年05月08日
同安区,3502122014A01037,同安五显布塘片区边角地临时道路及绿化用地,厦门市同安区五显镇,4.585400,0.000000,公共设施用地,划拨,,公共设施管理业,七级,0.0000,,0.00,0.00,2014年05月08日,2015年05月08日,2018年05月08日,,,厦门市人民政府,2014年05月08日
太湖县,3408252014B01324,汽车城地块,新花路南侧，当代学校西侧,5.671350,0.000000,其他商服用地,挂牌出让,40,商务服务业,一级,4880.0000,太湖县新屹汽车城有限责任公司,1.00,1.26,2014年08月18日,2014年11月07日,2016年11月06日,,,太湖县,2014年05月08日
咸安区,4212022014B00536,咸安区鑫源房地产开发有限责任公司项目（汀泗老链条厂）,咸安区汀泗桥镇政府旁,1.109700,1.109700,中低价位、中小套型普通商品住房用地,挂牌出让,70,房地产业,二级,297.0000,咸宁市咸安区鑫源房地产开发有限责任公司,1.00,1.70,2014年07月30日,2014年12月30日,2017年12月30日,,,咸安区,2014年05月08日
顺德区,4406062014B84011,(佛山新城）邓伟祺,佛山市顺德区乐从镇平步居委会义成新园,0.009010,0.009010,其他普通商品住房用地,协议出让,70,房地产业,一级,8.6851,邓伟祺,,,2014年05月08日,2014年05月08日,2014年05月08日,,,顺德区,2014年05月08日
宾川县,5329242014B01208,住宅用地,宾川县金牛镇金叶路（房管小区北侧）,0.015000,0.015000,其他普通商品住房用地,协议出让,70,住宿业,二级,12.8850,赵仲琴,,,1900年01月01日,1900年01月01日,1900年01月01日,,,宾川县,2014年05月08日
监利县,4210232014B00268,湖北森杰木业有限公司,监利县新沟镇交通村,4.117492,0.000000,工业用地,挂牌出让,50,木材加工及木、竹、藤、棕、草制品业,四级,407.6300,湖北森杰木业有限公司,1.00,,2014年06月24日,2014年07月24日,2015年07月24日,,,监利县,2014年05月08日
奉新县,3609212013A00330,奉新县文体艺术中心建设项目,冯川镇赤埆社区居委会,6.856600,0.000000,文体娱乐用地,划拨,,国家机构,十五等级,0.0000,,0.30,0.00,2014年05月08日,2014年05月08日,2016年05月08日,,,江西省国土资源厅,2014年05月08日
肥西县,3401232014B00198,合肥市亨泽制造有限公司,桃花工业园,4.212011,4.212011,工业用地,挂牌出让,49.6,其它,十级,770.7980,合肥市亨泽制造有限公司,1.00,0.00,2014年06月16日,2014年07月20日,2015年07月19日,,,安徽省肥西县,2014年05月08日
马关县,5326252014B00036,2013—D—00120,马关县夹寒箐镇夹寒箐村委会（大寨二组）,1.017900,0.000000,工业用地,挂牌出让,50,仓储业,十五等级,550.0000,云南省烟草公司文山州公司,1.02,1.02,2014年05月09日,2014年05月10日,2015年05月10日,,,文山州人民政府,2014年05月08日
九江市本级,3604002014B00481,房地产开发,会馆街路与德化路交汇处,11.076179,11.076179,其他普通商品住房用地,挂牌出让,其他商服用地40年; 其他普通商品住房用地70,房地产业,三级,36219.1086,大连万达商业地产股份有限公司,3.50,3.50,2014年05月29日,2014年12月29日,2017年06月29日,,,九江市,2014年05月08日
平泉县,1308232014B00864,工厂化杏鲍菇生产,平泉县七沟镇七沟村,1.328200,0.000000,工业用地,挂牌出让,50,农副食品加工业,三级,280.0000,平泉县亿园生物科技有限公司,0.80,1.00,2014年07月10日,2014年07月14日,2015年07月13日,,,平泉县,2014年05月08日
黄石市本级,4202002014B05355,配电自动化设备,黄石大道北延段以西鄂东长江大桥以北,0.611957,0.000000,工业用地,挂牌出让,50,其它,三级,225.0000,湖北网安科技有限公司,0.70,0.00,2014年05月15日,2014年10月31日,2015年10月31日,,,黄石市,2014年05月08日
平泉县,1308232014B00855,工厂化杏鲍菇生产,平泉县七沟镇七沟村,1.644300,0.000000,工业用地,挂牌出让,50,农副食品加工业,三级,345.0000,平泉县亿园生物科技有限公司,0.80,1.00,2014年07月10日,2014年07月14日,2015年07月13日,,,平泉县,2014年05月08日
鄱阳县,3611282014B00340,石门街集镇住宅项目,鄱阳县石门街集镇、和平路北侧,0.113030,0.113030,其他普通商品住房用地,挂牌出让,其他商服用地40年; 其他普通商品住房用地70,房地产业,十四等级,45.0000,陈善文,1.00,2.88,2014年11月07日,2015年10月07日,2018年10月07日,,,鄱阳县,2014年05月08日
中江县,5106232014B01795,龙台镇正街114号附1号,龙台镇正街114号附1号,0.004092,0.004092,其他商服用地,协议出让,40,其他服务业,五级,0.8051,刘永富,1.00,,2014年05月08日,1900年01月01日,1900年01月01日,,,中江县,2014年05月08日
鄱阳县,3611282014B00358,石门街集镇幼教用地,鄱阳县石门街集镇,0.195060,0.000000,科教用地,挂牌出让,50,教育业,十四等级,34.0000,李小卫,0.60,0.00,2014年11月07日,2015年10月07日,2018年10月07日,,,鄱阳县,2014年05月08日
德惠市,2201832014B00310,长春金鸟生物医药发展有限公司,德惠市米沙子工业集中区,3.311600,3.311600,工业用地,挂牌出让,50,其它,一级,592.7943,长春金鸟生物医药发展有限公司,0.70,,2014年05月08日,2015年05月07日,2016年05月06日,,,德惠市,2014年05月08日
莱阳市,3706822014B00209,莱阳市团旺油源兴加油站,莱穴路西、团旺镇南团旺村,0.266700,0.000000,批发零售用地,拍卖出让,40,零售业,未评估地区,88.0110,莱阳市团旺油源兴加油站,,0.80,2015年04月16日,2015年04月20日,2018年04月19日,,,莱阳市,2014年05月08日
亳州市本级,3416002014B03435,安徽鑫大宅门业有限责任公司,东一路东侧、绕城快速北侧,6.717180,0.000000,工业用地,挂牌出让,50,金属制品业,二级,1138.0000,安徽鑫大宅门业有限责任公司,1.00,0.00,2014年07月14日,2014年11月08日,2015年11月08日,,,亳州市,2014年05月08日
赤水市,5203812014B00894,长期镇七里坝住宅项目,长期镇七里坝处,1.755490,0.000000,中低价位、中小套型普通商品住房用地,挂牌出让,70,房地产业,十三等级,330.0000,赤水清灵置业有限公司,1.00,1.20,2014年07月30日,2014年09月30日,2016年09月30日,,,赤水市,2014年05月08日
宜良县,5301252014B00591,云南龙栖谷投资发展有限公司商服用地,宜良县北古城镇贾王社区宜马公路与北羊街岔口西北侧,1.577630,0.000000,其他商服用地,拍卖出让,40,餐饮业,未评估地区,875.4200,云南龙栖谷投资发展有限公司,,0.50,2014年04月30日,2015年01月04日,2017年01月03日,,,昆明市,2014年05月08日
潜江市,4290052014B00409,湖北中科博策新材料科技有限公司,后湖管理区天新场办事处,1.272936,0.000000,工业用地,挂牌出让,50,通用设备制造业,五级,261.0000,湖北中科博策新材料科技有限公司,1.00,1.50,2014年10月08日,2015年01月08日,2017年01月07日,,,潜江市,2014年05月08日
东安县,4311222014B00057,贺玉豹,东安县白牙市镇前进街12号,0.027300,0.027300,其他商服用地,挂牌出让,40,房地产业,四级,59.0000,贺玉豹,1.05,2.10,2014年05月08日,2014年05月08日,2015年05月08日,,,东安县,2014年05月08日
临邑县,3714242014B00084,山东东林铝业有限公司,花园大街东段路北,2.266626,0.000000,工业用地,挂牌出让,50,金属制品业,四级,220.9961,山东东林铝业有限公司,0.00,1.50,2014年05月30日,2014年12月31日,2016年12月26日,,,临邑县,2014年05月08日
鄞州区,3302122014A07757,鄞州区云龙山庄二期新村建设地块（宁波市鄞州区云龙镇新村建设办公室）,宁波市鄞州区云龙镇云龙村、前后陈村、双桥村,0.109800,0.000000,街巷用地,划拨,,中国共产党机关,六级,48.3375,,,,2014年05月08日,2015年05月07日,2017年05月06日,,,宁波市人民政府,2014年05月08日
丹江口市,4203812014B00069,十堰太极湖国际广场开发有限公司,武当山特区十字岭居委会,1.464093,0.000000,其他普通商品住房用地,挂牌出让,其他商服用地40年; 其他普通商品住房用地70,房地产业,三级,752.0000,十堰太极湖国际广场开发有限公司,2.44,2.44,2014年06月15日,2014年07月01日,2015年06月30日,,,武当山旅游经济特区管委会,2014年05月08日
赤水市,5203812014B00887,长期镇七里坝住宅项目,长期镇七里坝处,1.406370,0.000000,中低价位、中小套型普通商品住房用地,挂牌出让,70,房地产业,十三等级,264.0000,赤水清灵置业有限公司,1.00,1.20,2014年07月30日,2014年09月30日,2016年09月30日,,,赤水市,2014年05月08日
阜阳市本级,3412002014B00473,工业用地,开发区纬五路南侧、经三路东侧,2.630100,0.000000,工业用地,挂牌出让,50,其它,一级,1008.0000,安徽中电晶超照明有限公司,1.20,0.00,2014年05月18日,2014年09月08日,2015年09月07日,,,阜阳市,2014年05月08日
赤水市,5203812014B00878,长期镇七里坝住宅项目,长期镇七里坝处,3.162554,0.000000,中低价位、中小套型普通商品住房用地,挂牌出让,70,房地产业,十三等级,593.0000,赤水清灵置业有限公司,1.00,1.20,2014年07月30日,2014年09月30日,2016年09月30日,,,赤水市,2014年05月08日
阜阳市本级,3412002014B00486,工业用地,开发区经四路南侧、纬十路东侧,5.745064,0.000000,工业用地,挂牌出让,50,金属制品业,二级,1799.0000,安徽新呼吸门窗有限公司,1.20,0.00,2014年05月18日,2014年09月08日,2015年09月07日,,,阜阳市,2014年05月08日
赤水市,5203812014B00865,长期镇七里坝住宅项目,长期镇七里坝处,3.732865,0.000000,中低价位、中小套型普通商品住房用地,挂牌出让,70,房地产业,十三等级,700.0000,赤水清灵置业有限公司,1.00,1.20,2014年07月30日,2014年09月30日,2016年12月31日,,,赤水市,2014年05月08日
武汉市本级,4201002014C15796,武汉长控电气有限公司硚口区荣华东村14栋住宿餐饮用地,硚口区荣华东村14栋,0.002807,0.002807,住宿餐饮用地,租赁,1,仪器仪表及文化、办公用机械制造业,二级,3.0900,,,,2014年06月12日,1900年01月01日,1900年01月01日,,,武汉市,2014年05月08日
德惠市,2201832014B00304,德惠市富达加油站,东风路东侧,0.172800,0.172800,其他商服用地,挂牌出让,40,其它,一级,170.1254,德惠市富达加油站,0.00,0.50,2014年05月08日,2015年05月07日,2016年05月06日,,,德惠市,2014年05月08日
潜江市,4290052014B00421,湖北华来生物科技有限公司,园林办事处光明村,4.958783,0.000000,工业用地,挂牌出让,50,化学原料及化学制品制造业,五级,1959.0000,湖北华来生物科技有限公司,1.00,1.30,2014年10月08日,2015年01月08日,2017年01月07日,,,潜江市,2014年05月08日
米易县,5104212014B01482,米易县酿造有限公司整体搬迁改造项目,米易县攀莲镇长坡2014-01号地块,1.644889,1.644889,工业用地,挂牌出让,50,农副食品加工业,十三等级,158.0000,米易县酿造有限公司,1.00,,2014年06月07日,2014年06月07日,2017年06月07日,,,米易县,2014年05月08日
潜江市,4290052014B00442,湖北琦明光电科技有限公司,杨市办事处刘岭村,3.228881,3.228881,工业用地,挂牌出让,50,通讯设备、计算机及其他电子设备制造业,五级,659.0000,湖北琦明光电科技有限公司,1.00,1.30,2014年10月08日,2015年01月08日,2017年01月07日,,,潜江市,2014年05月08日
平湖市,3304822014B08906-2,浙江冠豪新材料有限公司（厂房）,平湖市新仓镇杭浦连接线东侧、仓庆路北侧,1.442010,0.000000,工业用地,挂牌出让,50,造纸及纸质品业,十二级,530.0000,浙江冠豪新材料有限公司,1.20,3.00,2014年07月08日,2015年03月08日,2018年01月14日,,,平湖市,2014年05月08日
六安市本级,3415002014B00875,李秋浩住宅房,叶集试验区桃园小区西侧,0.014660,0.014660,经济适用住房用地,协议出让,70,住宿业,一级,6.1600,李秋浩,0.00,0.00,1900年01月01日,1900年01月01日,1900年01月01日,,,叶集试验区管理委员会,2014年05月08日
江永县,4311252014B01236,黄利祥,江永县麒麟路120号,0.008700,0.008700,其他普通商品住房用地,协议出让,70,居民服务业,一级,6.5770,黄利祥,1.00,1.00,2014年05月08日,1900年01月01日,1900年01月01日,,,江永县,2014年05月08日
昔阳县,1407242014A00040,昔阳县文体广电新闻出版局新建昔阳县宋金墓葬博物馆,县城新西街、原县中医院旧址,0.221960,0.221960,科教用地,划拨,,教育业,一级,,,,0.69,2014年05月09日,2014年06月20日,2016年06月20日,,,昔阳县人民政府,2014年05月08日
河口瑶族自治县,5325322014B00547,住宅用地,河口县坝洒农场场部邮政所旁,0.006392,0.006392,其他普通商品住房用地,协议出让,70,居民服务业,未评估地区,2.2372,张卫星,,,2014年05月08日,2014年05月08日,2014年05月08日,,,河口瑶族自治县人民政府,2014年05月08日
淳安县,3301272014B00364,临岐镇工业园区2014年1-1号地块,临岐镇工业园区2014年1-1号地块,1.568362,0.000000,工业用地,挂牌出让,50,其它,一级,210.3763,杭州久创纺织有限公司,1.00,,2014年08月07日,2015年08月07日,2018年08月07日,,,淳安县,2014年05月08日
津南区,1201122014A01079,津南区小站示范小城镇二期工程（福馨公寓31#、32#项目）,津南区小站镇,0.339800,0.339800,经济适用住房用地,划拨,,房地产业,六级,,,1.00,,2014年05月08日,2015年05月08日,2018年05月08日,,,津南区人民政府,2014年05月08日
