行政区,电子监管号,项目名称,项目位置,面积(公顷),土地来源,土地用途,供地方式,土地使用年限,行业分类,土地级别,成交价格(万元),土地使用权人,约定容积率下限,约定容积率上限,约定交地时间,约定开工时间,约定竣工时间,实际开工时间,实际竣工时间,批准单位,合同签订日期
布尔津县,6543212014A00355,布尔津县S232线岔口—阿克加尔村—也拉曼村村村通工程项目,窝依莫克乡行政区域内,0.353500,0.000000,公路用地,划拨,,道路运输业,十五等级,,,1.00,,2013年06月03日,2013年06月12日,2013年09月30日,,,布尔津县人民政府,2014年03月09日
布尔津县,6543212014A00340,杜来提乡职权肯齐村安居富民工程项目,杜来提乡阿肯齐村,1.512000,0.000000,经济适用住房用地,划拨,,社会保障业,十五等级,,,1.00,,2013年04月20日,2013年05月10日,2013年10月30日,,,布尔津县人民政府,2014年03月09日
高唐县,3715262014B00173,高唐县昌恒棉业有限公司棉花加工生产项目,尹集镇大社李以北、工业园区以东,0.326100,0.000000,工业用地,挂牌出让,50,棉、化纤纺织及印染精加工,三级,60.0000,高唐县昌恒棉业有限公司,1.00,,2014年04月01日,2014年08月15日,2016年08月14日,,,高唐县,2014年03月09日
三亚市本级,4602002014B00142,海坡控规HPC-04-02地块,海坡控规HPC-04-02地块,1.322104,1.322104,文体娱乐用地,协议出让,70,住宿业,三级,3781.0000,海南中港诚实业有限公司,1.00,1.50,2014年08月09日,2014年11月09日,2016年11月09日,,,三亚市,2014年03月09日
晋江市,3505822014A06952,晋江市第八实验小学项目建设用地,灵源街道林格社区,3.297100,0.000000,科教用地,划拨,,中国共产党机关,八级,309.6638,,0.00,0.82,2014年06月09日,2015年03月09日,2017年03月09日,,,晋江市人民政府,2014年03月09日
赤水市,5203812014B00747,赤水市工业大道杨梅山安置点东侧工业项目,赤水市工业大道杨梅山安置点东侧,4.583800,0.000000,工业用地,挂牌出让,50,木材加工及木、竹、藤、棕、草制品业,十三等级,450.0000,贵州德信和木塑科技有限公司,1.00,0.00,2014年06月30日,2014年07月31日,2016年07月31日,,,赤水市,2014年03月09日
孟津县,4103222014B00481,洛阳泽天房地产开发有限公司,朝阳镇徐沟村境内,2.428000,0.000000,其他普通商品住房用地,挂牌出让,70,房地产业,五级,941.0000,洛阳泽天房地产开发有限公司,1.60,2.00,2014年06月11日,2014年12月10日,2017年06月10日,,,孟津县,2014年03月09日
阳江市本级,4417002014B00127-3,住宅兼容商业,市区创业北路东边A01、A02号,0.443460,0.443460,其他普通商品住房用地,协议出让,70,房地产业,三级,141.7329,黄思泽,1.00,2.80,2014年03月11日,2017年10月31日,2020年10月31日,,,阳江市,2014年03月09日
孟津县,4103222014B00476,洛阳泽天房地产开发有限公司,朝阳镇徐沟村境内,2.445580,0.000000,其他普通商品住房用地,挂牌出让,70,房地产业,五级,1174.0000,洛阳泽天房地产开发有限公司,1.60,2.00,2014年06月11日,2014年12月10日,2017年06月10日,,,孟津县,2014年03月09日
临澧县,4307242014A00085,临澧县官亭乡卫生院,官亭乡马路村,0.483400,0.000000,医卫慈善用地,划拨,,卫生,四级,,,0.80,0.80,2014年03月20日,2014年03月25日,2015年03月25日,,,临澧县人民政府,2014年03月09日
孟津县,4103222014B00466,洛阳泽天房地产开发有限公司,朝阳镇徐沟村境内,3.138340,0.000000,其他普通商品住房用地,挂牌出让,70,房地产业,五级,1976.0000,洛阳泽天房地产开发有限公司,3.00,5.00,2014年06月11日,2014年12月10日,2017年06月10日,,,孟津县,2014年03月09日
高唐县,3715262014B00155,高唐县泉合工贸有限公司造纸添加剂项目,盛世路西侧、泉林路东延段北侧,0.592300,0.000000,工业用地,挂牌出让,50,造纸及纸质品业,三级,120.0000,高唐县泉合工贸有限公司,1.00,,2014年04月01日,2014年08月15日,2016年08月14日,,,高唐县,2014年03月09日
高唐县,3715262014B00148,高唐县国豪建筑材料有限公司年产20万立方米加气混凝土生产项目,尹集镇镇区以东、青银高速公路以南,2.433100,0.000000,工业用地,挂牌出让,50,砖瓦、石材及其他建筑材料制造,三级,380.0000,高唐县国豪建筑材料有限公司,1.00,,2014年04月01日,2014年08月15日,2016年08月14日,,,高唐县,2014年03月09日
高唐县,3715262014B00136,高唐县亮光食品销售有限公司仓储项目,盛世路东侧、高杨路北侧,0.570000,0.000000,工业用地,挂牌出让,50,仓储业,三级,115.0000,高唐县亮光食品销售有限公司,0.70,1.20,2014年04月01日,2014年08月15日,2016年08月14日,,,高唐县,2014年03月09日
农五师本级,6605002014B00089,天骏新材料加工厂,83团3连,2.217700,2.217700,工业用地,挂牌出让,30,塑料制品业,十四等级,175.0000,精河县沙山子天骏新材料加工厂,0.70,,2014年04月01日,2014年04月01日,2014年12月31日,,,第五师,2014年03月09日
孟津县,4103222014B00457,洛阳泽天房地产开发有限公司,朝阳镇徐沟村境内,2.106020,0.000000,其他普通商品住房用地,挂牌出让,70,房地产业,五级,1359.0000,洛阳泽天房地产开发有限公司,3.00,5.00,2014年06月11日,2014年12月10日,2017年06月10日,,,孟津县,2014年03月09日
大洼县,2111212014B00053,临港新城 梧桐苑,榆树镇郑家分场,1.330800,0.000000,中低价位、中小套型普通商品住房用地,挂牌出让,中低价位、中小套型普通商品住房用地70年; 其他商服用地40,房地产业,四级,297.5700,盘锦弘鼎房地产开发有限公司,1.20,2.50,2014年03月20日,2014年03月20日,2016年03月20日,,,大洼县,2014年03月09日
西安市本级,6101002014A13707,道路绿地,草滩九路西侧，尚苑路以南,0.075000,0.000000,街巷用地,划拨,,公共设施管理业,六级,,,,0.10,1900年01月01日,1900年01月01日,1900年01月01日,,,西安市人民政府,2014年03月09日
正阳县,4117242014B00081,正阳县新地房地产开发有限公司,正阳县城西区,4.964936,4.964936,其他普通商品住房用地,挂牌出让,70,房地产业,十四等级,5957.9200,正阳县新地房地产开发有限公司,1.80,3.00,2014年06月30日,2014年09月01日,2017年08月31日,,,正阳县,2014年03月09日
正阳县,4117242014B00071,正阳县新地房地产开发有限公司,正阳县城西区,4.964000,4.964000,其他普通商品住房用地,挂牌出让,70,房地产业,十四等级,5733.4200,正阳县新地房地产开发有限公司,1.80,3.00,2014年06月30日,2014年09月01日,2017年08月31日,,,正阳县,2014年03月09日
平舆县,4117232014B02968,京开阳光城（一）,平舆县解放街北侧,0.087442,0.087442,其他普通商品住房用地,挂牌出让,其他普通商品住房用地70年; 其他商服用地40,房地产业,一级,94.1380,河南省天罡置业有限公司,1.20,3.00,2014年04月10日,2014年08月31日,2016年02月29日,,,平舆县,2014年03月09日
集美区,3502112014A00082,正新二期西侧用地横二路,集美区后溪镇,1.577100,0.000000,街巷用地,划拨,,国家机构,四级,1300.0000,,0.00,0.00,2014年03月11日,2015年03月11日,2016年03月11日,,,厦门市人民政府,2014年03月09日
平舆县,4117232014B03004,秦心奎批发零售,郭楼镇健康路东侧,0.092451,0.092451,批发零售用地,挂牌出让,40,批发业,一级,40.2550,秦心奎,1.20,2.00,2014年04月17日,2014年08月31日,2016年02月29日,,,平舆县,2014年03月09日
广水市,4213812014B00278,湖北广仁药业有限公司,十里工业基地双岗村,5.470000,0.000000,工业用地,挂牌出让,50,医药制造业,一级,870.0000,湖北广仁药业有限公司,0.80,,2014年05月27日,2014年11月27日,2017年11月26日,,,广水市,2014年03月09日
光山县,4115222014B00086,14-001棉麻公司棚户区改造项目,弦山南路西侧阳光灯饰城北侧,0.335470,0.313240,其他普通商品住房用地,拍卖出让,其他普通商品住房用地70年; 批发零售用地40,房地产业,十四等级,915.0000,光山县筑成房地产开发有限公司,4.50,7.45,2014年04月19日,2014年10月19日,2016年10月19日,,,光山县,2014年03月09日
沙坡头区,6405022014A00018,中卫市第二中心敬老院,东靠耕地、南靠耕地、西距规划柔一路中心线20米、北靠耕地,1.333500,0.000000,机关团体用地,划拨,,社会福利业,未评估地区,,,4.00,4.45,2014年03月09日,2014年03月10日,2014年12月09日,,,中卫市人民政府,2014年03月09日
平舆县,4117232014B02974,京开阳光城（二）,平舆县解放街北侧,0.055237,0.055237,其他普通商品住房用地,挂牌出让,70,房地产业,一级,50.1140,河南省天罡置业有限公司,1.20,3.20,2014年04月10日,2014年08月31日,2016年02月29日,,,平舆县,2014年03月09日
平舆县,4117232014B02980,京开阳光城(三）,平舆县永乐大道南侧,0.170314,0.170314,其他普通商品住房用地,挂牌出让,其他普通商品住房用地70年; 其他商服用地40,房地产业,一级,222.7142,河南省天罡置业有限公司,1.60,4.50,2014年04月10日,2014年08月31日,2016年02月29日,,,平舆县,2014年03月09日
汝城县,4310262014B00228-1,住宅、商服,汝城县三江大道以北、2013D23以西,4.389400,0.000000,其他普通商品住房用地,挂牌出让,其他普通商品住房用地70年; 其他商服用地40年;,房地产业,四级,3210.6800,湖南力拓投资有限公司,1.01,3.00,2014年03月19日,2015年03月09日,2017年03月09日,,,汝城县,2014年03月09日
永兴县,4310232014B00131-1,商住用地,永兴县开发区水南村,3.486500,0.000000,其他普通商品住房用地,挂牌出让,其他普通商品住房用地70年; 其他商服用地40年;,房地产业,三级,3835.1500,永兴县鑫飞宇房地产开发有限公司,1.00,2.20,2014年03月10日,2014年05月01日,2016年05月01日,,,永兴县,2014年03月09日
