行政区,电子监管号,项目名称,项目位置,面积(公顷),土地来源,土地用途,供地方式,土地使用年限,行业分类,土地级别,成交价格(万元),土地使用权人,约定容积率下限,约定容积率上限,约定交地时间,约定开工时间,约定竣工时间,实际开工时间,实际竣工时间,批准单位,合同签订日期
曲阜市,3708812016B00145,天然气压缩母站,北临、西临、东临大雪村用地；南临政府储备用地,1.508100,0.000000,公共设施用地,挂牌出让,50,燃气生产和供应业,未评估地区,411.0000,曲阜中石油昆仑燃气有限公司,,0.80,2016年07月21日,2017年07月20日,2019年07月19日,,,曲阜市,2016年07月21日
安源区,3603022016A00115,新苑安置小区,安源镇跃进村,0.088500,0.000000,经济适用住房用地,划拨,,居民服务业,九级,,,1.00,1.60,2016年07月21日,2017年01月21日,2019年01月21日,,,萍乡市人民政府,2016年07月21日
东明县,3717282016B00148,住宅项目,东邻106国道、城关街道办事处黄军营行政村，西邻城关街道办事处黄军营行政村，南邻2015年第一批次建设用地，北邻城关街道办事处黄军营行政村。,2.458400,0.000000,中低价位、中小套型普通商品住房用地,挂牌出让,70,房地产业,四级,1800.0000,东明县恒昌房地产开发有限公司,1.30,1.60,2016年12月20日,2017年03月20日,2019年03月20日,,,东明县,2016年07月21日
固原市本级,6404002016B00181,西南新区物流仓储用地,西兰银物流园区I地块，四至：东至深沟街，南至兴流路，西至物流三街，北至物流横二路,13.821900,0.000000,工业用地,挂牌出让,40,仓储业,未评估地区,1243.9800,固原市九龙城市建设集团有限公司,1.00,0.00,2016年08月30日,2016年08月30日,2018年06月30日,,,固原市,2016年07月21日
松花江分局,2392022016B03256,亚布力小火车游客接待中心,黑龙江省亚布力林业局青云小镇,0.575600,0.575600,其他商服用地,挂牌出让,40,铁路运输业,四级,71.9500,尚志市亚布力森林小火车观光有限公司,0.37,0.37,2016年07月21日,2016年07月21日,2017年07月31日,,,黑龙江省森林工业总局,2016年07月21日
和布克赛尔蒙古自治县,6542262016B00114,和布克赛尔县实施城镇规划2015年第十一批建设用地,和布克赛尔县和什托洛盖镇,0.602500,0.000000,其他商服用地,挂牌出让,30,批发和零售业,三级,220.0000,中石油新疆销售有限公司塔城分公司,,1.80,2016年07月22日,2016年08月01日,2017年08月01日,,,和布克赛尔县,2016年07月21日
哈巴河县,6543242016B00155,哈巴河县皓月酒店建设项目,解放路以南，幸福路以西,0.399100,0.399100,住宿餐饮用地,挂牌出让,40,住宿和餐饮业,四级,205.7058,阿勒泰地区阳光房地产开发有限公司,,1.50,2016年07月21日,2016年07月22日,2018年10月31日,,,哈巴河县,2016年07月21日
阿拉善左旗,1529212016A02010,阿拉善职业技术学院巴彦浩特新校区改扩建项目,巴彦浩特镇西城区西花园小区西侧,1.148500,0.471500,科教用地,划拨,,教育业,十五等级,0.0000,,0.00,1.00,2016年07月25日,2016年08月01日,2018年08月01日,,,阿左旗人民政府,2016年07月21日
原阳县,4107252016B00416,年产26000套民用板式套房家具生产线建设项目,万象路北侧,3.343803,3.343803,工业用地,挂牌出让,50,家具制造业,三级,464.7903,河南省顶好家具有限公司,1.00,,2016年09月21日,2017年07月21日,2019年07月20日,,,原阳县,2016年07月21日
澧县,4307232016B00917,倪仲生,澧阳街道小西门居委会,0.058281,0.001660,其他普通商品住房用地,协议出让,40,居民服务业,二级,0.7650,倪仲生,2.00,5.43,2016年07月21日,,,,,澧县,2016年07月21日
徐水县,1306252016B00297,住宅楼,纬七路南、纬六路北、经十路东,4.264857,0.000000,其他普通商品住房用地,挂牌出让,70,房地产业,十二级,1992.0000,博创城市建设开发有限公司,1.00,2.50,2016年07月29日,2017年07月28日,2019年07月28日,,,保定市徐水区,2016年07月21日
融水苗族自治县,4502252016B00281,黄启文,融水镇香山路21号,0.001181,0.001181,其他普通商品住房用地,协议出让,61,住宿业,一级,0.3187,黄启文,1.00,1.00,2016年07月31日,2016年08月31日,2018年08月31日,,,融水苗族自治县,2016年07月21日
南宁市本级,4501002016B27747,经开区金阳路西侧123亩商住地块,经开区那洪大道北侧，金阳路西侧,8.223508,8.223508,其他普通商品住房用地,挂牌出让,70,房地产业,四级,156041.0643,南宁大商汇实业有限公司,4.00,4.50,2017年02月15日,2018年02月15日,2021年02月14日,,,南宁市,2016年07月21日
徐水县,1306252016B00317,住宅楼,纬二路南、纬七路北、经十路东,6.369933,0.000000,其他普通商品住房用地,挂牌出让,70,房地产业,十二级,2975.0000,博创城市建设开发有限公司,1.00,2.50,2016年07月29日,2017年07月28日,2019年07月28日,,,保定市徐水区,2016年07月21日
贵溪市,3606812016B00064,鹰潭恺坤实业有限公司,江西鹰潭节能照明基地B-02-01地块,6.014360,6.014360,工业用地,拍卖出让,50,其它,四级,1011.0000,鹰潭恺坤实业有限公司,1.00,1.00,2016年09月21日,2017年03月21日,2019年03月20日,,,贵溪市,2016年07月21日
环县,6210222016A00226,储备粮库工程项目建设,城北新区灵武北路东侧、毛井路北侧,2.774700,0.000000,仓储用地,划拨,,其他服务业,十八等级,,,1.00,1.80,2016年07月28日,2016年07月28日,2018年07月28日,,,环县人民政府,2016年07月21日
大庆市本级,2306002016A00605,职业学院十号学生公寓建设工程,职业学院技培校区,0.157800,0.157800,科教用地,划拨,,教育业,六级,,,3.20,3.20,2016年08月21日,2017年08月21日,2020年08月21日,,,大庆市人民政府,2016年07月21日
秦安县,6205222016B00033,房地产开发项目,解放路以东、四司巷以南区域。东邻东山跟，南邻天启花苑住宅小区、巷道、天水昌泰实业有限责任公司，西邻天水昌泰实业有限责任公司、规划建设用地，北邻四司巷。,1.041560,1.041560,其他普通商品住房用地,挂牌出让,70,房地产业,一级,4749.4899,甘肃成纪房地产开发有限公司,1.00,5.00,2017年08月20日,2018年08月20日,2021年08月20日,,,秦安县人民政府,2016年07月21日
公主岭市,2203812016B01129,吉林省轩泽房地产开发有限公司,公主岭市范家屯镇东河村,4.050700,0.000000,其他普通商品住房用地,挂牌出让,其他商服用地40年; 其他普通商品住房用地70年;,房地产业,未评估地区,2952.0000,吉林省轩泽房地产开发有限公司,1.00,2.40,2016年07月30日,2016年07月30日,2018年07月29日,,,公主岭市,2016年07月21日
奎文区,3707052016A02035,电力科技园运维检修中心,桐荫街以北、蓉花路以西,1.924600,1.924600,公共设施用地,划拨,,其它,未评估地区,,,0.61,0.61,2016年07月21日,,,,,潍坊市人民政府,2016年07月21日
哈密市,6522012016A10159,新建新疆红柳河至淖毛湖铁路工程建设项目,哈密市辖区内,688.384800,0.000000,铁路用地,划拨,,铁路运输业,未评估地区,,,,,2016年07月25日,2016年07月30日,2018年07月29日,,,哈密市人民政府,2016年07月21日
亳州市本级,3416002016B00907,亳州市谯郡堂中药饮片有限公司,槐花路以北、团结路以南、金定路以东,2.905330,0.000000,工业用地,挂牌出让,50,医药制造业,三级,489.0000,亳州市谯郡堂中药饮片有限公司,1.20,0.00,2016年09月26日,2016年12月20日,2017年10月20日,,,亳州市,2016年07月21日
塘沽区,1201072016B01227,津滨生（挂）2016-3-1号,中新天津生态城（原旅游区区域内）,2.044380,2.044380,其他普通商品住房用地,挂牌出让,70,房地产业,七级,4790.0000,北科泰达投资发展有限公司,1.00,1.01,2016年10月21日,2017年07月21日,2020年07月21日,,,,2016年07月21日
东陵区,2101122016B00095,恒大御峰,沈阳市浑南区,13.819674,0.000000,其他普通商品住房用地,拍卖出让,70,房地产业,五级,70535.6161,沈阳嘉景置业有限公司,1.00,2.20,2017年07月20日,2018年07月20日,2021年07月20日,,,沈阳市,2016年07月21日
遵义市本级,5203002016B00836,2016-XP-05,新蒲新区新舟镇308县道西侧,16.127100,0.138700,中低价位、中小套型普通商品住房用地,挂牌出让,70,房地产业,八级,14999.0000,遵义洛安生态开发投资有限责任公司,1.00,1.60,2016年10月21日,2017年07月21日,2018年07月21日,,,遵义市,2016年07月21日
樟树市,3609822016B00560,樟树市盐城大道以东共和东路以南,樟树市盐城大道以东共和东路以南,3.972000,0.000000,其他普通商品住房用地,拍卖出让,其他普通商品住房用地70年; 批发零售用地40年;,房地产业,二级,5084.0000,江西荣盛房地产置业有限公司,1.80,2.00,2016年10月21日,2017年01月21日,2019年01月21日,,,樟树市,2016年07月21日
扬中市,3211822016A00217,扬中市三茅街道办事处城北幼儿园,扬中市三茅街道友好村,1.007300,1.002658,科教用地,划拨,,教育业,未评估地区,0.0000,,0.70,0.00,2016年07月21日,2016年08月08日,2018年08月07日,,,扬中市人民政府,2016年07月21日
丹寨县,5226362016B00099,丹寨县东湖路延伸段,丹寨县东湖路延伸段,0.609594,0.000000,其他普通商品住房用地,挂牌出让,其他商服用地40年; 其他普通商品住房用地70年;,房地产业,二级,494.0000,丹寨县龙泉镇南街居民委员会,1.80,2.50,2016年07月21日,2016年12月31日,2018年12月31日,,,丹寨县,2016年07月21日
贾汪区,3203052016A00471,贾汪区城市污水处理厂二期厂区扩建工程项目,贾汪区206国道东侧、310国道南侧,1.074800,1.074800,公共设施用地,划拨,,水的生产和供应业,未评估地区,0.0000,,0.00,0.30,2016年10月01日,2017年03月01日,2019年02月28日,,,徐州市贾汪区人民政府,2016年07月21日
肥东县,3401222016A01896,合肥市长宁投资有限公司长临河镇人居环境建设项目,长临河镇长临社区、星光社区,5.348600,0.000000,公路用地,划拨,,道路运输业,十级,707.8219,,,,2016年08月21日,2016年10月21日,2019年10月21日,,,肥东县人民政府,2016年07月21日
和布克赛尔蒙古自治县,6542262016B00107,和布克赛尔县莫特格乡新建加油（气）站建设项目,和布克赛尔县莫特格乡,0.600000,0.000000,其他商服用地,挂牌出让,30,批发和零售业,三级,230.0000,中石油新疆销售有限公司塔城分公司,,0.25,2016年07月22日,2016年08月01日,2017年08月01日,,,和布克赛尔县,2016年07月21日
社旗县,4113272016B00049,房地产开发（拍2016-01号）,原陌陂粮油购销有限公司部分用地,0.113023,0.053008,其他普通商品住房用地,拍卖出让,其他普通商品住房用地70年; 其他商服用地40年;,房地产业,二级,47.0000,王彦峰,4.00,6.00,2016年10月15日,2016年10月18日,2018年10月18日,,,社旗县,2016年07月21日
梧州市本级,4504002016B00458,四坊后路51号前座划拨补办出让,四坊后路51号前座,0.002087,0.002087,其他普通商品住房用地,协议出让,70,居民服务业,三级,2.4440,李志雄,,,,,,,,梧州市,2016年07月21日
克拉玛依市本级,6502002016B00065,2016GK07,新兴路以西、纬四路以北,8.271229,7.622555,中低价位、中小套型普通商品住房用地,挂牌出让,70,房地产业,三级,5552.0000,新疆三联房地产开发有限责任公司,1.00,1.30,2016年07月22日,2017年07月13日,2020年07月13日,,,克拉玛依市,2016年07月21日
环县,6210222016A00226,储备粮库工程项目建设,城北新区灵武北路东侧、毛井路北侧,2.774700,0.000000,仓储用地,划拨,,其他服务业,十八等级,,,1.00,1.80,2016年07月28日,2016年07月28日,2018年07月28日,,,环县人民政府,2016年07月21日
大庆市本级,2306002016A00605,职业学院十号学生公寓建设工程,职业学院技培校区,0.157800,0.157800,科教用地,划拨,,教育业,六级,,,3.20,3.20,2016年08月21日,2017年08月21日,2020年08月21日,,,大庆市人民政府,2016年07月21日
黄岛区,3702112016A14191,美术学校北侧规划路（柳花泊五号线-珠宋路）道路管网工程,柳花泊五号线至珠宋路,0.629100,0.000000,街巷用地,划拨,,道路运输业,八级,0.0000,,,,2016年08月06日,2017年08月06日,2019年08月06日,,,青岛市黄岛区人民政府,2016年07月21日
兴仁县,5223222016A00225,国有建设用地划拔决定书,东湖街道办事处陆关安置地,4.424400,0.000000,公共设施用地,划拨,,其他服务业,十八等级,,,1.00,4.00,,,,,,兴仁县人民政府,2016年07月21日
塘沽区,1201072016B01227,津滨生（挂）2016-3-1号,中新天津生态城（原旅游区区域内）,2.044380,2.044380,其他普通商品住房用地,挂牌出让,70,房地产业,七级,4790.0000,北科泰达投资发展有限公司,1.00,1.01,2016年10月21日,2017年07月21日,2020年07月21日,,,,2016年07月21日
东陵区,2101122016B00095,恒大御峰,沈阳市浑南区,13.819674,0.000000,其他普通商品住房用地,拍卖出让,70,房地产业,五级,70535.6161,沈阳嘉景置业有限公司,1.00,2.20,2017年07月20日,2018年07月20日,2021年07月20日,,,沈阳市,2016年07月21日
山丹县,6207252016A00357,G227,山丹县东乐镇,54.285900,0.000000,公路用地,划拨,,道路运输业,未评估地区,,,1.00,,2016年07月20日,2016年07月20日,2017年10月31日,,,山丹县人民政府,2016年07月21日
泗洪县,3213242016B00511,双沟镇纬一路南侧,双沟镇纬一路南侧,0.818960,0.818960,其他普通商品住房用地,挂牌出让,40,房地产业,未评估地区,384.0000,泗洪华旭置业有限公司,1.00,3.00,2016年10月21日,2017年01月21日,2019年01月21日,,,泗洪县人民政府,2016年07月21日
泗洪县,3213242016B00549,界集镇界曹路东侧,界集镇界曹路东侧,0.643228,0.000000,其他普通商品住房用地,挂牌出让,70,房地产业,未评估地区,291.0000,泗洪县宏盛置业有限公司,1.00,1.70,2016年10月21日,2017年01月21日,2019年01月21日,,,泗洪县人民政府,2016年07月21日
江宁区,3201152016B00772,江苏中南建设集团股价有限公司城镇住宅用地（混合）,江宁区天靖路以南、上高路以西,6.904204,1.407681,其他普通商品住房用地,挂牌出让,70,房地产业,七级,351000.0000,江苏中南建设集团股份有限公司,1.00,2.70,2016年10月25日,2017年04月25日,2019年04月25日,,,南京市江宁区,2016年07月21日
泗洪县,3213242016B00529,界集镇西大街西侧,界集镇西大街西侧,1.379722,0.000000,其他普通商品住房用地,挂牌出让,40,房地产业,未评估地区,624.0000,泗洪润德房地产有限公司,1.00,1.70,2016年10月21日,2017年01月21日,2019年01月21日,,,泗洪县人民政府,2016年07月21日
泗洪县,3213242016B00535,界集镇嵩山路西侧,界集镇嵩山路西侧,0.343941,0.000000,其他普通商品住房用地,挂牌出让,70,房地产业,未评估地区,147.0000,泗洪金盾置业有限公司,1.00,1.70,2016年10月21日,2017年01月21日,2019年01月21日,,,泗洪县人民政府,2016年07月21日
浦口区,3201112016B01005,明发集团南京浦口房地产开发有限公司,浦口区南工大以北、沿山大道以南地块,3.284290,0.000000,其他商服用地,挂牌出让,40,房地产业,九级,33000.0000,明发集团南京浦口房地产开发有限公司,,1.80,2016年12月23日,2017年06月23日,2019年06月23日,,,南京市国土资源局浦口分局,2016年07月21日
祁阳县,4311212016B00512,私人住宅,祁阳县城县前街,0.003550,0.003550,其他普通商品住房用地,协议出让,70,住宿业,未评估地区,6.3700,陈安喜,0.00,0.00,,,,,,祁阳县,2016年07月21日
昆明市本级,5301002016B00958,昆明十一物流有限公司KCG2015-2P-1-A4号地块项目,昆明新城高新技术产业基地B1-02-01地块,1.546951,0.000000,仓储用地,挂牌出让,50,仓储业,未评估地区,1160.2150,昆明十一物流有限公司,1.00,2.50,2017年08月11日,2018年08月11日,2020年08月11日,,,昆明市,2016年07月21日
南宁市本级,4501002016B26291,划拨国有土地使用权补办出让,兴宁区人民路北一里2号,0.006377,0.006377,其他普通商品住房用地,协议出让,70,房地产业,一级,15.8176,滕积强,2.02,2.02,2016年07月21日,,,,,南宁市,2016年07月21日
津南区,1201122016B00598,津南（协）2016-02号,津南区咸水沽镇广建里4-10,0.000860,0.000860,其他商服用地,协议出让,40,房地产业,六级,4.2000,万树英,,,,,,,,津南区人民政府,2016年07月21日
清丰县,4109222016A00459,五眼井村棚户区改造项目安置房用地,县城区兴民路东侧、建设路西侧。,2.584366,0.000000,其他普通商品住房用地,划拨,,房地产业,三级,,,1.00,2.80,2016年07月31日,2017年07月31日,2020年07月31日,,,清丰县人民政府,2016年07月21日
梧州市本级,4504002016B00441,下三云路东街14-2号302房划拨补办出让,下三云路东街14-2号302房,0.021400,0.001664,其他普通商品住房用地,协议出让,60,居民服务业,三级,1.0710,林剑虹,0.00,0.00,,,,,,梧州市,2016年07月21日
安阳市本级,4105002016A00457,龙安区西南片区城中村改造安置房,文明大道与钢一路交叉口东南角,28.318100,21.358500,经济适用住房用地,划拨,,房地产业,三级,,,2.00,4.00,2016年07月22日,2017年07月21日,2020年07月20日,,,安阳市人民政府,2016年07月21日
渝北区,5001122016A01495,天堡寨7号地块配套道路二期工程等5个项目,重庆两江新区龙兴园区,14.513700,13.006100,街巷用地,划拨,,道路运输业,十一级,8272.8090,,,,2017年02月28日,2017年06月22日,2019年06月22日,,,重庆市人民政府,2016年07月21日
临沂市本级,3713002016B01568,兰山区义堂镇济铁物流,兰山区义堂镇,1.833200,0.000000,仓储用地,挂牌出让,50,仓储业,未评估地区,638.0000,临沂济铁物流园有限公司,,1.00,2016年07月21日,2017年07月21日,2019年07月20日,,,临沂市,2016年07月21日
昆明市本级,5301002016B00958,昆明十一物流有限公司KCG2015-2P-1-A4号地块项目,昆明新城高新技术产业基地B1-02-01地块,1.546951,0.000000,仓储用地,挂牌出让,50,仓储业,未评估地区,1160.2150,昆明十一物流有限公司,1.00,2.50,2017年08月11日,2018年08月11日,2020年08月11日,,,昆明市,2016年07月21日
哈密市,6522012016A10159,新建新疆红柳河至淖毛湖铁路工程建设项目,哈密市辖区内,688.384800,0.000000,铁路用地,划拨,,铁路运输业,未评估地区,,,,,2016年07月25日,2016年07月30日,2018年07月29日,,,哈密市人民政府,2016年07月21日
上海市本级,3101002016B15087,闵行区浦江镇工-233号,闵行区浦江镇539街坊P1宗地（浦江镇工-233地块）,0.994250,0.000000,工业用地,挂牌出让,20,通讯设备、计算机及其他电子设备制造业,六级,1127.0000,上海耀莱防伪科技有限公司,1.00,,2016年09月23日,2017年03月23日,2018年03月23日,,,闵行区,2016年07月21日
怀宁县,3408222016B00637,住宅用地,怀宁县公岭镇五岭村,0.065774,0.000000,中低价位、中小套型普通商品住房用地,挂牌出让,中低价位、中小套型普通商品住房用地70年; 其他商服用地40年;,房地产业,二级,25.0000,怀宁县房地产开发有限公司,1.00,1.80,2016年07月31日,2017年01月30日,2018年01月29日,,,怀宁县,2016年07月21日
合川区,5001172016A02518,高职教城连接道路、学府一路二路部分路段、四桥北引道路绿化景观工程,合阳城街道,13.753200,5.486300,公路用地,划拨,,城市公共交通业,十四等级,11965.2840,,,,2016年08月31日,2016年12月31日,2018年12月31日,,,合川区人民政府,2016年07月21日
哈巴河县,6543242016B00155,哈巴河县皓月酒店建设项目,解放路以南，幸福路以西,0.399100,0.399100,住宿餐饮用地,挂牌出让,40,住宿和餐饮业,四级,205.7058,阿勒泰地区阳光房地产开发有限公司,,1.50,2016年07月21日,2016年07月22日,2018年10月31日,,,哈巴河县,2016年07月21日
阿拉善左旗,1529212016A02010,阿拉善职业技术学院巴彦浩特新校区改扩建项目,巴彦浩特镇西城区西花园小区西侧,1.148500,0.471500,科教用地,划拨,,教育业,十五等级,0.0000,,0.00,1.00,2016年07月25日,2016年08月01日,2018年08月01日,,,阿左旗人民政府,2016年07月21日
德惠市,2201832016A00700,基层卫生院医疗用房,德惠市布海镇布海街道,0.029000,0.029000,医卫慈善用地,划拨,,卫生,一级,,,0.80,0.80,,,,,,德惠市人民政府,2016年07月21日
巴中市本级,5119002016B00047,屠宰场,四川巴中经济开发区兴文街道办事处新兴居委会、沙溪村、白鹤村K11-03宗地,0.273593,0.000000,工业用地,挂牌出让,50,农副食品加工业,三级,36.9400,巴中市鑫鑫食品有限公司,1.00,,2016年08月20日,2016年09月20日,2017年09月19日,,,四川巴中经济开发区管理委员会,2016年07月21日
隆安县,4501232016B00456,隆安县震东生态移民安置工程项目B-12（1）,隆安县城厢镇震东村,4.532886,0.000000,中低价位、中小套型普通商品住房用地,挂牌出让,中低价位、中小套型普通商品住房用地70年; 批发零售用地40年;,房地产业,四级,4079.5800,南宁昌泰置业投资有限公司,1.00,3.00,2016年10月18日,2017年07月03日,2020年07月03日,,,隆安县,2016年07月21日
中卫市本级,6405002016A00286,双桥村棚户区改造安置住房二期项目,文昌镇,3.923500,0.000000,经济适用住房用地,划拨,,房地产业,未评估地区,,,1.00,,2016年07月21日,2016年07月22日,2017年07月22日,,,中卫市人民政府,2016年07月21日
曲阜市,3708812016B00145,天然气压缩母站,北临、西临、东临大雪村用地；南临政府储备用地,1.508100,0.000000,公共设施用地,挂牌出让,50,燃气生产和供应业,未评估地区,411.0000,曲阜中石油昆仑燃气有限公司,,0.80,2016年07月21日,2017年07月20日,2019年07月19日,,,曲阜市,2016年07月21日
樟树市,3609822016B00599,樟树市葛玄路东侧地块二,樟树市葛玄路东侧地块二,1.350500,0.000000,住宿餐饮用地,拍卖出让,40,住宿业,四级,260.0000,江西丁仙湖福地旅游发展有限公司,1.00,1.35,2016年10月21日,2017年01月21日,2019年01月21日,,,樟树市,2016年07月21日
莱芜市本级,3712002016B00707,以立项为准,鲁中大街以南、联通公司以西,3.253200,3.253200,其他普通商品住房用地,挂牌出让,其他普通商品住房用地70年; 其他商服用地40年;,房地产业,二级,5050.0000,莱芜慧利置业有限公司,1.00,2.60,2016年07月21日,2017年07月21日,2019年07月21日,,,莱芜市,2016年07月21日
老边区,2108112016B00045,营口传化仓储配送中心,智泉街南侧、腾飞西路西侧（中小园E0）,3.932600,3.932600,仓储用地,挂牌出让,50,仓储业,三级,1132.5888,营口传化公路港物流有限公司,0.40,0.00,2016年08月13日,2017年05月05日,2019年05月04日,,,营口市,2016年07月21日
隆安县,4501232016B00448,隆安县震东生态移民安置工程项目B-12（2）,隆安县城厢镇震东村,4.583036,0.000000,中低价位、中小套型普通商品住房用地,挂牌出让,中低价位、中小套型普通商品住房用地70年; 批发零售用地40年;,房地产业,四级,4124.7600,南宁昌泰置业投资有限公司,1.00,3.00,2016年10月18日,2017年07月03日,2020年07月03日,,,隆安县,2016年07月21日
平坝县,5204212016B00089,G-16-08建设用地,安顺市平坝区安平街道办事处城南村观音路北侧,0.029160,0.000000,中低价位、中小套型普通商品住房用地,挂牌出让,40,房地产业,三级,86.0000,安顺市平坝区东风房地产开发有限公司,14.79,14.79,2016年08月03日,2016年08月03日,2017年08月03日,,,安顺市平坝区,2016年07月21日
凌源市,2113822016A00217,市直党政机关疏散基地,热水汤街道办事处,1.561400,1.262800,公共设施用地,划拨,,国家机构,十一级,0.0000,,0.46,0.00,2016年08月03日,2016年11月03日,2018年11月03日,,,凌源市人民政府,2016年07月21日
天长市,3411812016B04606,安徽泰达仪表有限公司,天长市冶山镇工业园区,0.272600,0.000000,工业用地,挂牌出让,50,仪器仪表及文化、办公用机械制造业,四级,28.0000,安徽泰达仪表有限公司,1.00,,2016年07月21日,2017年07月21日,2018年07月20日,,,天长市,2016年07月21日
抚远县,2308332016A00156,抚远市第二小学教学楼改扩建,抚远市第二小学教学楼西侧,0.022500,0.022500,科教用地,划拨,,教育业,一级,0.0000,,2.31,0.00,2016年10月21日,2017年10月21日,2019年10月20日,,,抚远市人民政府,2016年07月21日
固安县,1310222016B00651,固安县通宇房地产开发有限公司项目用地,新中西街南侧,0.409000,0.409000,中低价位、中小套型普通商品住房用地,挂牌出让,中低价位、中小套型普通商品住房用地70年; 其他商服用地40年;,房地产业,二级,837.0000,固安县通宇房地产开发有限公司,1.30,3.05,2016年08月20日,2017年08月20日,2020年08月19日,,,固安县,2016年07月21日
奎文区,3707052016A02035,电力科技园运维检修中心,桐荫街以北、蓉花路以西,1.924600,1.924600,公共设施用地,划拨,,其它,未评估地区,,,0.61,0.61,2016年07月21日,,,,,潍坊市人民政府,2016年07月21日
遵义市本级,5203002016B00836,2016-XP-05,新蒲新区新舟镇308县道西侧,16.127100,0.138700,中低价位、中小套型普通商品住房用地,挂牌出让,70,房地产业,八级,14999.0000,遵义洛安生态开发投资有限责任公司,1.00,1.60,2016年10月21日,2017年07月21日,2018年07月21日,,,遵义市,2016年07月21日
