行政区,电子监管号,项目名称,项目位置,面积(公顷),土地来源,土地用途,供地方式,土地使用年限,行业分类,土地级别,成交价格(万元),土地使用权人,约定容积率下限,约定容积率上限,约定交地时间,约定开工时间,约定竣工时间,实际开工时间,实际竣工时间,批准单位,合同签订日期
小店区,1401052012B00058,山西九州通现代医药仓储基地项目,太原经济区,4.722100,0.000000,仓储用地,挂牌出让,50,仓储业,七级,1725.2865,山西九州通医药有限公司,0.80,,2012年03月15日,2012年11月30日,2013年11月01日,,,太原市,2012年01月15日
依兰县,2301232012B00021,关于尚志市龙腾房地产开发有限公司用地,依兰镇中央大街东段北侧,1.574700,1.514700,其他普通商品住房用地,挂牌出让,70,房地产业,一级,280.2200,尚志市龙腾房地产开发有限公司,,,2012年01月15日,2012年01月15日,2013年01月14日,,,依兰县,2012年01月15日
小店区,1401052012B00021,环保、节能谐波治理成套电气设备研发生产基地,太原经济区,2.783700,0.000000,工业用地,挂牌出让,50,其它,七级,930.8835,山西德力西电器有限公司,0.80,,2012年03月15日,2012年11月30日,2013年11月01日,,,太原市,2012年01月15日
江山市,3308812012B00022,凤林镇2007005-1#区块国有建设用地使用权出让,凤林镇茅坂二村,0.629600,0.000000,工业用地,挂牌出让,50,其它,十三等级,124.0312,浙江鸿延矿业科技有限公司,1.00,,2012年04月15日,2012年10月15日,2014年10月15日,,,江山市,2012年01月15日
依兰县,2301232012B00010,关于黑龙江省依兰国有林场公司用地的批复,依兰镇中央大街东段北侧,0.793700,0.793700,机关团体用地,挂牌出让,70,林业,一级,139.6900,黑龙江省依兰国有林场公司,,,2012年01月15日,2012年01月15日,2013年01月14日,,,依兰县,2012年01月15日
中牟县,4101222012A00058,郑州至开封城市快速通道工程建设项目,西起郑东新区金水路与郑州市规划的东四环相交处、东至开封市大梁路西端,151.138800,0.000000,公路用地,划拨,,道路运输业,未评估地区,,,,,2012年02月15日,2012年03月15日,2012年09月13日,,,中牟县人民政府,2012年01月15日
通江县,5119212012B00836-1,住宅用地,通江县诺水河镇平溪街道,0.021800,0.021800,其他普通商品住房用地,协议出让,50,住宿业,三级,2.1000,张国奇、闫伟,1.00,3.99,2012年01月15日,2012年01月16日,2013年01月15日,,,通江县,2012年01月15日
上饶县,3611212012B00040,房地产开发,尊桥乡原食品添加剂厂,2.000000,2.000000,其他普通商品住房用地,拍卖出让,70,房地产业,一级,300.0000,胡剑、弋阳县瑞弘实业有限公司,1.00,1.40,2012年02月29日,2012年12月31日,2014年02月28日,,,上饶县,2012年01月15日
淮北市本级,3406002012B01273,淮北市开发区鸿福建设发展有限公司,虎山路西、石山路南,10.293513,0.000000,中低价位、中小套型普通商品住房用地,挂牌出让,70,房地产业,六级,4720.0000,淮北市开发区鸿福建设发展有限公司,1.00,1.50,2013年01月30日,2013年06月30日,2015年06月30日,,,淮北市,2012年01月15日
新和县,6529252012B00146,新疆宝鑫机械制造有限公司机械加工制造项目建设用地,新和县工业园区北区,3.726300,0.000000,工业用地,挂牌出让,50,通用设备制造业,未评估地区,33.5367,新疆宝鑫机械制造有限公司,,1.20,2011年11月15日,2011年11月15日,2012年12月31日,,,新和县人民政府,2012年01月15日
常熟市,3205812012B00070,江苏良基投资发展有限公司,梅李镇恒丰街北侧、寺泾路东侧,1.742200,1.742200,其他普通商品住房用地,挂牌出让,中低价位、中小套型普通商品住房用地70年，其他普通商品住房用地70年,房地产业,未评估地区,5749.2600,江苏良基投资发展有限公司,1.40,1.60,2012年02月04日,2013年02月04日,2016年02月04日,,,常熟市人民政府,2012年01月15日
张家港市,3205822012A00140,1009人防工程项目,杨舍镇长安路东侧、暨阳路南侧,0.528700,0.528700,公共设施用地,划拨,,中国共产党机关,未评估地区,0.0000,,,1.00,2012年01月15日,2012年01月15日,2012年05月30日,,,张家港市人民政府,2012年01月15日
