行政区,电子监管号,项目名称,项目位置,面积(公顷),土地来源,土地用途,供地方式,土地使用年限,行业分类,土地级别,成交价格(万元),土地使用权人,约定容积率下限,约定容积率上限,约定交地时间,约定开工时间,约定竣工时间,实际开工时间,实际竣工时间,批准单位,合同签订日期平果县,4510232013B01645,城镇住宅,平果县马头镇教育路炼沙三角安置地,0.008140,0.008140,其他普通商品住房用地,协议出让,70,房地产业,二级,3.9072,叶银梅,,,2013年07月18日,1900年01月01日,1900年01月01日,,,平果县,2013年07月11日
富民县,5301242013B00155,富民县工业园区公共租赁住房建设项目,富民县永定街道办事处大营村民委员会,2.300280,0.000000,公共租赁住房用地,协议出让,70,其他金融服务,二级,621.0000,富民工业园区国有资产管理有限公司,2.00,2.50,2013年09月23日,2014年09月22日,2017年09月21日,,,昆明市,2013年07月11日
合浦县,4505212013B03396,个人住宅,廉州镇城东新区A-IV-10号地块6号,0.008190,0.008190,其他普通商品住房用地,协议出让,70,住宿业,二级,0.9844,利广德,,,1900年01月01日,1900年01月01日,1900年01月01日,,,合浦县,2013年07月11日
泰和县,3608262013B00667,商住楼,苏溪圩镇,1.653500,0.000000,其他普通商品住房用地,拍卖出让,70,房地产业,未评估地区,1681.0000,刘武斌,1.49,1.49,2013年07月17日,2014年07月11日,2016年07月10日,,,泰和县人民政府,2013年07月11日
平果县,4510232013B01637,城镇住宅,平果县马头镇城北开发区,0.008080,0.008080,其他普通商品住房用地,协议出让,70,房地产业,二级,3.4906,方德福,,,2013年07月18日,1900年01月01日,1900年01月01日,,,平果县,2013年07月11日
万州区,5001012013B00380,天仙湖核心区4号地块未出让的零星存量土地整合使用（重庆冠荣房地产开发有限公司）,万州区天仙湖核心区4号地块,0.026400,0.026400,其他商服用地,协议出让,40,房地产业,四级,79.2000,重庆冠荣房地产开发有限公司,1.00,,2013年07月31日,2014年01月31日,2016年01月31日,,,万州区,2013年07月11日
三元区,3504032013B00199,三明市丰润化工有限公司化学原料与化学制品制造业项目,三元区莘口镇汇华工业园,3.043900,0.000000,工业用地,挂牌出让,50,化学原料及化学制品制造业,九级,634.0000,三明市丰润化工有限公司,0.70,0.00,2013年08月04日,2014年01月04日,2015年07月04日,,,三明市,2013年07月11日
湛江市本级,4408002013B00819,住宅用地（湛江市中农生产资料有限公司）,湛江市霞山区工农路21号,0.009856,0.009856,其他普通商品住房用地,协议出让,70,房地产业,三级,11.4581,湛江市中农生产资料有限公司,,,1900年01月01日,1900年01月01日,1900年01月01日,,,湛江市,2013年07月11日
高台县,6207242013B01150,地下商场,高台县北环路北侧,0.442700,0.442700,其他商服用地,挂牌出让,40,商务服务业,一级,132.8184,高台县恒瑞房地产开发有限责任公司,,1.60,2013年07月11日,2013年08月31日,2015年08月30日,,,高台县,2013年07月11日
高州市,4409812013B01193,高州市碧桂园房地产开发有限公司,高州市宝光街道西岸、红花、北江、新塘村委会207国道西北向,6.944280,0.000000,其他普通商品住房用地,挂牌出让,其他普通商品住房用地70年; 其他商服用地40,房地产业,五级,8340.0900,高州市碧桂园房地产开发有限公司,1.00,2.00,2014年07月11日,2015年07月11日,2018年07月11日,,,高州市,2013年07月11日
惠州市本级,4413002013B02160,关于惠州市惠晟实业有限公司企业改制土地使用权处置,惠州市惠城区马安新群二圣宫,6.860000,6.860000,工业用地,协议出让,50,批发业,三级,936.3935,惠州市惠晟实业有限公司,2.00,,2013年07月11日,1900年01月01日,1900年01月01日,,,惠州市,2013年07月11日
贵溪市,3606812013A00284,耳口（冷水）110千伏变电站,冷水镇冷水村碧溪村小组,0.720800,0.000000,公共设施用地,划拨,,公共设施管理业,四级,,,,,2013年07月21日,2013年08月21日,2015年08月21日,,,贵溪市人民政府,2013年07月11日
岑溪市,4504812013B00916,岑溪市至祥房地产开发有限公司房地产项目,岑城镇甘冲社区“百花洲”处,0.666960,0.000000,其他普通商品住房用地,挂牌出让,批发零售用地40年; 其他普通商品住房用地70,房地产业,十三等级,1450.0000,岑溪市至祥房地产开发有限公司,5.00,6.00,2013年08月27日,2014年08月26日,2017年08月25日,,,岑溪市,2013年07月11日
三元区,3504032013B00155,福建天翼食品有限公司食品制造业项目,三元区富兴堡白蒙畲,1.224500,0.000000,工业用地,挂牌出让,50,食品制造业,九级,264.0000,福建天翼食品有限公司,1.00,0.00,2013年08月04日,2014年01月04日,2015年07月04日,,,三明市,2013年07月11日
牡丹江市本级,2310002013B00506,东居华庭安置小区三期,江南新区海浪河路（兴凯湖路）东、卧龙街（渤州街）南,3.380600,0.000000,其他普通商品住房用地,挂牌出让,70,房地产业,一级,1889.0000,牡丹江龙盛投资有限公司,1.00,1.50,2013年08月30日,2013年10月16日,2016年10月16日,,,牡丹江市,2013年07月11日
高州市,4409812013B01185,高州市碧桂园房地产开发有限公司,高州市宝光街道西岸、红花、北江、新塘村委会207国道西北向,5.027250,0.000000,其他普通商品住房用地,挂牌出让,70,房地产业,五级,6037.7300,高州市碧桂园房地产开发有限公司,1.00,2.00,2014年07月11日,2015年07月11日,2018年07月11日,,,高州市,2013年07月11日
丰顺县,4414232013B01384,住宅楼（曾碧容）,丰顺县汤坑镇大山背,0.007688,0.007688,其他普通商品住房用地,协议出让,70,房地产业,十二级,1.1762,曾碧容,1.00,2.00,2013年07月18日,1900年01月01日,1900年01月01日,,,丰顺县,2013年07月11日
济南市本级,3701002013A03025,山东海天软件工程专修学院新校区建设项目代征道路用地,高新区经十东路南侧,0.067900,0.000000,街巷用地,划拨,,国家机构,未评估地区,,,,,2013年07月11日,2013年12月11日,2015年12月11日,,,济南市人民政府,2013年07月11日
合浦县,4505212013B03386,个人住宅,廉州镇东门口15号,0.014331,0.014331,其他普通商品住房用地,协议出让,70,住宿业,二级,1.5764,蒲镇文、蒲镇萍、刘志芳,,,1900年01月01日,1900年01月01日,1900年01月01日,,,合浦县,2013年07月11日
龙陵县,5305232013B00757,关于挂牌出让龙陵县木城乡1.7141公顷国有建设用地使用权给龙陵县绿根河水电开发有限公司的批复,龙陵县木城乡乌木寨,0.995300,0.000000,水工建筑用地,挂牌出让,50,水的生产和供应业,未评估地区,66.9760,龙陵县绿根河水电开发有限公司,1.00,,2013年08月01日,2013年08月01日,2015年08月01日,,,龙陵县,2013年07月11日
盘龙区,5301032013B06807,个人已购住房划拨补办出让手续,颐园里小区颐园里15幢3单元2层202号,0.000774,0.000774,其他普通商品住房用地,协议出让,70,房地产业,一级,0.3542,刘亭丽,,,2013年07月12日,1900年01月01日,1900年01月01日,,,昆明市,2013年07月11日
小河区,5201142013B00196,2013-挂-028,贵阳市花溪区孟关乡沙坡村,4.966032,0.000000,科教用地,挂牌出让,50,教育业,三级,1700.0000,贵阳花溪碧桂园物业发展有限公司,1.10,1.10,2013年12月11日,2014年05月11日,2017年05月11日,,,贵阳市,2013年07月11日
东西湖区,4201122013A00547,慈天公路（柏泉互通口至柏银公路段）,慈天公路柏泉互通口至柏银公路段改扩建工程,6.733900,0.000000,公路用地,划拨,,道路运输业,六级,451.8187,,,,2013年10月08日,2014年04月09日,2016年04月09日,,,武汉市东西湖区人民政府,2013年07月11日
高台县,6207242013B01147,商住楼,高台县黑泉乡黑泉村,1.185500,1.185500,其他普通商品住房用地,挂牌出让,70,房地产业,一级,73.4991,李红星,1.70,,2013年07月11日,2013年08月31日,2015年08月30日,,,高台县,2013年07月11日
富蕴县,6543222013B00346,金恩斯﹒木开来,富蕴县吐尔洪乡加油站东侧,0.011000,0.011000,批发零售用地,挂牌出让,40,零售业,三级,2.5080,金恩斯﹒木开来,,1.50,2013年07月11日,2013年07月11日,2014年07月11日,,,富蕴县,2013年07月11日
府谷县,6108222013B00018,府谷县启源加油站,老高川镇丁家伙盘村,0.355400,0.000000,其他商服用地,挂牌出让,40,其他服务业,三级,85.0000,府谷县启源加油站,,0.80,2013年07月03日,2014年07月03日,2016年07月03日,,,府谷县,2013年07月11日
大庆市本级,2306002013B01000,开发区新风路5号1-15-3-602个人住宅,开发区新风路5号1-15-3-602,0.002324,0.002324,其他普通商品住房用地,协议出让,70,房地产业,一级,0.3380,王喆,,,1900年01月01日,1900年01月01日,1900年01月01日,,,大庆市,2013年07月11日
宁洱哈尼族彝族自治县,5308212013B00131,林缘林产化工有限公司公共租赁住房建设项目,宁洱镇细石头村,0.039848,0.039848,公共租赁住房用地,协议出让,70,化学原料及化学制品制造业,未评估地区,0.0000,云南林缘林产化工有限公司,1.00,1.80,2013年07月11日,2013年07月11日,2015年07月11日,,,宁洱县,2013年07月11日
高州市,4409812013B01166,高州市碧桂园房地产开发有限公司,高州市宝光街道西岸、红花、北江、新塘村委会207国道西北向,6.937140,0.000000,其他普通商品住房用地,挂牌出让,70,房地产业,五级,8331.5100,高州市碧桂园房地产开发有限公司,1.00,2.00,2014年07月11日,2015年07月11日,2018年07月11日,,,高州市,2013年07月11日
广州市本级,4401002013A02892,华邦物流园商务中心,白云区沙太北路太和镇米龙村,0.594000,0.000000,仓储用地,划拨,,群众团体、社会团体和宗教组织,五级,,,,2.00,2013年07月11日,2014年07月11日,2016年07月11日,,,广东省人民政府,2013年07月11日
济南市本级,3701002013A03520,武警山东省总队后勤基地工程项目代征市政用地,历城区彩龙路东侧、新旅游路两侧,8.041000,0.000000,街巷用地,划拨,,国家机构,未评估地区,,,,,1900年01月01日,1900年01月01日,1900年01月01日,,,济南市人民政府,2013年07月11日
三台县,5107222013B05411,划拨转出让,潼川镇解放下街,0.000901,0.000901,其他普通商品住房用地,协议出让,70,住宿业,一级,0.1452,黄建,,,1900年01月01日,1900年01月01日,1900年01月01日,,,三台县,2013年07月11日
即墨市,3702822013B01009,四方机车建设厂房及配套设施,普东中心社区福海路以南B地块,2.137700,0.000000,工业用地,挂牌出让,50,金属制品业,七级,389.0000,青岛四方机车车辆铸钢有限公司,0.70,,2013年07月19日,2014年05月31日,2015年05月31日,,,即墨市,2013年07月11日
船山区,5109032013B01332,四川苏哈瑞涛电子科技有限公司,玫瑰大道东侧，主干道A,3.437871,0.642771,工业用地,挂牌出让,50,通讯设备、计算机及其他电子设备制造业,未评估地区,495.0720,四川苏哈瑞涛电子科技有限公司,0.00,1.50,2013年08月09日,2013年08月10日,2014年06月30日,,,遂宁市船山区,2013年07月11日
吴忠市本级,6403002013B00733,滨河新区北片区10#-A,纬四路南侧、文化街西侧、黄河路北侧,1.913370,0.000000,其他普通商品住房用地,挂牌出让,其他普通商品住房用地70年; 其他商服用地40,房地产业,四级,2296.0500,吴忠市民族房地产开发有限公司,1.00,2.60,2013年08月11日,2013年10月06日,2015年10月05日,,,吴忠市,2013年07月11日
即墨市,3702822013B01020,顺联集装箱建设厂房及配套设施,普东中心社区福海路以南、福顺路以西D地块,0.661300,0.000000,工业用地,挂牌出让,50,塑料制品业,六级,128.0000,青岛顺联集装箱部件制造有限公司,0.70,,2013年07月19日,2014年05月31日,2015年05月31日,,,即墨市,2013年07月11日
即墨市,3702822013B01013,联合物产建设厂房及配套设施,即墨市普东中心社区园区三路以西,1.333300,0.000000,工业用地,挂牌出让,50,金属制品业,六级,258.0000,青岛联合物产金属制品有限公司,0.70,1.00,2013年07月19日,2014年06月01日,2015年06月01日,,,即墨市,2013年07月11日
济南市本级,3701002013A03515,济南市动物疫病预防与控制中心代征市政用地,历城区唐冶新区横六路以南、港西路东侧,0.288700,0.000000,街巷用地,划拨,,国家机构,未评估地区,,,,,1900年01月01日,1900年01月01日,1900年01月01日,,,济南市人民政府,2013年07月11日
富蕴县,6543222013B00330,努尔兰﹒卡曼商业用房,富蕴县吐尔洪乡加油站东侧,0.005000,0.005000,批发零售用地,挂牌出让,40,零售业,三级,1.1400,努尔兰﹒卡曼,,1.50,2013年07月11日,2013年07月11日,2014年07月11日,,,富蕴县,2013年07月11日
济南市本级,3701002013A03503,山东（暖温带）珍稀濒危树种种质资源保护与利用建设项目代征市政用地,旅游路以南、民兵训练中心南侧、港九路西侧,2.101300,0.000000,街巷用地,划拨,,国家机构,未评估地区,,,,,1900年01月01日,1900年01月01日,1900年01月01日,,,济南市人民政府,2013年07月11日
吴兴区,3305022013B00427-1,浙江创赢新材料有限公司,埭溪镇工业功能区创业大道南侧、官泽路东侧（埭溪镇99号地块）,3.066000,3.066000,工业用地,拍卖出让,50,化学原料及化学制品制造业,七级,1079.0000,浙江创赢新材料有限公司,0.70,1.50,2013年09月07日,2014年03月07日,2016年09月07日,,,浙江省湖州市,2013年07月11日
万年县,3611292013A00275,万年县石镇卫生院,万年县石镇镇石镇村,2.666000,0.000000,医卫慈善用地,划拨,,卫生,一级,0.0000,,0.00,1.50,2013年10月11日,2014年03月28日,2016年03月27日,,,万年县人民政府,2013年07月11日
宁海县,3302262013B03267,宁波海斯曼科技发展有限公司新建厂房,西店镇集义村,0.665600,0.665600,工业用地,挂牌出让,50,塑料制品业,十三等级,197.6614,宁波海斯曼科技发展有限公司,0.80,2.00,2013年10月11日,2014年07月11日,2015年07月11日,,,宁海县,2013年07月11日
上饶市本级,3611002013A00458,滨江支路项目,信州区沙溪镇,0.266600,0.000000,公路用地,划拨,,道路运输业,未评估地区,0.0000,,0.00,0.00,2013年11月28日,2014年05月28日,2016年05月27日,,,上饶市人民政府,2013年07月11日
新泰市,3709822013B01468,中国石化山东泰山石油股份有限公司加油站项目,青云街道北师店村,0.273300,0.000000,其他商服用地,挂牌出让,40,石油加工、炼焦及核燃料加工业,一级,752.0000,中国石化山东泰山石油股份有限公司,,1.50,2013年10月02日,2014年01月02日,2016年01月02日,,,新泰市,2013年07月11日
济南市本级,3701002013A03495,市公安局交警支队历城大队济钢交警中队营房建设项目代征市政用地,临港开发区B区、机场路东侧、荷花路北侧,1.037200,0.000000,街巷用地,划拨,,国家机构,未评估地区,,,,,1900年01月01日,1900年01月01日,1900年01月01日,,,济南市人民政府,2013年07月11日
上饶市本级,3611002013A00445,龙门路延伸段,信州区沙溪镇,0.671200,0.000000,公路用地,划拨,,道路运输业,未评估地区,0.0000,,0.00,0.00,2013年11月28日,2014年05月28日,2016年05月27日,,,上饶市人民政府,2013年07月11日
济南市本级,3701002013A03485,市公安局警卫部队公寓营房建设项目代征市政用地,历城区港沟办事处田庄村,0.035100,0.000000,街巷用地,划拨,,国家机构,未评估地区,,,,,1900年01月01日,1900年01月01日,1900年01月01日,,,济南市人民政府,2013年07月11日
济南市本级,3701002013A03476,山东省残疾人康复中心代征市政用地,历城区唐冶南村,2.788300,0.000000,街巷用地,划拨,,国家机构,未评估地区,,,,,1900年01月01日,1900年01月01日,1900年01月01日,,,济南市人民政府,2013年07月11日
日照市本级,3711002013A00636,公共绿地,温州路南、银川路西,2.851100,0.000000,公园与绿地,划拨,,公共设施管理业,三级,,,,,2013年07月14日,2013年07月16日,2014年07月15日,,,山东省人民政府,2013年07月11日
龙陵县,5305232013B00745,关于挂牌出让龙陵县木城乡1.7141公顷国有建设用地使用权给龙陵县绿根河水电开发有限公司的批复,龙陵县木城乡乌木寨,0.718800,0.000000,水工建筑用地,挂牌出让,50,水的生产和供应业,未评估地区,48.5087,龙陵县绿根河水电开发有限公司,1.00,,2013年08月01日,2013年08月01日,2015年08月01日,,,龙陵县,2013年07月11日
上饶市本级,3611002013A00434,信州区烟花爆竹仓库,信州区朝阳镇,0.653000,0.000000,仓储用地,划拨,,仓储业,未评估地区,0.0000,,0.00,0.80,2013年11月28日,2014年05月28日,2016年05月27日,,,上饶市人民政府,2013年07月11日
会理县,5134252013B00208,四川省景苑房地产开发有限公司,会理县果元乡果元村三组,2.159105,0.000000,住宿餐饮用地,挂牌出让,40,房地产业,十四等级,7000.0000,四川省景苑房地产开发有限公司,3.50,4.00,2013年07月27日,2014年01月27日,2017年01月27日,,,会理县,2013年07月11日
济南市本级,3701002013A03467,山东省地震监测中心台二期代征市政用地,历城区旅游路以北、港西路以东,0.932000,0.000000,街巷用地,划拨,,国家机构,未评估地区,,,,,1900年01月01日,1900年01月01日,1900年01月01日,,,济南市人民政府,2013年07月11日
泸水县,5333212013B01410,赵萍丽个人土地使用权房改房登记出让手续,六库镇穿城路120号,0.001278,0.001278,其他普通商品住房用地,协议出让,70,居民服务业,二级,0.2165,赵萍丽,1.00,,2013年07月11日,2013年07月11日,2013年07月11日,,,泸水县,2013年07月11日
平远县,4414262013B01492,林丽英,大柘镇新建路,0.003552,0.003552,其他普通商品住房用地,协议出让,70,房地产业,十二级,0.3978,林丽英,,,1900年01月01日,1900年01月01日,1900年01月01日,,,平远县,2013年07月11日
恩施市,4228012013B24714,田聪,恩施市小渡船街道办事处民族路四巷,0.001321,0.001321,其他普通商品住房用地,协议出让,70,房地产业,十二级,0.8402,田聪,,,1900年01月01日,1900年01月01日,1900年01月01日,,,恩施市,2013年07月11日
济南市本级,3701002013A03453,济南国际机场航站区扩建工程代征市政用地,历城区遥墙国际机场内,0.996000,0.000000,街巷用地,划拨,,国家机构,未评估地区,,,,,1900年01月01日,1900年01月01日,1900年01月01日,,,山东省人民政府,2013年07月11日
济南市本级,3701002013A03441,山东省济南卫生学校新校区代征市政用地,历城区港沟镇旅游路以南、港西路东侧,1.012900,0.000000,街巷用地,划拨,,国家机构,未评估地区,,,,,1900年01月01日,1900年01月01日,1900年01月01日,,,济南市人民政府,2013年07月11日
济南市本级,3701002013A03435,山东协和职业技术学院新校区建设项目三期工程代征市政用地,历城区郭店镇杨家河以东、102省道北侧,4.786600,0.000000,街巷用地,划拨,,国家机构,未评估地区,,,,,1900年01月01日,1900年01月01日,1900年01月01日,,,济南市人民政府,2013年07月11日
绥化分局,2391092013A00047,绥棱农场自来水厂扩建,黑龙江省绥棱农场场部,0.104300,0.104300,公共设施用地,划拨,,农业,二级,,,0.30,0.30,2013年07月10日,2013年07月10日,2013年11月30日,,,驻农垦总局国土资源局绥化分局,2013年07月11日
石门县,4307262013B00848,个人住宅,石门县楚江镇观山社区曹家垱,0.009600,0.009600,其他普通商品住房用地,协议出让,70,房屋和土木工程业,五级,1.3248,杨生明,,,1900年01月01日,1900年01月01日,1900年01月01日,,,石门县,2013年07月11日
端州区,4412022013B01280,梁肇俊,端州区翠岗新村一区18号,0.012700,0.012700,其他普通商品住房用地,协议出让,49,房地产业,三级,2.0574,梁肇俊,,,1900年01月01日,1900年01月01日,1900年01月01日,,,肇庆市,2013年07月11日
且末县,6528252012A00384,中石油塔里木油田分公司2009-2010年滚动开发建设项目,且末县境内,27.547500,0.000000,工业用地,划拨,,石油和天然气开采业,未评估地区,,,1.00,,1900年01月01日,1900年01月01日,1900年01月01日,,,中华人民共和国国土资源部,2013年07月11日
丰都县,5002302013A00335,水天坪小学建设项目,丰都县水天坪组团A12-1/1、A12-1/2地块,2.749000,0.000000,科教用地,划拨,,教育业,十六等级,0.0000,,,0.60,2013年07月31日,2014年05月12日,2017年05月12日,,,丰都县人民政府,2013年07月11日
歙县,3410212013B01219,吴明祥、汪湘,徽城镇旸村,0.104700,0.000000,其他商服用地,挂牌出让,40,文化艺术业,四级,106.7940,吴明祥、汪湘,,1.40,2013年07月31日,2013年08月31日,2014年08月31日,,,歙县,2013年07月11日
合浦县,4505212013B03376,个人住宅,廉州镇三街阜民北87号,0.004114,0.004114,其他普通商品住房用地,协议出让,70,住宿业,一级,0.6171,金承绢、金承缙、金承绮、金承绰,,,1900年01月01日,1900年01月01日,1900年01月01日,,,合浦县,2013年07月11日
三台县,5107222013B05409,划拨转出让,北坝镇北坝小区,0.000633,0.000633,其他普通商品住房用地,协议出让,70,住宿业,二级,0.3671,张永红,,,1900年01月01日,1900年01月01日,1900年01月01日,,,三台县,2013年07月11日
福贡县,5333232013B00286,住宅用地,福贡县上帕镇娃底街45号,0.002001,0.002001,中低价位、中小套型普通商品住房用地,协议出让,70,居民服务业,二级,0.6363,开友加,,,1900年01月01日,1900年01月01日,1900年01月01日,,,,2013年07月11日
围场满族蒙古族自治县,1308282013B00370,围场满族蒙古族自治县中奥燃气输配有限公司,御道口牧场,0.777340,0.777340,批发零售用地,挂牌出让,40,燃气生产和供应业,二级,117.0000,围场满族蒙古族自治县中奥燃气输配有限公司,,0.50,2013年07月13日,2013年07月20日,2013年10月30日,,,围场满族蒙古族自治县,2013年07月11日
嫩江县,2311212013B00382,福龙家园一期,三阳胡同南、庆丰大街西,0.833167,0.833167,中低价位、中小套型普通商品住房用地,挂牌出让,中低价位、中小套型普通商品住房用地70年; 其他商服用地40,房地产业,二级,264.5000,嫩江北药房地产开发有限公司,1.00,1.39,2013年07月31日,2013年08月10日,2015年08月10日,,,嫩江县,2013年07月11日
桦甸市,2202822013A00137,桦甸市公安局业务技术用房及附属设施用房,桦甸市桦甸大街北、金水路西侧,1.755200,0.000000,机关团体用地,划拨,,国家机构,二级,0.0000,,1.00,3.59,2013年07月11日,2013年12月11日,2015年12月11日,,,桦甸市人民政府,2013年07月11日
万年县,3611292013A00267,万年县体育馆,陈营镇郊区村,4.666000,0.000000,公共设施用地,划拨,,体育,一级,,,0.60,1.30,2013年11月12日,2014年03月29日,2016年03月28日,,,万年县人民政府,2013年07月11日
鄞州区,3302122013B04885,宁波金苑金属材料有限公司,鄞州区云龙镇顿岙村,0.404700,0.000000,工业用地,挂牌出让,50,废弃资源和废旧材料回收加工业,七级,309.5955,宁波金苑金属材料有限公司,1.00,2.00,2013年10月31日,2014年10月31日,2016年10月30日,,,宁波市,2013年07月11日
旌德县,3418252013A00787,城东新村安置区,旌德县旌阳镇城东区,0.425050,0.425050,其他普通商品住房用地,划拨,,房地产业,一级,0.0000,,1.00,1.20,2013年07月30日,2013年08月30日,2014年08月30日,,,旌德县人民政府,2013年07月11日
富平县,6105282013A00123,庄里敬老院,庄里镇新区,0.621300,0.000000,医卫慈善用地,划拨,,社会福利业,未评估地区,,,,0.50,2013年09月10日,2013年09月15日,2015年09月14日,,,富平县人民政府,2013年07月11日
福贡县,5333232013B00278,住宅用地,福贡县上帕镇娃底街45号,0.002001,0.002001,中低价位、中小套型普通商品住房用地,协议出让,70,居民服务业,二级,0.6363,刘汉武,,,1900年01月01日,1900年01月01日,1900年01月01日,,,,2013年07月11日
侯马市,1410812013B00309,侯马市热乐采暖设备厂,侯马市新田乡东庄村,0.369300,0.000000,工业用地,挂牌出让,50,专用设备制造业,四级,106.0000,侯马市热乐采暖设备厂,0.40,1.60,2013年07月20日,2014年06月30日,2017年06月30日,,,侯马市,2013年07月11日
三台县,5107222013B05397,划拨转出让,潼川镇金凤路,0.005612,0.005612,其他普通商品住房用地,协议出让,70,住宿业,三级,2.1718,许正东,,,1900年01月01日,1900年01月01日,1900年01月01日,,,三台县,2013年07月11日
91团,6605112013A00029,九十一团2013年新建廉租住房建设项目(36#、39#、40#、47#住宅楼),九十一团团部建工路西、环城路南,1.224700,1.224700,廉租住房用地,划拨,,房屋和土木工程业,十四等级,18.3705,,1.03,1.03,2013年07月12日,2013年07月12日,2014年12月30日,,,第五师,2013年07月11日
南漳县,4206242013B01460,商业住房建设,巡检镇峡口村三组,0.026000,0.000000,其他商服用地,挂牌出让,40,居民服务业,十三等级,6.5500,冯祖国,,3.00,2013年07月11日,2013年07月26日,2013年12月26日,,,南漳县,2013年07月11日
