行政区,电子监管号,项目名称,项目位置,面积(公顷),土地来源,土地用途,供地方式,土地使用年限,行业分类,土地级别,成交价格(万元),土地使用权人,约定容积率下限,约定容积率上限,约定交地时间,约定开工时间,约定竣工时间,实际开工时间,实际竣工时间,批准单位,合同签订日期荆州市本级,4210002013B00281,荆州市中环置业有限公司,沙市区关沮乡白水村,7.354535,7.354535,其他普通商品住房用地,拍卖出让,其他普通商品住房用地70年; 其他商服用地40,房地产业,未评估地区,16110.0000,荆州市中环置业有限公司,1.80,3.50,2013年10月16日,2014年06月30日,2017年06月30日,,,荆州市,2013年07月16日
浔阳区,3604032013B00067,新雪域物流公司,浔阳区工业园1号地A-01-1地块,0.061590,0.061590,批发零售用地,挂牌出让,40,批发业,一级,122.8787,九江市新雪域置业有限公司,0.00,1.80,2013年07月16日,2013年09月17日,2015年09月17日,,,江西省九江市浔阳区,2013年07月16日
晴隆县,5223242013B00170,晴隆县国有建设用地使用权出让,莲城镇南街社区,0.017830,0.017830,其他普通商品住房用地,协议出让,70,住宿业,十五等级,2.4962,龙玉国,1.00,0.00,2013年07月18日,1900年01月01日,1900年01月01日,,,晴隆县,2013年07月16日
娄底市本级,4313002013B00718,娄底市星海房地产开发有限公司,贤童街以南，氐星路西侧,0.013501,0.013501,其他普通商品住房用地,协议出让,70,房地产业,九级,41.0000,娄底市星海房地产开发有限公司,1.38,1.38,2013年04月19日,2014年04月19日,2015年04月19日,,,娄底市,2013年07月16日
蕲春县,4211262013B00526,行政服务中心,赤东镇马铺村、范铺村,2.473660,0.000000,工业用地,挂牌出让,50,国家机构,三级,267.1517,湖北蕲春李时珍医药工业园区管委会,0.80,,2013年07月05日,2013年07月30日,2015年07月30日,,,蕲春县,2013年07月16日
谯城区,3416022013B00710,亳州金芝帮家具有限责任公司,赵桥乡,1.672740,0.000000,工业用地,挂牌出让,50,家具制造业,未评估地区,281.0000,亳州金芝帮家具有限责任公司,1.00,0.00,2013年10月16日,2014年01月16日,2015年01月16日,,,亳州市谯城区,2013年07月16日
襄阳区,4206072013B14836,住宅,襄州区钢铁路8号（南车集团襄樊机车厂）,0.001279,0.001279,其他普通商品住房用地,协议出让,50,住宿业,一级,0.0959,孙瑞松,,,2013年06月20日,1900年01月01日,1900年01月01日,,,襄州区,2013年07月16日
围场满族蒙古族自治县,1308282013B00586,孙久芹,塞罕坝机械林场总场,0.297770,0.297770,住宿餐饮用地,挂牌出让,40,住宿业,未评估地区,76.0000,孙久芹,,1.50,2013年08月15日,2013年08月20日,2014年08月30日,,,围场满族蒙古族自治县,2013年07月16日
普兰店市,2102822013B00322,大连新安越电力设备有限公司,太平办事处虫王庙社区,1.308300,0.000000,工业用地,挂牌出让,50,其它,四级,317.0000,大连新安越电力设备有限公司,0.80,0.00,2013年08月15日,2013年11月14日,2015年11月13日,,,普兰店市,2013年07月16日
四会市,4412842013B01986,杨桂华,四会市城中街道拱桥直街1号一座19号,0.000740,0.000740,其他普通商品住房用地,协议出让,70,房地产业,十级,0.1850,杨桂华,,,2013年07月16日,1900年01月01日,1900年01月01日,,,四会市,2013年07月16日
城阳区,3702142013B01997,青岛联华苑纺织开发有限公司年产500万套无缝美体内衣项目,棘洪滩街道韩海路东侧、青大二号路南侧,3.934200,0.000000,工业用地,挂牌出让,50,纺织服装、鞋、帽制造业,四级,1160.5890,青岛联华苑纺织开发有限公司,1.00,,2013年07月16日,2014年07月01日,2015年06月30日,,,青岛市,2013年07月16日
郯城县,3713222013B00726,年产10000吨钢结构构件项目,李庄镇青山村,3.333400,0.000000,工业用地,挂牌出让,50,金属制品业,十二级,370.0000,临沂茂华钢结构工程有限公司,0.70,,2013年07月17日,2013年07月18日,2014年07月18日,,,郯城县,2013年07月16日
夷陵区,4205062013B00524,宜昌人福药业有限责任公司工业项目,龙泉镇车站村,21.426421,0.000000,工业用地,挂牌出让,50,医药制造业,十二级,5797.0000,宜昌人福药业有限责任公司,0.70,2.00,2013年10月16日,2014年10月16日,2016年10月16日,,,宜昌市夷陵区,2013年07月16日
瓯海区,3303042013B02688,温州市瓯海娄桥化建有限公司拆迁安置工程,娄桥街道河庄村,0.263872,0.000000,工业用地,协议出让,34.4,工艺品及其他制造业,六级,63.1190,温州市瓯海娄桥化建有限公司,1.00,2.60,2013年07月17日,2014年01月16日,2016年01月15日,,,温州市,2013年07月16日
长治县,1404212013B00455-1,张巧则,长治县韩店镇黎岭村北,0.180495,0.000000,其他普通商品住房用地,挂牌出让,70,房地产业,四级,94.0000,张巧则,1.80,2.30,2014年07月15日,2015年07月14日,2018年07月13日,,,长治县,2013年07月16日
盐津县,5306232013B00522,住宅,盐津县牛寨乡安乐社区老街岩洞口,0.004900,0.004900,其他普通商品住房用地,协议出让,70,住宿业,十五等级,1.0927,张平,3.00,,2013年07月19日,2013年07月26日,2014年07月26日,,,盐津县,2013年07月16日
绍兴县,3306212013A00875,阳嘉龙安置小区幼儿园及社区服务中心,齐贤镇阳嘉龙村,1.325800,1.325800,科教用地,划拨,,教育业,二级,284.3374,,,0.22,2013年09月10日,2014年01月10日,2015年07月10日,,,绍兴县人民政府,2013年07月16日
四会市,4412842013B01975,吴伙娇,四会市地豆镇大街东65号,0.005000,0.005000,其他普通商品住房用地,协议出让,70,房地产业,十级,1.3725,吴伙娇,,,2013年07月16日,1900年01月01日,1900年01月01日,,,四会市,2013年07月16日
浔阳区,3604032013B00057,九江市浔阳区城市投资有限公司,浔阳区庐峰东路南侧,4.394700,4.394700,其他普通商品住房用地,挂牌出让,70,房屋和土木工程业,一级,25709.1900,九江市浔阳区城市建设投资有限公司,3.20,3.20,2013年07月17日,2013年09月17日,2015年09月17日,,,九江市浔阳区,2013年07月16日
芜湖县,3402212013A00923,湾沚镇辉湖山庄安置小区建设项目三期,湾沚镇焦村村,0.799800,0.000000,公共租赁住房用地,划拨,,房地产业,一级,0.0000,,1.00,,2013年08月16日,2013年09月16日,2015年09月16日,,,芜湖县发改委,2013年07月16日
河口瑶族自治县,5325322013B01175,住宅用地,河口县北山小区经济适用房,0.002347,0.002347,其他普通商品住房用地,协议出让,70,居民服务业,未评估地区,1.7016,周荣生,,,2013年07月16日,2013年07月16日,2013年07月16日,,,河口瑶族自治县人民政府,2013年07月16日
漠河县,2327232013B00240,于金龙,漠河县西林吉镇,0.058045,0.058045,其他商服用地,挂牌出让,40,零售业,四级,4.4200,于金龙,0.00,1.50,2013年07月19日,2013年07月19日,2015年07月19日,,,漠河县,2013年07月16日
临泽县,6207232013B00684,银鑫物流有限责任公司货运停车场,临泽县沙河镇西头号村,0.791000,0.000000,其他商服用地,挂牌出让,40,居民服务业,未评估地区,151.2000,临泽县银鑫物流有限责任公司,,1.20,2013年07月20日,2013年07月31日,2015年07月30日,,,临泽县,2013年07月16日
东陵区,2101122013A03194,沈阳市动漫大桥及其连接线道路工程,棋盘山开发区高坎街道七间房村,0.721514,0.000000,公路用地,划拨,,中国共产党机关,六级,0.0000,,0.00,0.00,2013年07月16日,2014年07月16日,2017年07月15日,,,沈阳市人民政府,2013年07月16日
项城市,4116812013B00084,河南莲花股份有限公司,颖河路西、纬二十六路南、经二十九路北,27.830600,0.000000,工业用地,挂牌出让,50,农副食品加工业,一级,5700.0000,河南莲花股份有限公司,1.00,0.00,2013年10月01日,2014年01月01日,2017年01月01日,,,项城市,2013年07月16日
武陟县,4108232013B00185,WZGT2013-09,云台大道西侧,4.412100,0.000000,中低价位、中小套型普通商品住房用地,挂牌出让,70,房地产业,四级,3630.0000,武陟县鼎盛置业有限公司,1.00,2.00,2013年07月31日,2014年07月30日,2017年07月30日,,,武陟县,2013年07月16日
芜湖县,3402212013A00914,湾沚镇辉湖山庄安置小区建设项目二期,湾沚镇焦村村,0.347700,0.000000,公共租赁住房用地,划拨,,房地产业,一级,0.0000,,1.00,,2013年08月16日,2013年09月16日,2015年09月16日,,,芜湖县发改委,2013年07月16日
临沂市本级,3713002013B05637,临沂市人民政府关于挂牌出让临沂高新技术产业开发区沂河路西段南侧一宗国有建设用地使用权的批复,临沂高新技术产业开发区沂河路西段南侧,0.910000,0.910000,批发零售用地,挂牌出让,40,批发业,六级,603.0000,临沂高新区恒安汽车销售服务有限公司,0.00,1.30,2013年07月16日,2014年07月01日,2015年06月30日,,,临沂市,2013年07月16日
泰宁县,3504292013A00276,县红十字会救灾仓库和卫生消毒站,泰宁县杉城镇民主街县疾病控制中心西侧,0.009000,0.009000,医卫慈善用地,划拨,,国家机构,一级,,,1.00,3.20,2013年08月20日,2013年11月30日,2014年11月30日,,,泰宁县人民政府,2013年07月16日
恩施市,4228012013B24389,何晓斌  胡秀美,新塘乡双河组(原双河乡上坝村5组),0.007850,0.007850,其他普通商品住房用地,协议出让,40,房地产业,三级,0.5495,何晓斌  胡秀美,,,1900年01月01日,1900年01月01日,1900年01月01日,,,恩施市,2013年07月16日
桃源县,4307252013B01888,田德明私人住宅用地,桃源县陬市镇下街居委会,0.007975,0.007975,其他普通商品住房用地,协议出让,49,住宿业,一级,4.2777,田德明,,1.74,1900年01月01日,1900年01月01日,1900年01月01日,,,桃源县,2013年07月16日
洞口县,4305252013B01436,个人住宅申请办理出让手续,黄桥镇和平街,0.008290,0.008290,其他普通商品住房用地,协议出让,70,房地产业,二级,0.4394,肖功胜,,,1900年01月01日,1900年01月01日,1900年01月01日,,,洞口县,2013年07月16日
福鼎市,3509822013B00805,福鼎市宏盛服装有限公司(二期),福鼎市星火工业园区4号地块,0.409800,0.000000,工业用地,挂牌出让,50,皮革、毛皮、羽毛（绒）及其制造业,十二级,184.4100,福鼎市宏盛服装有限公司,0.80,1.60,2014年01月16日,2014年07月16日,2016年07月16日,,,福鼎市,2013年07月16日
许昌市本级,4110002013B00472-1,许昌汉威置业有限公司,永昌东路南侧,6.360800,6.042800,中低价位、中小套型普通商品住房用地,拍卖出让,70,房地产业,五级,7550.0000,许昌汉威置业有限公司,1.00,3.00,2014年01月31日,2014年11月30日,2017年11月29日,,,许昌市,2013年07月16日
阜阳市本级,3412002013B00625,年产60万平方米节能及安全玻璃建设项目,阜阳市颍东区境内,1.889300,0.000000,工业用地,挂牌出让,50,砖瓦、石材及其他建筑材料制造,未评估地区,454.0000,阜阳市远大浮法玻璃制品有限公司,1.00,,2013年08月01日,2013年10月01日,2014年10月01日,,,阜阳市,2013年07月16日
松滋市,4210872013B03009,高后凤,松滋市新江口镇玉岭村五组,0.024280,0.024280,中低价位、中小套型普通商品住房用地,协议出让,20,房屋和土木工程业,三级,3.1982,高后凤,1.49,1.49,2013年07月19日,2013年07月26日,2014年01月26日,,,松滋市,2013年07月16日
云溪区,4306032013B00111,朱永祥,岳阳市云溪区洗马中路,0.009975,0.009975,其他普通商品住房用地,协议出让,70,住宿业,二级,4.4389,朱永祥,,,2013年07月16日,1900年01月01日,1900年01月01日,,,岳阳市云溪区,2013年07月16日
蒙阴县,3713282012A00736,门诊病房综合大楼配套附属设施建设项目,县城东蒙路以西，叠翠路以南。,1.212500,0.000000,医卫慈善用地,划拨,,卫生,十四等级,88.8522,,0.73,,2013年07月17日,2013年07月18日,2013年12月17日,,,蒙阴县人民政府,2013年07月16日
谯城区,3416022013B00626,国网安徽省电力公司亳州供电公司,赵桥乡赵桥村,2.360600,0.000000,公共设施用地,挂牌出让,50,其它,未评估地区,397.0000,国网安徽省电力公司亳州供电公司,,0.50,2013年10月16日,2014年01月16日,2015年01月16日,,,亳州市谯城区,2013年07月16日
惠州市本级,4413002013A02221,惠州市社会福利院服务中心,惠州市林场激流坑片区05-03-01地块,7.767100,7.767100,公共设施用地,划拨,,公共设施管理业,三级,1553.4200,,,1.50,2013年07月16日,2014年01月16日,2015年07月16日,,,惠州市国土资源局,2013年07月16日
武宁县,3604232013B01255,商住楼（艾政雷、柯传荣）,鲁溪集镇,0.253724,0.253724,其他普通商品住房用地,挂牌出让,其他普通商品住房用地70年; 其他商服用地40,房地产业,二级,274.2800,艾政雷、柯传荣,1.00,3.60,2013年08月30日,2014年08月30日,2015年08月30日,,,武宁县,2013年07月16日
顺德区,4406062013B69522,叶雪仪,大良街道办事处文秀居委会来鸥横九巷18号二楼,0.002054,0.002054,其他普通商品住房用地,协议出让,70,房地产业,一级,0.5960,叶雪仪,1.00,,1900年01月01日,1900年01月01日,1900年01月01日,,,佛山市,2013年07月16日
逊克县,2311232013B00139,昌宁小区,逊克县山湖路南、国防路北,0.149177,0.149177,其他商服用地,挂牌出让,40,房地产业,二级,79.1000,黑龙江宏昌房地产开发有限公司,2.30,2.30,2013年07月31日,2013年08月01日,2015年08月01日,,,逊克县,2013年07月16日
龙湾区,3303032013B04533,温州锦一无纺布有限公司新建厂房（拆迁安置）,龙湾区永中街道刘宅村,0.153800,0.000000,工业用地,协议出让,35,其它,五级,34.6774,温州锦一无纺布有限公司,0.80,,2013年07月16日,2014年01月16日,2015年07月16日,,,温州市,2013年07月16日
剑阁县,5108232013B19469,剑阁县人民政府关于程彦军国有建设用地使用权遗留问题处置,剑阁县迎水乡河东街,0.012600,0.012600,其他普通商品住房用地,协议出让,70,房地产业,十级,0.5292,程彦军,1.00,2.00,1900年01月01日,1900年01月01日,1900年01月01日,,,剑阁县人民政府,2013年07月16日
和平区,1201012013B01403,田阗,河东区英禧里1-3-底商6号,0.003510,0.003510,其他商服用地,协议出让,40,商务服务业,四级,5.6336,田阗,,,2013年07月16日,1900年01月01日,1900年01月01日,,,天津市人民政府授权的天津市国土资源和房屋管理局,2013年07月16日
诏安县,3506242013B00110,诏安县塔牌混凝土有限公司,诏安县四都镇城楼村,2.015500,0.000000,工业用地,挂牌出让,50,砖瓦、石材及其他建筑材料制造,三级,266.0460,诏安县塔牌混凝土有限公司,0.70,1.20,2013年07月21日,2013年08月21日,2015年04月21日,,,诏安县,2013年07月16日
建昌县,2114222013B00511,加油站,石佛乡张家店村,0.146700,0.000000,批发零售用地,挂牌出让,40,零售业,一级,100.0000,中国石油天然气股份有限公司辽宁葫芦岛销售分公司,0.00,1.00,2013年08月01日,2013年09月01日,2014年09月01日,,,建昌县,2013年07月16日
浮梁县,3602222013B00365,双龙湾山庄,庄湾乡古铜桥村,0.152688,0.000000,其他商服用地,挂牌出让,40,其他服务业,三级,39.6170,景德镇双龙湾农业生态园有限公司,1.00,2.00,2013年09月12日,2014年09月12日,2016年09月12日,,,浮梁县,2013年07月16日
,,,,,,,,,,,,,,,,,,,,,
靖远县,6204212013A00247,白银市公安局交通警察支队靖远大队刘川中队办公楼,靖远县刘川乡吴家川,0.266700,0.266700,机关团体用地,划拨,,国家机构,十四等级,,,1.00,,1900年01月01日,1900年01月01日,1900年01月01日,,,靖远县人民政府,2013年07月16日
德令哈市,6328022013A00439,德令哈协合二期20兆瓦并网光伏发电项目,德令哈市西出口光伏（热）产业园,38.000000,0.000000,工业用地,划拨,,其它,未评估地区,,,,1.00,2013年07月17日,2013年07月18日,2014年07月31日,,,青海省人民政府,2013年07月16日
日照市本级,3711002013A00691,综合业务楼,北京路以东、五莲路以北,3.331300,2.131300,机关团体用地,划拨,,中国共产党机关,一级,286.0196,,,1.70,2013年08月16日,2014年08月16日,2015年08月16日,,,日照市人民政府,2013年07月16日
关岭布依族苗族自治县,5204242013B02181,2005年关索新区被征地农户安置,关岭自治县关索镇大岩新区,0.009200,0.000000,中低价位、中小套型普通商品住房用地,协议出让,70,住宿业,三级,3.7536,蔡家义,1.00,3.00,2013年07月17日,2013年07月18日,2016年07月17日,,,关岭布依族苗族自治县,2013年07月16日
靖远县,6204212013A00237,白银市公安局交通警察支队靖远大队杜寨柯中队办公楼,靖远县北滩乡杜寨柯,0.403500,0.403500,机关团体用地,划拨,,国家机构,十四等级,,,1.00,,1900年01月01日,1900年01月01日,1900年01月01日,,,靖远县人民政府,2013年07月16日
济阳县,3701252013A00653,济阳县中医院病房楼,济阳县纬二路南，华阳路东,0.220237,0.220237,医卫慈善用地,划拨,,卫生,一级,0.0116,,0.00,,2013年06月25日,2013年06月25日,2015年06月25日,,,济阳县人民政府,2013年07月16日
麻城市,4211812013B00907,麻城市闽达房地产投资开发有限公司,麻城市南湖办事处五里墩村、万家堰村,4.087530,4.087530,其他普通商品住房用地,拍卖出让,70,房地产业,十一级,7155.0000,麻城市闽达房地产投资开发有限公司,2.50,2.50,2014年08月01日,2014年07月31日,2017年07月31日,,,麻城市人民政府,2013年07月16日
津南区,1201122013B01359,津南（挂）G2013-15号,津南区,2.444110,0.000000,工业用地,挂牌出让,50,房地产业,六级,1100.0000,天津团结投资有限公司,1.00,1.30,2013年10月25日,2014年07月16日,2017年07月16日,,,津南区,2013年07月16日
平乐县,4503302013B01150,商住楼,平乐镇月城街,0.528998,0.528998,中低价位、中小套型普通商品住房用地,协议出让,批发零售用地40年; 中低价位、中小套型普通商品住房用地50,房地产业,未评估地区,49.1969,麦桂琨,1.50,2.50,2013年07月15日,2014年07月15日,2017年07月14日,,,平乐县,2013年07月16日
昌图县,2112242013B00819,新建厂房、办公楼,老四平镇光辉村,1.442600,1.442600,工业用地,挂牌出让,50,通用设备制造业,十三等级,138.5000,辽宁弛丰环保设备制造有限公司,0.80,,2013年07月16日,2013年07月16日,2014年07月15日,,,昌图县,2013年07月16日
耒阳市,4304812013B00838,资朝华,耒阳市灶市村8组马家坪,0.009600,0.009600,其他普通商品住房用地,协议出让,70,房地产业,三级,4.6080,资朝华,,,1900年01月01日,2013年09月16日,2014年07月10日,,,耒阳市人民政府,2013年07月16日
平乐县,4503302013B01140,商住楼,平乐镇月城街,0.400002,0.400002,中低价位、中小套型普通商品住房用地,协议出让,中低价位、中小套型普通商品住房用地50年; 批发零售用地40,房地产业,未评估地区,31.1601,申润芳,1.50,2.50,2017年07月15日,2014年07月15日,2017年07月14日,,,平乐县,2013年07月16日
金平苗族瑶族傣族自治县,5325302013A00415,住宅,金平县城金福苑小区B7幢后面白沙坡水沟处,0.012000,0.012000,其他普通商品住房用地,划拨,,其他服务业,二级,0.0000,,1.00,2.00,2013年07月16日,2013年07月17日,2014年07月17日,,,金平县人民政府,2013年07月16日
科尔沁右翼中旗,1522222013A01089,高力板镇农牧林水服务中心,高力板镇区南收购部,0.593313,0.108433,机关团体用地,划拨,,中国共产党机关,一级,,,0.46,0.46,2013年07月20日,2013年07月30日,2013年12月30日,,,科右中旗人民政府,2013年07月16日
顺德区,4406062013B69502,陈金庆,大良街道办事处金榜居委会龙京北路2号501号,0.001332,0.001332,其他普通商品住房用地,协议出让,70,房地产业,二级,0.6451,陈金庆,1.00,,1900年01月01日,1900年01月01日,1900年01月01日,,,佛山市,2013年07月16日
临汾市本级,1410002013B00071,解放东路南侧商品房开发,解放东路南侧,0.914522,0.914522,中低价位、中小套型普通商品住房用地,挂牌出让,70,房地产业,二级,1963.0000,临汾市尧隆房地产开发有限公司,1.00,3.00,2013年08月20日,2013年11月30日,2016年09月30日,,,临汾市,2013年07月16日
科尔沁右翼中旗,1522222013A01071,高力板镇干部职工集体宿舍,高力板镇区南收购部,0.156129,0.000000,机关团体用地,划拨,,中国共产党机关,一级,,,0.60,0.60,2013年07月20日,2013年07月30日,2013年12月30日,,,科右中旗人民政府,2013年07月16日
河口瑶族自治县,5325322013B01167,住宅用地,河口县桥头乡桥头杰园小区,0.001836,0.001836,其他普通商品住房用地,协议出让,70,居民服务业,未评估地区,0.8996,丁玉林,,,2013年07月16日,2013年07月16日,2013年07月16日,,,河口瑶族自治县人民政府,2013年07月16日
麻城市,4211812013B00896,麻城市闽达房地产投资开发有限公司,麻城市南湖办事处五里墩村、万家堰村,4.399470,4.399470,其他普通商品住房用地,拍卖出让,70,房地产业,十一级,7701.0000,麻城市闽达房地产投资开发有限公司,2.50,2.50,2014年04月01日,2014年10月01日,2016年10月01日,,,麻城市,2013年07月16日
科尔沁右翼中旗,1522222013A01069,高力板镇干部职工食堂,高力板镇区南收购部,0.036426,0.000000,机关团体用地,划拨,,中国共产党机关,一级,,,0.45,0.45,2013年07月20日,2013年07月30日,2013年12月30日,,,科右中旗人民政府,2013年07月16日
鸡西市本级,2303002013B00587,城子河区2010-04号地块（金三角家具城批发城南）,金三角家具城批发城南,1.499100,1.499100,其他普通商品住房用地,挂牌出让,70,房地产业,三级,1475.5644,牡丹江怡兴房地产开发有限责任公司,1.00,4.50,2013年08月16日,2013年08月20日,2016年08月16日,,,鸡西市,2013年07月16日
天津市本级,1201002013B00992,天津市榕洋房地产开发有限公司,东丽区利津路增5号,0.432110,0.432110,商务金融用地,协议出让,40,房地产业,八级,708.4444,天津市榕洋房地产开发有限公司,,,1900年01月01日,1900年01月01日,1900年01月01日,,,天津市人民政府授权的天津市国土资源和房屋管理局,2013年07月16日
围场满族蒙古族自治县,1308282013B00550,承德春和景明酒店有限公司,塞罕坝机械林场总场,0.512007,0.512007,住宿餐饮用地,挂牌出让,40,住宿业,未评估地区,123.0000,承德春和景明酒店有限公司,,1.50,2013年08月10日,2014年06月01日,2016年07月30日,,,围场满族蒙古族自治县,2013年07月16日
吴忠市本级,6403002013B00890,宁夏太阳镁业有限公司3号工业用地项目,红寺堡区太阳山镇塘坊梁村，四至;东靠天然牧草地、南靠天然牧草地、西靠宁夏太阳镁业有限公司、北靠石子路,3.335600,0.000000,工业用地,挂牌出让,50,铁合金冶炼,十五等级,62.4300,宁夏太阳镁业有限公司,0.70,,2013年07月31日,2013年08月06日,2015年08月06日,,,吴忠市红寺堡区,2013年07月16日
项城市,4116812013B00224-1,项城市益明食用油有限公司,颖河路西、天安大道北、经二路东,4.815900,0.000000,工业用地,挂牌出让,50,农副食品加工业,十三等级,1000.0000,项城市益明食用油有限公司,1.00,0.00,2013年10月01日,2014年01月01日,2016年01月01日,,,项城市人民政府,2013年07月16日
夷陵区,4205062013B00542,宜昌鑫宏房地产开发有限公司商服、住宅项目,发展新区梅子垭村,0.918700,0.000000,其他普通商品住房用地,挂牌出让,其他商服用地40年; 其他普通商品住房用地70,房地产业,十二级,1264.0000,宜昌鑫宏房地产开发有限公司,1.00,2.20,2013年10月16日,2014年10月16日,2016年10月16日,,,宜昌市夷陵区,2013年07月16日
富平县,6105282013B00161,西二环加油站,富平县西二环西侧,0.300000,0.000000,其他商服用地,挂牌出让,40,零售业,未评估地区,171.0000,富平县物资局石油液化气加油站,,0.50,2013年09月26日,2014年03月01日,2016年02月29日,,,富平县,2013年07月16日
莲都区,3311022013A00909,大港头镇自来水厂,大港头镇53省道以北，丽云西路C1-C2段以南,0.663000,0.006800,公共设施用地,划拨,,公共设施管理业,三级,207.0967,,0.19,0.19,2013年10月16日,2014年01月16日,2016年01月15日,,,丽水市人民政府,2013年07月16日
金平苗族瑶族傣族自治县,5325302013A00403,住宅,金平县城金福苑小区B7幢后面白沙坡水沟处,0.012000,0.012000,其他普通商品住房用地,划拨,,其他服务业,二级,0.0000,,1.00,2.00,2013年07月16日,2013年07月17日,2014年07月17日,,,金平县人民政府,2013年07月16日
诏安县,3506242013B00100,天恒达电工科技股份有限公司,诏安县四都镇城楼村、后港村,6.570200,0.000000,工业用地,挂牌出让,50,其它,三级,867.2664,天恒达电工科技股份有限公司,0.60,1.20,2013年07月21日,2013年08月21日,2016年02月21日,,,诏安县,2013年07月16日
富平县,6105282013B00237,秦正公馆,富平县莲湖大街东段北侧,5.293400,0.000000,其他普通商品住房用地,挂牌出让,其他普通商品住房用地70年; 其他商服用地40,房地产业,未评估地区,12704.0000,富平县汇容置业有限公司,1.00,3.00,2013年09月26日,2014年03月01日,2016年02月29日,,,富平县,2013年07月16日
