行政区,电子监管号,项目名称,项目位置,面积(公顷),土地来源,土地用途,供地方式,土地使用年限,行业分类,土地级别,成交价格(万元),土地使用权人,约定容积率下限,约定容积率上限,约定交地时间,约定开工时间,约定竣工时间,实际开工时间,实际竣工时间,批准单位,合同签订日期
珠海市本级,4404002016A01144,吉大公交总站项目,吉大海滨南路东侧、吉大路北侧,2.139244,2.139244,公共设施用地,划拨,,环境管理业,一级,,,,1.00,2016年11月05日,2017年11月05日,2019年11月05日,,,珠海市人民政府,2016年11月05日
鹿城区,3303022016A38413,浙江温州鹿城轻工产业园区中央大道（下坦河-纵二路）绿化带建设工程,温州市鹿城区藤桥镇戴宅村、外垟村,0.391008,0.000000,公园与绿地,划拨,,公共设施管理业,三级,0.0000,,0.00,0.00,2016年11月06日,2017年05月05日,2018年11月05日,,,温州市人民政府,2016年11月05日
肇庆市本级,4412002016B01835,肇庆高新区投资控股有限公司,肇庆市高新区中心服务区经十五路东面、纬四路北面地段,3.976529,0.000000,中低价位、中小套型普通商品住房用地,拍卖出让,70,房地产业,十级,6200.0000,肇庆高新区投资控股有限公司,1.00,3.20,2016年11月25日,2017年11月25日,2018年11月25日,,,肇庆市,2016年11月05日
肇庆市本级,4412002016B01818,肇庆高新区投资控股有限公司,肇庆市高新区中心服务区经十六路东面、环湖路北面地段,1.212035,0.000000,商务金融用地,拍卖出让,40,其他服务业,十级,2300.0000,肇庆高新区投资控股有限公司,1.00,7.00,2016年11月25日,2017年11月25日,2018年11月25日,,,肇庆市,2016年11月05日
肇庆市本级,4412002016B01821,肇庆高新区投资控股有限公司,肇庆市高新区中心服务区经二十路西面、环湖路北面,1.215144,0.000000,商务金融用地,拍卖出让,40,其他服务业,十级,2300.0000,肇庆高新区投资控股有限公司,1.00,7.00,2016年11月25日,2017年11月25日,2018年11月25日,,,肇庆市,2016年11月05日
肇庆市本级,4412002016B01797,肇庆高新区纳德科技有限公司,肇庆高新区凤岗工业园美达服装东面、创新大街北面地段,6.680684,6.680684,工业用地,拍卖出让,50,化学原料及化学制品制造业,十级,2600.0000,肇庆高新区纳德科技有限公司,1.00,,2016年11月25日,2017年11月25日,2019年11月25日,,,肇庆市,2016年11月05日
桃源县,4307252016B03507,桃源县年产3000吨桂花塘产品地块挂牌出让,陬市镇三里铺村,1.868575,0.000000,工业用地,挂牌出让,50,食品制造业,三级,485.0000,桃源县佳奇食品有限责任公司,1.00,,2016年12月05日,2017年12月05日,2020年12月05日,,,桃源县,2016年11月05日
桃源县,4307252016B03486,湖南迪文三期地块挂牌出让,漳江镇官家坪居委会、青林乡青林村,7.658900,0.000000,工业用地,挂牌出让,50,计算机服务业,四级,2010.0000,湖南迪文科技有限公司,1.00,,2016年12月05日,2017年12月05日,2020年12月05日,,,桃源县,2016年11月05日
华容县,4306232016B00394,潘永红,章华镇环城村,0.035860,0.003000,其他普通商品住房用地,协议出让,70,居民服务业,二级,2.4600,潘永红,1.00,5.73,2016年10月20日,,,,,华容县,2016年11月05日
枝江市,4205832016B00301,枝江翔达置业有限公司,马家店街办礼化路以西、胜利路以北。,1.747930,1.747930,其他普通商品住房用地,拍卖出让,70,房地产业,未评估地区,4000.0000,枝江翔达置业有限公司,1.00,2.50,2017年11月05日,2018年07月05日,2021年07月05日,,,枝江市,2016年11月05日
嘉荫县,2307222016B00169,嘉荫县泷浦居住宅小区,嘉荫县朝阳镇,0.889285,0.889285,其他商服用地,协议出让,40,房地产业,一级,466.8746,黑龙江省利嘉 园房地产开发有限责任公司,1.80,,2016年11月05日,2016年11月08日,2016年11月30日,,,嘉荫县,2016年11月05日
182团,6610022016A00074,十师一八二团社区老年人日间照料中心建设项目,十师一八二团团部,0.233500,0.233500,医卫慈善用地,划拨,,社会保障业,未评估地区,3.5025,,0.43,0.43,2017年04月15日,2017年04月15日,2017年11月30日,,,新疆生产建设兵团第十师,2016年11月05日
盐都区,3209032016A01110,市公交中心回车场工程,盐城市盐都区潘黄街道办事处美丽居委会,1.250400,0.000000,公共设施用地,划拨,,公共设施管理业,十二级,0.0000,,1.33,0.00,2016年10月05日,2017年03月05日,2019年03月04日,,,盐城市人民政府,2016年11月05日
杭锦后旗,1508262016B00155,富锦嘉园,杭锦后旗陕坝镇河套大街南侧,2.064100,2.064100,其他普通商品住房用地,挂牌出让,70,房地产业,二级,880.0000,巴彦淖尔市瑞丰房地产开发有限责任公司,1.00,2.00,2016年11月05日,2017年03月15日,2018年11月01日,,,杭锦后旗,2016年11月05日
嘉荫县,2307222016A00171,嘉荫县泷浦居住宅小区,嘉荫县朝阳镇,2.254207,2.254207,经济适用住房用地,划拨,,房地产业,一级,,,1.80,,2016年11月07日,2016年11月09日,2017年11月30日,,,嘉荫县国土资源局,2016年11月05日
崇礼县,1307332016A00287,崇礼西桥梁48兆瓦风电场二期工程,崇礼区四台嘴乡西坪村、桦林子村、水泉子村、窑子湾村、四台嘴村、行人马沟村、沟掌村、东坪村、辛丈子村、河阳沟村、转枝莲村、马丈子村,0.831000,0.000000,公共设施用地,划拨,,其它,未评估地区,65.0000,,,,2016年11月08日,2017年11月07日,2018年11月06日,,,张家口市崇礼区人民政府,2016年11月05日
巢湖市本级,3414002016A00506,中垾镇卫生院,中垾镇,0.498904,0.000000,医卫慈善用地,划拨,,卫生,十一级,,,1.00,,2016年12月02日,2016年12月12日,2017年12月12日,,,巢湖市人民政府,2016年11月05日
滁州市本级,3411002016B01210,滁州蓝疆自动化设备科技有限公司,示范园区滁州大道与南通路交叉口西北侧,1.338600,0.000000,工业用地,挂牌出让,50,通讯设备、计算机及其他电子设备制造业,三级,225.0000,滁州蓝疆自动化设备科技有限公司,1.20,,2016年11月15日,2017年02月15日,2018年02月14日,,,滁州市,2016年11月05日
华容县,4306232016B00389,舒琴,章华镇书院路,0.014720,0.014720,其他普通商品住房用地,协议出让,70,居民服务业,二级,2.3100,舒琴,1.00,2.00,2016年10月28日,,,,,华容县,2016年11月05日
太原市本级,1401002016A01229,小店区北格镇西蒲村部分规划道路用地项目,小店区北格镇西蒲村,0.309365,0.000000,街巷用地,划拨,,国家机构,未评估地区,,,,,2016年11月05日,,,,,太原市人民政府,2016年11月05日
182团,6610022016A00083,十师一八二团医院医疗康复中心建设项目,十师一八二团团部,0.206200,0.206200,医卫慈善用地,划拨,,社会保障业,未评估地区,3.0930,,1.43,1.43,2017年04月15日,2017年04月15日,2017年11月30日,,,新疆生产建设兵团第十师,2016年11月05日
莒南县,3713272016B00967,中国石化销售有限公司山东临沂石油分公司建设加油站项目,岭泉镇殷家庄村,0.634070,0.634070,批发零售用地,挂牌出让,40,零售业,四级,1592.0000,中国石化销售有限公司山东临沂石油分公司,,2.00,2017年05月05日,2017年11月05日,2019年11月05日,,,莒南县,2016年11月05日
桃源县,4307252016B03734,桃源县年产800吨酱板系列食品项目地块挂牌出让,桃源县陬市镇观音桥村,1.817515,0.000000,工业用地,挂牌出让,50,食品制造业,三级,635.0000,湖南丹洋食品有限公司,1.00,,2016年12月05日,2017年12月05日,2020年12月05日,,,桃源县,2016年11月05日
