行政区,电子监管号,项目名称,项目位置,面积(公顷),土地来源,土地用途,供地方式,土地使用年限,行业分类,土地级别,成交价格(万元),土地使用权人,约定容积率下限,约定容积率上限,约定交地时间,约定开工时间,约定竣工时间,实际开工时间,实际竣工时间,批准单位,合同签订日期
郑州市本级,4101002016B19609,蓝宝石3,凤华路北侧、航虹路东侧,8.259560,0.000000,工业用地,挂牌出让,50,其它,十二级,2743.0000,河南瑞弘源科技有限公司,1.00,3.00,2017年02月28日,2017年11月29日,2019年11月28日,,,郑州航空港经济综合实验区管理委员会、新郑市,2016年11月30日
凌源市,2113822016A00425,道路用地,红山街道庙东村,0.476500,0.000000,街巷用地,划拨,,公共设施管理业,十一级,0.0000,,0.00,0.00,2016年12月05日,2017年04月01日,2020年04月01日,,,凌源市人民政府,2016年11月30日
大渡口区,5001042016A00300,丰收坝水厂二期扩建工程,大渡口区跳磴镇石盘村,1.108150,0.075500,公共设施用地,划拨,,其他服务业,七级,2174.3100,,,,2017年03月01日,2017年04月30日,2019年04月30日,,,重庆市人民政府,2016年11月30日
广安市本级,5116002016B00688,GC2016-43号,协兴镇金广村、保安村,0.531100,0.000000,其他商服用地,挂牌出让,40,房地产业,三级,390.3340,四川协创房地产开发有限责任公司,1.00,1.20,2017年01月30日,2017年07月30日,2019年07月30日,,,川渝合作示范区广安协兴生态文化旅游园区管理委员会,2016年11月30日
中牟县,4101222016A03920,机西高速,中牟县境内,0.003600,0.000000,公路用地,划拨,,国家机构,十二级,,,,1.00,2016年12月30日,2017年01月01日,2019年01月01日,,,中牟县人民政府,2016年11月30日
乡宁县,1410292016B00313,2016-CLSC-011号商住地块,乡宁县昌宁镇迎旭大街财政局东,0.226500,0.226500,其他普通商品住房用地,挂牌出让,其他普通商品住房用地70年; 其他商服用地40年;,房地产业,一级,331.2800,山西省硕伦房地产开发有限公司,1.00,3.50,2017年03月06日,2018年03月06日,2021年03月06日,,,乡宁县,2016年11月30日
浏阳市,4301812016B03302,三一工程机械产品销售及再制造项目,制造产业基地内，樟树路南侧、坪头北路西侧(PT07-14-02地块),2.670538,0.000000,工业用地,挂牌出让,50,专用设备制造业,十级,1002.0000,长沙三一工程机械有限公司,1.00,2.00,2016年11月30日,2017年11月01日,2019年11月01日,,,浏阳市,2016年11月30日
白碱滩区,6502042016B00198,工业用地KGB2016-041,克拉玛依石化园区石化大道南延伸段西侧,0.724949,0.724949,工业用地,挂牌出让,50,石油加工、炼焦及核燃料加工业,三级,115.0000,克拉玛依金江有限责任公司,0.50,0.00,2016年12月24日,2017年10月15日,2018年10月15日,,,克拉玛依市白碱滩区,2016年11月30日
辽阳市本级,2110002016A00393,储备项目三,河东新城迎水岛,42.318300,0.000000,空闲地,划拨,,中国共产党机关,未评估地区,,,,,,,,,,辽阳市人民政府,2016年11月30日
辽阳市本级,2110002016A00347,储备项目一,河东新城中轴,28.469140,0.000000,空闲地,划拨,,中国共产党机关,未评估地区,,,,,,,,,,辽阳市人民政府,2016年11月30日
竹山县,4203232016B00609,房改房上市交易,城关镇人民路老车站,0.001420,0.001420,其他普通商品住房用地,协议出让,70,房地产业,十四等级,0.8934,刘振理 陈耀庆,,,2016年11月30日,,,,,竹山县,2016年11月30日
上饶市本级,3611002016B01304,商住楼,凤凰大道北侧、天佑大道南侧、站前大道西侧,5.996680,5.478400,商务金融用地,挂牌出让,批发零售用地40年; 住宿餐饮用地40年; 商务金融用地40年; 其他商服用地40年; 其他普通商品住房用地70年;,房地产业,四级,15670.0000,上饶饶商投资控股有限公司,1.00,3.00,2017年06月17日,2018年05月17日,2021年05月17日,,,上饶市,2016年11月30日
西乡县,6107242016B00866,陈明顺,城关镇云盘村一组,0.019227,0.019227,其他普通商品住房用地,协议出让,70,房地产业,一级,7.5800,陈明顺,1.50,,,,,,,西乡县,2016年11月30日
固原市本级,6404002016A00341,固原市张易至隆德公路工程,固原市原州区张易镇贺套村、田堡村、张易村,16.230900,0.000000,公路用地,划拨,,道路运输业,未评估地区,,,,,2016年12月24日,2017年03月24日,2019年03月24日,,,固原市人民政府,2016年11月30日
益阳市本级,4309002016B39644,袁正端国有划拨用地使用权出让,金山西路南侧、水箱厂北侧,0.001160,0.001160,中低价位、中小套型普通商品住房用地,协议出让,70,房地产业,二级,0.1064,袁正端,,,2016年11月30日,,,,,益阳市,2016年11月30日
永城市,4114812016A00307,蓝色港湾安置社区项目用地,龙宇大道东侧、城郊铁路专用线北侧,8.875200,0.000000,其他普通商品住房用地,划拨,,房地产业,十二级,1426.3473,,1.00,1.97,2017年01月17日,2017年04月17日,2020年01月17日,,,永城市人民政府,2016年11月30日
印江土家族苗族自治县,5222262016A00302,交通局物资储备中心,印江自治县中兴街道办事处蔓袍村,0.824800,0.000000,仓储用地,划拨,,国家机构,十五等级,,,0.50,,2017年03月01日,2017年06月01日,2019年06月01日,,,印江自治县人民政府,2016年11月30日
建昌县,2114222016A00150,建昌县黑山科乡中心幼儿园学生宿舍楼,建昌县黑山科小学院内南侧,0.431700,0.000000,科教用地,划拨,,教育业,三级,,,0.50,1.00,,,,,,建昌县人民政府,2016年11月30日
无为县,3414222016A03804,新建公园与绿地项目（HB-2016134）,无为县无城镇王福村,9.531200,0.000000,公共设施用地,划拨,,其他金融服务,二级,0.0000,,,,2016年12月30日,2017年11月30日,2019年11月30日,,,无为县人民政府,2016年11月30日
西峡县,4113232016B00166,西峡县丹水联盛加油站,丹水镇丹水居委会二组,0.216819,0.000000,其他商服用地,挂牌出让,40,零售业,十四等级,94.3163,西峡县丹水联盛加油站,,0.90,2016年12月01日,2016年12月08日,2018年12月08日,,,西峡县,2016年11月30日
湘乡市,4303812016B01838,李新华个人住宅,望办夏梓桥财政局03栋503,0.001702,0.001702,其他普通商品住房用地,协议出让,70,房地产业,二级,1.6663,李新华,,,,,,,,湘乡市,2016年11月30日
怀化市本级,4312002016B02073,住宅,怀化市飞鹤村,0.038850,0.001295,其他普通商品住房用地,协议出让,70,房地产业,一级,0.2745,黄素玲,,,,,,,,怀化市,2016年11月30日
新县,4115232016A00085,河南省木本油产品质量监督检验中心和新县食品质量安全综合检验检测中心,金兰山街道办事处白果树居委会蔡庄,0.592800,0.433799,科教用地,划拨,,公共管理和社会组织,二级,,,1.40,1.40,2016年12月01日,2016年12月01日,2018年12月01日,,,新县人民政府,2016年11月30日
芜湖市本级,3402002016B01476,单轨车辆及捷运系统胶轮车辆生产基地建设（一期）项目,经开区东区赤铸山路南侧、梦溪路西侧,16.137700,16.137700,工业用地,挂牌出让,30,交通运输设备制造业,一级,5099.5200,中车浦镇庞巴迪运输系统有限公司,1.20,,2016年12月30日,2017年05月30日,2019年05月29日,,,芜湖市,2016年11月30日
浏阳市,4301812016B03349,汽车零部件及装备制造项目,浏阳高新区永泰路北侧、浒水路东侧(汽车零部件及装备制造项目),0.365559,0.000000,工业用地,挂牌出让,50,工艺品及其他制造业,十级,121.0000,浏阳现代制造产业建设投资开发有限公司,1.00,1.50,2016年11月30日,2017年11月01日,2019年11月01日,,,浏阳市,2016年11月30日
银川市本级,6401002016A01965,金凤区盈南砖渠康居六号路（通达街-经一路）道路工程,金凤区通达街至经一路,0.566477,0.560177,街巷用地,划拨,,国家机构,未评估地区,,,,,2016年12月02日,2016年12月02日,2018年12月02日,,,银川市人民政府,2016年11月30日
钦州市本级,4507002016B00456,中马中等专业学校用地,丹兰路东面、中马北二街南面、锦绣大道西面、中马北一街北面C-04-02地块,5.421139,0.000000,科教用地,挂牌出让,50,房地产业,三级,4283.0000,广西中马钦州产业园区方圆实业有限公司,,2.00,2016年11月30日,2017年11月30日,2019年11月30日,,,钦州市,2016年11月30日
乡宁县,1410292016B00313,2016-CLSC-011号商住地块,乡宁县昌宁镇迎旭大街财政局东,0.226500,0.226500,其他普通商品住房用地,挂牌出让,其他普通商品住房用地70年; 其他商服用地40年;,房地产业,一级,331.2800,山西省硕伦房地产开发有限公司,1.00,3.50,2017年03月06日,2018年03月06日,2021年03月06日,,,乡宁县,2016年11月30日
弥渡县,5329252016B00545,MCZ2016-17,弥渡县弥城镇文新街,0.009147,0.009147,其他普通商品住房用地,拍卖出让,70,住宿业,二级,115.0000,郭江,1.50,1.50,2016年12月31日,2017年12月31日,2020年12月31日,,,弥渡县人民政府,2016年11月30日
安乡县,4307212016A00148,深柳大道东延伸线道路工程,西起安乡大道东至规划东环路,8.650300,0.000000,公路用地,划拨,,城市公共交通业,十二级,0.0000,,,,2016年12月08日,2016年12月09日,2017年12月08日,,,安乡县人民政府,2016年11月30日
郑州市本级,4101002016B19716,台科14,文安路南、政和路东,1.327600,0.000000,工业用地,挂牌出让,50,环境管理业,十二级,439.0000,郑州台科产业园有限公司,1.60,3.00,2017年02月28日,2017年11月29日,2019年11月28日,,,郑州航空港经济综合实验区管理委员会、新郑市,2016年11月30日
中牟县,4101222016A03918,机西高速,中牟县境内,0.434600,0.000000,公路用地,划拨,,国家机构,十二级,,,,1.00,2016年12月30日,2017年01月01日,2019年01月01日,,,中牟县人民政府,2016年11月30日
怀化市本级,4312002016B02130,住宅,怀化市怀黔路鸭嘴岩路段西侧,0.252200,0.000000,其他普通商品住房用地,挂牌出让,70,房地产业,二级,2547.2200,怀化天野园林绿化有限公司,1.00,3.50,2017年11月30日,2018年11月30日,2021年11月30日,,,怀化市,2016年11月30日
永年县,1304292016B00529,工业用地,永合会镇娄里村南,8.523389,0.000000,工业用地,挂牌出让,50,金属制品业,未评估地区,2261.0000,河北永洋特钢集团有限公司,0.80,,2016年11月30日,2017年11月28日,2019年11月27日,,,邯郸市永年区,2016年11月30日
辽阳市本级,2110002016A00393,储备项目三,河东新城迎水岛,42.318300,0.000000,空闲地,划拨,,中国共产党机关,未评估地区,,,,,,,,,,辽阳市人民政府,2016年11月30日
荥阳市,4101822016B00988,郑州瀚宇置业有限公司,滨河东路东侧,0.893724,0.000000,其他普通商品住房用地,挂牌出让,70,房地产业,十二级,2125.0000,郑州瀚宇置业有限公司,1.00,3.00,2017年02月28日,2017年08月28日,2019年08月28日,,,荥阳市,2016年11月30日
永城市,4114812016A00307,蓝色港湾安置社区项目用地,龙宇大道东侧、城郊铁路专用线北侧,8.875200,0.000000,其他普通商品住房用地,划拨,,房地产业,十二级,1426.3473,,1.00,1.97,2017年01月17日,2017年04月17日,2020年01月17日,,,永城市人民政府,2016年11月30日
鹿泉市,1301852016A00656,道路绿化,获鹿镇三街村,0.869080,0.000000,公园与绿地,划拨,,中国共产党机关,九级,0.0000,,,,,,,,,石家庄市鹿泉区人民政府,2016年11月30日
宜宾县,5115212016B00128,其他普通商品住房用地,宜宾市天柏组团柏溪片区26-2/01-1地块,2.607600,0.000000,其他普通商品住房用地,拍卖出让,70,房地产业,一级,5110.8960,宜宾经典置业有限公司,1.00,3.50,2017年04月16日,2017年07月16日,2020年07月15日,,,宜宾县,2016年11月30日
科尔沁右翼前旗,1522212016B00697,工业,科右前旗大石寨镇本街,0.040000,0.040000,工业用地,协议出让,10,房地产业,一级,0.9360,刘振江,0.00,0.00,,,,,,科右前旗,2016年11月30日
大同市本级,1402002016B00671,平城街北侧地块改变使用条件（大同市北都石化加油站）,平城街北侧魏都大道东二路西侧,0.238500,0.238500,批发零售用地,协议出让,40,房地产业,一级,1217.7900,大同市宇鑫房地产开发有限责任公司,,0.30,2016年12月01日,2017年05月01日,2019年05月01日,,,大同市,2016年11月30日
郑州市本级,4101002016B19766,越人生物,规划工业三路南，规划生物科技二街东,4.641310,0.000000,工业用地,挂牌出让,50,医药制造业,十二级,1416.0000,河南省越人生物科技有限公司,1.60,3.00,2017年02月28日,2017年11月29日,2019年11月28日,,,郑州航空港经济综合实验区管理委员会、新郑市,2016年11月30日
新干县,3608242016B00180,城北工业园内一宗国有建设用地使用权（DDH2016015地块）,城北工业园,1.307490,1.307490,工业用地,挂牌出让,50,汽车制造,十三等级,125.6000,江西东鼎汽车配件有限公司,0.90,1.30,2017年12月01日,2017年11月24日,2019年11月24日,,,新干县人民政府,2016年11月30日
洪湖市,4210832016B01648,朱俊祖国有建设用地使用权,洪湖市峰口镇凤凰街,0.012580,0.012580,其他普通商品住房用地,协议出让,30,房地产业,三级,0.4530,朱俊祖,1.00,3.00,2016年11月30日,,,,,洪湖市,2016年11月30日
丰都县,5002302016A00329,三峡移民后扶项目,名山街道东作门街36号,0.079900,0.079900,宗教用地,划拨,,群众团体、社会团体和宗教组织,十六等级,,,1.00,1.10,2016年12月02日,2017年06月02日,2020年06月01日,,,丰都县人民政府,2016年11月30日
郑州市本级,4101002016B19629,蓝宝石1,新港八路南侧、航虹路西侧,8.434230,0.000000,工业用地,挂牌出让,50,其它,十二级,2801.0000,河南瑞弘源科技有限公司,1.00,3.00,2017年02月28日,2017年11月29日,2019年11月28日,,,郑州航空港经济综合实验区管理委员、新郑市,2016年11月30日
水富县,5306302016B00791,周强,云富街道办事处人民东路,0.002138,0.002138,其他普通商品住房用地,协议出让,70,房屋和土木工程业,一级,1.5351,周强,,,2016年11月30日,,,,,水富县,2016年11月30日
临沂市本级,3713002016A02770,代征道路,河东区,0.000100,0.000000,街巷用地,划拨,,城市公共交通业,未评估地区,0.0000,,,,,,,,,临沂市人民政府,2016年11月30日
郑州市本级,4101002016B19665,台科9,文华路南、政和路西,1.869540,0.000000,工业用地,挂牌出让,50,其他服务业,十二级,617.0000,郑州台科产业园有限公司,1.60,3.00,2017年02月28日,2017年11月29日,2019年11月28日,,,郑州航空港经济综合实验区管理委员会、新郑市,2016年11月30日
岚皋县,6109252016B00281,其他商服,岚皋县县城柑竹坝王家堡,0.258900,0.258900,其他商服用地,挂牌出让,40,批发和零售业,四级,194.1750,安康市中园石油有限公司,,1.00,2016年12月31日,2016年12月31日,2019年12月31日,,,岚皋县,2016年11月30日
岚皋县,6109252016B00281,其他商服,岚皋县县城柑竹坝王家堡,0.258900,0.258900,其他商服用地,挂牌出让,40,批发和零售业,四级,194.1750,安康市中园石油有限公司,,1.00,2016年12月31日,2016年12月31日,2019年12月31日,,,岚皋县,2016年11月30日
无为县,3414222016A03968,无城镇新金塔东路项目（HB-2016060）,无为县无城镇王福村，福渡镇沙湾村、福渡社区,23.234900,5.768200,街巷用地,划拨,,国家机构,二级,0.0000,,,,2016年12月30日,2017年11月30日,2019年11月30日,,,无为县人民政府,2016年11月30日
上海市本级,3101002016B18300,青浦区徐泾镇徐南路北侧08-04地块,_____青浦区徐泾镇_______,0.832030,0.000000,其他普通商品住房用地,挂牌出让,70,房地产业,八级,60000.0000,上海骏博房地产开发有限公司,1.00,0.00,2017年02月01日,2018年02月01日,2019年02月01日,,,青浦区,2016年11月30日
界首市,3412822016B00438,界首市城乡建设有限公司,位于规划连后楼路东侧、规划龚庄西路西侧、复兴路南侧、规划莲蒲路北侧,6.352326,0.000000,中低价位、中小套型普通商品住房用地,挂牌出让,70,房地产业,三级,10600.0000,界首市城乡建设有限公司,1.00,1.83,2017年01月08日,2017年01月30日,2019年01月30日,,,界首市,2016年11月30日
南宁市本级,4501002016A29485,广西体育教科训一体化基地项目（一期）,玉洞大道北侧、稔水路东侧,6.506963,0.000000,文体娱乐用地,划拨,,体育,五级,8081.6480,,1.00,2.00,2016年11月30日,2017年11月30日,2020年11月30日,,,南宁市人民政府,2016年11月30日
汤原县,2308282016B00339,学府新城三期,汤原镇大米河以东、华胜街以西,0.097400,0.097400,其他普通商品住房用地,挂牌出让,其他商服用地40年; 其他普通商品住房用地70年;,房地产业,二级,25.5900,佳木斯鸿森房地产开发有限公司,1.00,1.87,2017年04月25日,2017年05月25日,2019年05月25日,,,汤原县,2016年11月30日
湘乡市,4303812016B01829,张伯仁、廖莲娥个人住宅,昆办东山路34号02栋406,0.001165,0.001165,其他普通商品住房用地,协议出让,70,房地产业,二级,1.1410,张伯仁、廖莲娥,,,,,,,,湘乡市,2016年11月30日
海口市本级,4601002016B01761,海南成信房地产开发有限公司,滨江西路以西白沙坊棚户区改造项目A0209,1.213824,1.213824,中低价位、中小套型普通商品住房用地,拍卖出让,中低价位、中小套型普通商品住房用地70年; 批发零售用地40年;,房地产业,三级,11124.6970,海南成信房地产开发有限公司,1.00,4.70,2016年12月30日,2017年12月30日,2019年12月30日,,,海口市,2016年11月30日
濉溪县,3406212016B00411,韩村镇马店幸福家园,韩村镇基地北路南侧,2.065525,0.000000,经济适用住房用地,协议出让,70,房地产业,六级,707.0000,濉溪县韩村镇人民政府,1.00,1.30,2016年12月30日,2017年01月30日,2018年07月30日,,,濉溪县,2016年11月30日
中牟县,4101222016A03872,机西高速,中牟县境内,0.180200,0.000000,公路用地,划拨,,国家机构,十二级,,,,1.00,2016年12月30日,2017年01月01日,2019年01月01日,,,中牟县人民政府,2016年11月30日
浏阳市,4301812016B03157,重型机械标准化二厂房建设项目,浏阳市经开区经七路东侧、纬一路南侧、经八路西侧、319国道北侧,7.202539,0.000000,工业用地,挂牌出让,50,通用设备制造业,十级,2507.0000,浏阳市工业新城建设开发有限公司,1.00,1.50,2016年11月30日,2017年11月01日,2019年11月01日,,,浏阳市,2016年11月30日
浏阳市,4301812016B03469,50KW灯泡贯流水轮发电机组项目,浏阳高新区永裕北路西侧、鼎盛路北侧,4.420317,0.000000,工业用地,挂牌出让,50,通用设备制造业,十级,1620.0000,浏阳鼎盛投资有限公司,1.00,1.50,2016年11月30日,2017年11月01日,2019年11月01日,,,浏阳市,2016年11月30日
益阳市本级,4309002016B39644,袁正端国有划拨用地使用权出让,金山西路南侧、水箱厂北侧,0.001160,0.001160,中低价位、中小套型普通商品住房用地,协议出让,70,房地产业,二级,0.1064,袁正端,,,2016年11月30日,,,,,益阳市,2016年11月30日
永定区,4308022016B02121,徐建华,崇文办事处凤湾居委会土门岗,0.011790,0.011790,其他普通商品住房用地,协议出让,70,房地产业,一级,8.6710,徐建华,0.00,0.00,,,,,,张家界市,2016年11月30日
中牟县,4101222016A03918,机西高速,中牟县境内,0.434600,0.000000,公路用地,划拨,,国家机构,十二级,,,,1.00,2016年12月30日,2017年01月01日,2019年01月01日,,,中牟县人民政府,2016年11月30日
江口县,5222222016B00059,江口县城兴隆片区B0702地块,江口县双江街道兴隆村高速公路收费站北侧,3.498900,0.000000,中低价位、中小套型普通商品住房用地,挂牌出让,中低价位、中小套型普通商品住房用地70年; 批发零售用地40年;,房地产业,三级,1210.0000,江口鑫达房地产开发有限公司,1.00,1.50,2017年01月29日,2017年03月30日,2019年03月30日,,,江口县,2016年11月30日
镇平县,4113242016B00315,2016-029号,工业路西延与玉神路交叉口,6.090780,0.000000,其他商服用地,挂牌出让,40,教育业,三级,5800.0000,镇平县鼎诚教育文化投资有限公司,,1.00,2017年03月02日,2018年03月02日,2021年03月02日,,,镇平县人民政府,2016年11月30日
大竹县,5117242016B00556,DZG194,大竹县经济开发区,2.860900,0.000000,工业用地,挂牌出让,50,纺织服装、鞋、帽制造业,四级,466.0000,四川蓝博兴科技有限公司,1.00,,2017年03月17日,2018年03月17日,2021年03月17日,,,大竹县,2016年11月30日
肇源县,2306222016B00880,徐百涛商业用地,肇源镇,0.000504,0.000504,批发零售用地,协议出让,40,零售业,十三等级,0.6200,徐百涛,1.00,7.50,2016年12月07日,,,,,肇源县,2016年11月30日
迁安市,1302832016A00485,彭店子乡农民保障房项目,彭店子乡彭店子村,2.449800,0.000000,经济适用住房用地,划拨,,房地产业,十级,556.1046,,1.00,1.40,2016年11月30日,2017年11月06日,2019年11月05日,,,迁安市人民政府,2016年11月30日
中牟县,4101222016A03920,机西高速,中牟县境内,0.003600,0.000000,公路用地,划拨,,国家机构,十二级,,,,1.00,2016年12月30日,2017年01月01日,2019年01月01日,,,中牟县人民政府,2016年11月30日
贾汪区,3203052016B00684,徐州潘安湖建设发展有限公司,贾汪区310国道南侧、权台矿北门东侧、徐州市高邦化纤有限公司北侧,6.639800,3.259600,中低价位、中小套型普通商品住房用地,挂牌出让,70,房地产业,未评估地区,3984.0000,徐州潘安湖建设发展有限公司,1.00,1.40,2017年05月01日,2017年12月01日,2019年11月30日,,,徐州市贾汪区人民政府,2016年11月30日
上高县,3609232016A00690,基础设施,五里岭,0.398614,0.000000,公共设施用地,划拨,,国家机构,五级,,,,,2017年03月15日,2017年06月15日,2020年06月15日,,,上高县人民政府,2016年11月30日
五莲县,3711212016B00847,王云国,县城济南路以南、县委党校以北,0.003793,0.003793,其他普通商品住房用地,挂牌出让,70,房地产业,未评估地区,4.1000,王云国,,,2016年11月30日,,,,,五莲县,2016年11月30日
淮南市本级,3404002016B00945,中铁四局置业（淮南）有限公司,高新区（山南新区）高塘湖路东侧、民惠街南侧,15.048965,14.369346,其他普通商品住房用地,拍卖出让,70,房地产业,一级,31900.0000,中铁四局置业（淮南）有限公司,1.00,1.30,2016年12月30日,2017年11月25日,2020年11月25日,,,淮南市,2016年11月30日
平凉市本级,6208002016B00324,中心城区棚户区新生巷南片区改造地块二和地块三项目用地,东起市公安局家属院、西至平凉监狱、南至南环路、北至盛和嘉园（地块二和地块三））,1.247339,1.247339,其他普通商品住房用地,挂牌出让,70,房地产业,二级,5238.8000,平凉市市直房地产开发公司,1.10,5.00,2016年12月15日,2017年03月30日,2018年03月30日,,,平凉市,2016年11月30日
固安县,1310222016B00758,固安茂悦房地产开发有限公司项目用地,东环路西侧,5.690452,0.000000,其他普通商品住房用地,招标出让,70,房地产业,二级,4651.0000,固安茂悦房地产开发有限公司,1.30,2.00,2016年12月30日,2017年12月30日,2020年12月29日,,,固安县,2016年11月30日
全南县,3607292016A00257,全南县城管局工业大道垃圾中转站项目,全南县工业园二区工业大道旁边,0.178641,0.178641,公共设施用地,划拨,,公共设施管理业,十五等级,0.0000,,0.00,0.00,2015年11月17日,2017年01月01日,2018年01月01日,,,全南县人民政府,2016年11月30日
辽阳市本级,2110002016A00350,辽阳市铝合金精深加工产业基地起步区路网（一期）工程,河东新城罗大台镇,6.234846,0.000000,街巷用地,划拨,,房地产业,未评估地区,,,,,2016年12月31日,2017年07月31日,2019年07月30日,,,辽阳市人民政府,2016年11月30日
松滋市,4210872016B03598,刘兴龙,新江口镇玉岭社区,0.014420,0.014420,中低价位、中小套型普通商品住房用地,协议出让,20,建筑业,二级,2.5384,刘兴龙,0.00,0.00,2016年12月30日,,,,,松滋市,2016年11月30日
建昌县,2114222016A00150,建昌县黑山科乡中心幼儿园学生宿舍楼,建昌县黑山科小学院内南侧,0.431700,0.000000,科教用地,划拨,,教育业,三级,,,0.50,1.00,,,,,,建昌县人民政府,2016年11月30日
海城市,2103812016A00601,腾鳌镇中心幼儿园,海城市腾鳌镇福安村,0.504900,0.504900,科教用地,划拨,,教育业,四级,,,0.60,0.90,2017年01月30日,2017年05月01日,2020年04月30日,,,鞍山腾鳌经济开发区管委会,2016年11月30日
安康市本级,6109002016B00778,岚皋县飞地经济环保产业园发展有限公司,高新十一路西侧,0.397756,0.000000,工业用地,挂牌出让,50,制造业,五级,266.0000,岚皋县飞地经济环保产业园发展有限公司,1.00,,2016年12月15日,2017年03月15日,2019年03月15日,,,安康市,2016年11月30日
临川区,3610022016B01455,综合物流园,临川区展坪乡马家村,20.068400,0.000000,工业用地,挂牌出让,50,仓储业,五级,2930.0000,抚州中物宝特物流有限公司,1.00,1.50,2016年12月30日,2017年02月22日,2019年02月22日,,,临川区,2016年11月30日
隆安县,4501232016B00639,转让后不改变用途划拨土地补办出让,隆安县雁江镇雁江村塘埔屯118号,0.004554,0.004554,其他普通商品住房用地,协议出让,70,房地产业,三级,1.3800,余彦、曾丽平,1.00,3.50,2016年12月30日,,,,,隆安县,2016年11月30日
