行政区,电子监管号,项目名称,项目位置,面积(公顷),土地来源,土地用途,供地方式,土地使用年限,行业分类,土地级别,成交价格(万元),土地使用权人,约定容积率下限,约定容积率上限,约定交地时间,约定开工时间,约定竣工时间,实际开工时间,实际竣工时间,批准单位,合同签订日期
台前县,4109272016B00129,河南台前农村商业银行股份有限公司,台前县打渔陈镇人民政府南侧、打渔陈村集体土地西侧,0.252401,0.000000,其他商服用地,挂牌出让,40,银行业,一级,114.0000,河南台前农村商业银行股份有限公司,,2.00,2017年01月30日,2017年03月30日,2019年03月30日,,,台前县,2016年11月30日
印江土家族苗族自治县,5222262016A00228,新寨镇敬老院,新寨镇集镇,0.343400,0.000000,公共设施用地,划拨,,社会保障业,十五等级,,,1.00,,2017年02月20日,2017年05月20日,2019年05月20日,,,印江自治县人民政府,2016年11月30日
银川市本级,6401002016B01989,宁夏新材房地产开发有限公司,金凤区九号路东侧、六号路北侧,4.190987,0.085500,其他普通商品住房用地,挂牌出让,其他普通商品住房用地70年; 批发零售用地40年;,房地产业,三级,4590.0000,宁夏新材房地产开发有限公司,1.00,2.50,2016年12月18日,,,,,银川市,2016年11月30日
汝南县,4117272016A00100,汝宁大街,汝宁大街,3.273400,0.000000,公路用地,划拨,,国家机构,三级,,,,,2017年03月15日,2017年12月29日,2019年06月27日,,,汝南县人民政府,2016年11月30日
镇平县,4113242016B00297-1,2016-026号,南环路西段北侧,2.718990,0.000000,其他商服用地,挂牌出让,40,国家机构,四级,2900.0000,镇平县城建投资有限公司,,1.50,2017年03月02日,2018年03月02日,2021年03月02日,,,镇平县人民政府,2016年11月30日
克什克腾旗,1504252016B00464,赤峰市天润鑫能新能源有限公司克什克腾旗新开地风电场4.8万千瓦风电项目,克什克腾旗新开地乡新开地村,3.819100,0.000000,工业用地,挂牌出让,50,电力、热力的生产和供应业,十五等级,137.4876,赤峰市天润鑫能新能源有限公司,0.00,0.54,2016年12月01日,2017年11月30日,2020年11月30日,,,克什克腾旗,2016年11月30日
辽阳市本级,2110002016A00347,储备项目一,河东新城中轴,28.469140,0.000000,空闲地,划拨,,中国共产党机关,未评估地区,,,,,,,,,,辽阳市人民政府,2016年11月30日
永年县,1304292016B00585,工业用地,永合会镇娄里村南,2.160136,0.000000,工业用地,挂牌出让,50,金属制品业,未评估地区,573.0000,河北永洋特钢集团有限公司,0.80,,2016年11月30日,2017年11月28日,2019年11月27日,,,邯郸市永年区,2016年11月30日
平果县,4510232016B01337,马头镇金山路旁（巴仲屯西侧）A块用地,平果县马头镇金山路旁（巴仲屯西侧）A块用地,0.798634,0.000000,其他普通商品住房用地,挂牌出让,其他普通商品住房用地70年; 批发零售用地40年;,其它,二级,874.5042,平果县交通投资有限责任公司,1.00,3.00,2017年11月30日,2018年11月30日,2021年11月30日,,,平果县,2016年11月30日
翼城县,1410222016A00084,翼城县城西沟城市绿地建设项目,唐兴镇西关村、陵下村、城内村、世家庄村,11.872900,0.000000,公园与绿地,划拨,,公共设施管理业,未评估地区,,,,,,,,,,翼城县人民政府,2016年11月30日
宿松县,3408262016A01148,宿松县洲头乡官洲村美好乡村,宿松县洲头乡官洲村,0.193630,0.000000,公园与绿地,划拨,,国家机构,未评估地区,,,,,,,,,,宿松县人民政府,2016年11月30日
怀化市本级,4312002016B02110,住宅,怀化市太平桥市场,0.087830,0.001259,其他普通商品住房用地,协议出让,70,房地产业,一级,0.3539,赵正杰,,,,,,,,怀化市,2016年11月30日
什邡市,5106822016A00512,什邡市回澜镇敬老院,什邡市回澜镇鱼桥村12组,0.381210,0.381210,医卫慈善用地,划拨,,社会福利业,十二级,0.0000,,,1.00,,,,,,什邡市人民政府,2016年11月30日
衡东县,4304242016B00518,衡东县年产5000吨茶油加工厂和年加工10000吨农业有机肥建设项目打捆,衡东县吴集镇五里坪村,8.899900,0.000000,工业用地,挂牌出让,50,农副食品加工业,十二级,1664.2813,湖南恒建农林综合开发有限公司,1.00,,2016年12月20日,2016年12月30日,2018年12月20日,,,衡东县,2016年11月30日
滕州市,3704812016A00515,第二实验小学新校扩建项目,三里河街南侧、振兴南路以东,2.662200,0.000000,科教用地,划拨,,教育业,未评估地区,0.0000,,0.60,,2017年03月02日,2017年06月02日,2019年06月01日,,,滕州市人民政府,2016年11月30日
辽阳市本级,2110002016A00393,储备项目三,河东新城迎水岛,42.318300,0.000000,空闲地,划拨,,中国共产党机关,未评估地区,,,,,,,,,,辽阳市人民政府,2016年11月30日
长白朝鲜族自治县,2206232016B02047,房产13号楼,长白镇中兴委,0.113025,0.001076,其他普通商品住房用地,协议出让,70,房地产业,一级,0.1367,尹文良,1.10,,,,,,,长白县,2016年11月30日
资兴市,4310812016B03072,住宅,资兴市唐洞矿17村3栋,0.048754,0.001366,其他普通商品住房用地,协议出让,69,住宿业,三级,0.1299,钟美纯,,,2016年11月30日,,,,,资兴市,2016年11月30日
弥渡县,5329252016B00477,弥城镇政府2号铺面,弥渡县弥城镇建设路,0.000595,0.000595,批发零售用地,拍卖出让,40,零售业,一级,45.9149,李银兰,,,2016年12月31日,,,,,弥渡县人民政府,2016年11月30日
永年县,1304292016B00726,工业用地,明珠大街东侧（农产品园区内）,1.912647,0.000000,工业用地,挂牌出让,50,林业,一级,546.0000,邯郸市丽景园林绿化工程有限公司,1.10,,2016年11月30日,2017年11月28日,2019年11月27日,,,邯郸市永年区,2016年11月30日
平凉市本级,6208002016B00324,中心城区棚户区新生巷南片区改造地块二和地块三项目用地,东起市公安局家属院、西至平凉监狱、南至南环路、北至盛和嘉园（地块二和地块三））,1.247339,1.247339,其他普通商品住房用地,挂牌出让,70,房地产业,二级,5238.8000,平凉市市直房地产开发公司,1.10,5.00,2016年12月15日,2017年03月30日,2018年03月30日,,,平凉市,2016年11月30日
白沙黎族自治县,4690252016A00263,田径运动场,海南省白沙黎族自治县牙叉镇环城东路东北侧,8.237186,0.000086,文体娱乐用地,划拨,,体育,二级,,,0.00,,2016年11月30日,2017年11月30日,2019年11月30日,,,白沙黎族自治县人民政府,2016年11月30日
锡林郭勒盟本级,1525002016B00132,杨航个人自拆自建工程,哈拉盖图农牧场通霍林郭勒路东侧,0.105280,0.105280,住宿餐饮用地,协议出让,40,住宿业,二级,6.8432,杨航,0.10,0.40,2016年11月30日,2017年06月20日,2018年12月30日,,,锡林郭勒盟,2016年11月30日
永定区,4308022016B02071,秦兴英,永定办事处解放路23号,0.001936,0.001936,其他普通商品住房用地,协议出让,70,房地产业,一级,0.8404,秦兴英,0.00,0.00,,,,,,张家界市,2016年11月30日
永年县,1304292016B00606,工业用地,永合会镇娄里村南,1.077975,0.000000,工业用地,挂牌出让,50,金属制品业,未评估地区,286.0000,河北永洋特钢集团有限公司,0.80,,2016年11月30日,2017年11月28日,2019年11月27日,,,邯郸市永年区,2016年11月30日
印江土家族苗族自治县,5222262016A00302,交通局物资储备中心,印江自治县中兴街道办事处蔓袍村,0.824800,0.000000,仓储用地,划拨,,国家机构,十五等级,,,0.50,,2017年03月01日,2017年06月01日,2019年06月01日,,,印江自治县人民政府,2016年11月30日
长丰县,3401212016B01745,环压式薄壁不锈钢节能管材、管件生产项目,水湖镇,3.671100,0.000000,工业用地,挂牌出让,50,通用设备制造业,十一级,583.7049,长丰县水湖镇城市建设投资有限公司,1.00,,2016年12月30日,2017年03月01日,2018年03月01日,,,长丰县,2016年11月30日
安康市本级,6109002016B00810,安康市高新区勇华商混有限责任公司,创新一路南侧罗家粱村,3.130243,0.000000,工业用地,挂牌出让,50,批发和零售业,二级,1810.0000,安康市高新区勇华商混有限责任公司,1.00,,2016年12月31日,2017年04月30日,2019年04月30日,,,安康市,2016年11月30日
贺州市本级,4511002016A02410,洛湛铁路建设项目拆迁安置户,平桂管理区黄田镇黄田新区回建点57号,0.012000,0.000000,其他普通商品住房用地,划拨,,房地产业,未评估地区,0.0695,,1.00,,2017年03月06日,2017年12月06日,2019年12月06日,,,贺州市人民政府,2016年11月30日
永年县,1304292016B00654,工业用地,永合会镇娄里村南,6.541605,0.000000,工业用地,挂牌出让,50,金属制品业,未评估地区,1735.0000,河北永洋特钢集团有限公司,0.80,,2016年11月30日,2017年11月28日,2019年11月27日,,,邯郸市永年区,2016年11月30日
疏勒县,6531222016B00059,紫竹明城小区二期,疏勒县双拥广场西侧,0.933765,0.933765,其他普通商品住房用地,挂牌出让,70,房地产业,一级,533.4787,新疆亚成远畅房地产开发有限公司,1.80,2.60,2016年11月13日,2016年11月14日,2018年11月13日,,,疏勒县,2016年11月30日
印江土家族苗族自治县,5222262016A00184,紫薇镇旅游接待中心,紫薇镇集镇坝上,1.391300,0.000000,风景名胜设施用地,划拨,,国家机构,十五等级,,,1.00,,2017年01月10日,2017年03月10日,2018年03月09日,,,印江自治县人民政府,2016年11月30日
前郭尔罗斯蒙古族自治县,2207212016B00682,商业楼,查干花镇,0.009600,0.009600,批发零售用地,挂牌出让,40,商务服务业,未评估地区,4.4832,姜洪泰,0.00,1.80,2016年11月30日,2017年05月01日,2019年05月01日,,,前郭县,2016年11月30日
永定区,4308022016B02068,张卫,崇文办事处北正街6号,0.002634,0.002634,其他普通商品住房用地,协议出让,70,房地产业,一级,1.1434,张卫,0.00,0.00,,,,,,张家界市,2016年11月30日
无为县,3414222016A03844,安置点项目项目（HB-2016093）,无为县泥汊镇日新村,8.333300,0.000000,经济适用住房用地,划拨,,国家机构,二级,0.0000,,1.00,1.50,2016年12月30日,2017年11月30日,2019年11月30日,,,无为县人民政府,2016年11月30日
中江县,5106232016B01861,中江县黄鹿镇响石街42号,中江县黄鹿镇响石街42号,0.006683,0.006683,其他普通商品住房用地,协议出让,其他普通商品住房用地70年; 批发零售用地40年;,居民服务业,十四等级,2.0574,杨成孝,1.00,0.00,2016年11月30日,,,,,中江县,2016年11月30日
浏阳市,4301812016B03148,重型机械标准化一厂房建设项目,浏阳市经开区经七路东侧、纬一路南侧、经八路西侧、319国道北侧,10.994518,0.000000,工业用地,挂牌出让,50,通用设备制造业,十级,3827.0000,浏阳市工业新城建设开发有限公司,1.00,1.50,2016年11月30日,2017年11月01日,2019年11月01日,,,浏阳市,2016年11月30日
前郭尔罗斯蒙古族自治县,2207212016B00678,商业楼,查干花镇,0.011800,0.011800,批发零售用地,挂牌出让,40,商务服务业,未评估地区,5.4752,鲍玉民,0.00,1.50,2016年11月30日,2017年05月01日,2019年05月01日,,,前郭县,2016年11月30日
泰兴市,3212832016B01649,泰兴市中天物流有限公司,根思乡井坔村前进一组,0.201400,0.000000,仓储用地,挂牌出让,50,道路运输业,六级,84.5880,泰兴市中天物流有限公司,0.80,2.50,2017年11月30日,2018年05月30日,2019年11月30日,,,泰兴市人民政府,2016年11月30日
泰兴市,3212832016B01664,泰兴市海诚物流有限公司,虹桥镇上元村元垡、元西组,1.282700,0.000000,工业用地,挂牌出让,50,道路运输业,六级,513.0800,泰兴市海诚物流有限公司,0.80,,2017年11月30日,2018年05月30日,2019年11月30日,,,泰兴市人民政府,2016年11月30日
贾汪区,3203052016B00649,梁静,贾汪区泉涯路南侧、原东方公司办公楼,0.565700,0.565700,中低价位、中小套型普通商品住房用地,挂牌出让,其他商服用地40年，中低价位、中小套型普通商品住房用地70年,房地产业,未评估地区,1453.0000,梁静,1.40,2.40,2017年06月01日,2017年12月01日,2019年11月30日,,,徐州市贾汪区人民政府,2016年11月30日
泰兴市,3212832016B01679,江苏锦城建设有限公司,济川街道办燕头村文五组、中陈组,0.187100,0.000000,仓储用地,挂牌出让,50,房屋和土木工程业,六级,85.1305,江苏锦城建设有限公司,0.80,2.50,2017年11月30日,2018年05月30日,2019年11月30日,,,泰兴市人民政府,2016年11月30日
泰兴市,3212832016B01658,泰兴市华锦建筑安装工程有限公司,根思乡井坔村前进一组,0.065300,0.000000,仓储用地,挂牌出让,50,建筑安装业,六级,27.4260,泰兴市华锦建筑安装工程有限公司,0.80,2.50,2017年11月30日,2018年05月30日,2019年11月30日,,,泰兴市人民政府,2016年11月30日
泰兴市,3212832016B01683,泰兴市泰华汽车危险品运输有限公司,虹桥镇四仙村如意组,0.417300,0.000000,工业用地,挂牌出让,50,道路运输业,六级,166.9200,泰兴市泰华汽车危险品运输有限公司,0.80,,2017年11月30日,2018年05月30日,2019年11月30日,,,泰兴市人民政府,2016年11月30日
泰兴市,3212832016B01702,泰兴市泰源水带厂,根思乡集体,0.242100,0.000000,工业用地,挂牌出让,50,橡胶制品业,六级,91.9980,泰兴市泰源水带厂,0.80,,2017年11月30日,2018年05月30日,2019年11月30日,,,泰兴市人民政府,2016年11月30日
泰兴市,3212832016B01698,泰兴龙溢端子有限公司,根思乡集体,0.422700,0.000000,工业用地,挂牌出让,50,金属制品业,六级,160.6260,泰兴龙溢端子有限公司,0.80,,2017年11月30日,2018年05月30日,2019年11月30日,,,泰兴市人民政府,2016年11月30日
浏阳市,4301812016B03446,永安集镇开发10号地块,浏阳高新区株陵河东侧、永泰路北侧,1.408590,0.000000,其他商服用地,挂牌出让,40,房地产业,十级,2573.0000,浏阳鼎盛投资有限公司,3.00,4.00,2016年11月30日,2017年11月01日,2019年11月01日,,,浏阳市,2016年11月30日
固安县,1310222016B00720,廊坊市保利房地产开发有限公司项目用地,北环路南侧,1.847315,0.000000,其他普通商品住房用地,招标出让,70,房地产业,二级,1715.0000,廊坊市保利房地产开发有限公司,1.30,2.50,2016年12月30日,2017年12月30日,2020年12月29日,,,固安县,2016年11月30日
印江土家族苗族自治县,5222262016A00366,移民安置用地,中兴街道办事处中坝村,1.140200,0.000000,公共租赁住房用地,划拨,,国家机构,十五等级,,,1.00,1.50,2017年02月20日,2017年05月20日,2019年05月20日,,,印江自治县人民政府,2016年11月30日
中牟县,4101222016A03888,机西高速,中牟县境内,3.504500,0.000000,公路用地,划拨,,国家机构,十二级,,,,1.00,2016年12月30日,2017年01月01日,2019年01月01日,,,中牟县人民政府,2016年11月30日
哈密市,6522012016B10755,哈密金得利房地产开发有限公司住宅小区建设项目,西区六一路以西、新民六路以南、纬五路以北、经六路以东,2.003960,0.000000,其他普通商品住房用地,挂牌出让,70,房地产业,二级,961.3800,哈密金得利房地产开发有限公司,1.00,2.70,2016年12月09日,2016年12月14日,2018年12月13日,,,哈密市,2016年11月30日
浏阳市,4301812016B03157,重型机械标准化二厂房建设项目,浏阳市经开区经七路东侧、纬一路南侧、经八路西侧、319国道北侧,7.202539,0.000000,工业用地,挂牌出让,50,通用设备制造业,十级,2507.0000,浏阳市工业新城建设开发有限公司,1.00,1.50,2016年11月30日,2017年11月01日,2019年11月01日,,,浏阳市,2016年11月30日
汉中市本级,6107002016A03626,（代征道路）汉中朝阳机械有限责任公司,汉台区铺镇工业园区,0.872100,0.000000,街巷用地,划拨,,国家机构,七级,,,,,,,,,,汉中市人民政府,2016年11月30日
弥渡县,5329252016B00435,弥城镇政府6号铺面,弥渡县弥城镇建设路,0.000560,0.000560,批发零售用地,拍卖出让,40,批发业,一级,60.1398,马联生,,,2016年12月31日,,,,,弥渡县人民政府,2016年11月30日
亳州市本级,3416002016B01635-1,亳州粤诚置业有限公司,仙翁路以东、希夷大道以西,14.040570,0.000000,其他普通商品住房用地,挂牌出让,其他普通商品住房用地70年; 其他商服用地40年;,房地产业,三级,38000.0000,亳州粤诚置业有限公司,1.00,2.20,2017年03月07日,2017年03月17日,2020年03月17日,,,亳州市,2016年11月30日
马鞍山市本级,3405002016B00477,慈湖河路与葛羊路交叉口东北角地块,东、北至空地、南至规划路、西至慈湖河路,0.505748,0.297069,其他商服用地,挂牌出让,40,零售业,四级,2230.0000,马鞍山市慈河石化贸易有限公司,,0.80,2016年12月21日,2017年04月21日,2018年04月21日,,,马鞍山市,2016年11月30日
鹿泉市,1301852016A00636,道路,上庄镇台头村,0.049452,0.000000,公路用地,划拨,,中国共产党机关,九级,0.0000,,,,,,,,,石家庄市鹿泉区人民政府,2016年11月30日
汝南县,4117272016A00137,李愬路,李愬路,0.472700,0.000000,公路用地,划拨,,国家机构,三级,,,,,2017年03月16日,2017年11月30日,2018年11月30日,,,汝南县人民政府,2016年11月30日
郑州市本级,4101002016B19721,天迈剩余,新港十一路南、新港大道西,0.167170,0.000000,工业用地,挂牌出让,50,通讯设备、计算机及其他电子设备制造业,十二级,56.0000,河南天迈科技有限公司,1.00,2.00,2017年02月28日,2017年11月29日,2019年11月28日,,,郑州航空港经济综合实验区管理委员会、新郑市,2016年11月30日
永城市,4114812016A00307,蓝色港湾安置社区项目用地,龙宇大道东侧、城郊铁路专用线北侧,8.875200,0.000000,其他普通商品住房用地,划拨,,房地产业,十二级,1426.3473,,1.00,1.97,2017年01月17日,2017年04月17日,2020年01月17日,,,永城市人民政府,2016年11月30日
印江土家族苗族自治县,5222262016A00302,交通局物资储备中心,印江自治县中兴街道办事处蔓袍村,0.824800,0.000000,仓储用地,划拨,,国家机构,十五等级,,,0.50,,2017年03月01日,2017年06月01日,2019年06月01日,,,印江自治县人民政府,2016年11月30日
建昌县,2114222016A00150,建昌县黑山科乡中心幼儿园学生宿舍楼,建昌县黑山科小学院内南侧,0.431700,0.000000,科教用地,划拨,,教育业,三级,,,0.50,1.00,,,,,,建昌县人民政府,2016年11月30日
鄂托克旗,1506242016A00300,棋盘井镇镇区道路及配套管网工程建设项目（健民路）,棋盘井镇,0.292600,0.292600,街巷用地,划拨,,城市公共交通业,十五等级,0.0000,,0.00,0.00,2016年11月30日,2017年04月27日,2017年12月31日,,,鄂托克旗人民政府,2016年11月30日
上海市本级,3101002016B17728,松江区车墩镇南站大型居住社区C18-43-01号地块,松江区车墩镇,14.598290,0.000000,中低价位、中小套型普通商品住房用地,挂牌出让,70,房地产业,八级,83547.0000,农工商房地产集团上海汇德置业有限公司,1.00,,2017年01月20日,2017年11月20日,2020年11月20日,,,松江区,2016年11月30日
衡东县,4304242016B00518,衡东县年产5000吨茶油加工厂和年加工10000吨农业有机肥建设项目打捆,衡东县吴集镇五里坪村,8.899900,0.000000,工业用地,挂牌出让,50,农副食品加工业,十二级,1664.2813,湖南恒建农林综合开发有限公司,1.00,,2016年12月20日,2016年12月30日,2018年12月20日,,,衡东县,2016年11月30日
克什克腾旗,1504252016B00464,赤峰市天润鑫能新能源有限公司克什克腾旗新开地风电场4.8万千瓦风电项目,克什克腾旗新开地乡新开地村,3.819100,0.000000,工业用地,挂牌出让,50,电力、热力的生产和供应业,十五等级,137.4876,赤峰市天润鑫能新能源有限公司,0.00,0.54,2016年12月01日,2017年11月30日,2020年11月30日,,,克什克腾旗,2016年11月30日
浏阳市,4301812016B03469,50KW灯泡贯流水轮发电机组项目,浏阳高新区永裕北路西侧、鼎盛路北侧,4.420317,0.000000,工业用地,挂牌出让,50,通用设备制造业,十级,1620.0000,浏阳鼎盛投资有限公司,1.00,1.50,2016年11月30日,2017年11月01日,2019年11月01日,,,浏阳市,2016年11月30日
大渡口区,5001042016A00327,大渡口金建路,大渡口区八桥镇民乐村,6.474490,0.408770,街巷用地,划拨,,其他服务业,四级,12199.0000,,,,2017年04月01日,2017年06月30日,2018年06月30日,,,重庆市人民政府,2016年11月30日
怀化市本级,4312002016B02086,住宅,怀化市迎丰西路,0.065527,0.001639,其他普通商品住房用地,协议出让,70,房地产业,一级,1.5471,尹承荣,,,,,,,,怀化市,2016年11月30日
水富县,5306302016B00840,杨同林,云富街道办事处盐丰小区,0.002021,0.002021,其他普通商品住房用地,协议出让,40,房屋和土木工程业,二级,0.9701,杨同林,,,2016年11月30日,,,,,水富县,2016年11月30日
浏阳市,4301812016B03148,重型机械标准化一厂房建设项目,浏阳市经开区经七路东侧、纬一路南侧、经八路西侧、319国道北侧,10.994518,0.000000,工业用地,挂牌出让,50,通用设备制造业,十级,3827.0000,浏阳市工业新城建设开发有限公司,1.00,1.50,2016年11月30日,2017年11月01日,2019年11月01日,,,浏阳市,2016年11月30日
前郭尔罗斯蒙古族自治县,2207212016B00678,商业楼,查干花镇,0.011800,0.011800,批发零售用地,挂牌出让,40,商务服务业,未评估地区,5.4752,鲍玉民,0.00,1.50,2016年11月30日,2017年05月01日,2019年05月01日,,,前郭县,2016年11月30日
东西湖区,4201122016B00857,武汉航空港互联网+金融产业园,金银湖南一街以南、金银湖西路以西,3.959370,3.959370,商务金融用地,挂牌出让,40,住宿和餐饮业,六级,32652.2727,武汉华生制冷工业有限责任公司,,5.50,2017年02月27日,2017年11月29日,2019年11月28日,,,东西湖区,2016年11月30日
合川区,5001172016B03028,公共交通场站、公用设施营业网点,合川区合阳城街道北环路延伸段北侧,3.668000,1.134700,公共设施用地,挂牌出让,50,城市公共交通业,十一级,3065.6777,重庆由甲公交客运站场建设有限公司、重庆臻惠石油有限公司、重庆惠誉燃气有限公司,,1.50,2017年02月28日,2017年06月01日,2019年05月31日,,,合川区,2016年11月30日
利川市,4228022016B00495,利川简雅置业有限公司,都亭办事处木栈村、普庵村,6.666700,0.000000,其他普通商品住房用地,挂牌出让,70,房地产业,三级,8215.0000,利川简雅置业有限公司,1.00,3.00,2017年11月30日,2017年12月06日,2019年12月06日,,,利川,2016年11月30日
无为县,3414222016A03883,无城镇新上自来水厂项目（HB-2016125）,无为县无城镇官镇村,5.527200,0.000000,公共设施用地,划拨,,国家机构,二级,0.0000,,,,2016年12月30日,2017年11月30日,2019年11月30日,,,无为县人民政府,2016年11月30日
海城市,2103812016A00601,腾鳌镇中心幼儿园,海城市腾鳌镇福安村,0.504900,0.504900,科教用地,划拨,,教育业,四级,,,0.60,0.90,2017年01月30日,2017年05月01日,2020年04月30日,,,鞍山腾鳌经济开发区管委会,2016年11月30日
安康市本级,6109002016B00778,岚皋县飞地经济环保产业园发展有限公司,高新十一路西侧,0.397756,0.000000,工业用地,挂牌出让,50,制造业,五级,266.0000,岚皋县飞地经济环保产业园发展有限公司,1.00,,2016年12月15日,2017年03月15日,2019年03月15日,,,安康市,2016年11月30日
临川区,3610022016B01455,综合物流园,临川区展坪乡马家村,20.068400,0.000000,工业用地,挂牌出让,50,仓储业,五级,2930.0000,抚州中物宝特物流有限公司,1.00,1.50,2016年12月30日,2017年02月22日,2019年02月22日,,,临川区,2016年11月30日
隆安县,4501232016B00639,转让后不改变用途划拨土地补办出让,隆安县雁江镇雁江村塘埔屯118号,0.004554,0.004554,其他普通商品住房用地,协议出让,70,房地产业,三级,1.3800,余彦、曾丽平,1.00,3.50,2016年12月30日,,,,,隆安县,2016年11月30日
水富县,5306302016B00791,周强,云富街道办事处人民东路,0.002138,0.002138,其他普通商品住房用地,协议出让,70,房屋和土木工程业,一级,1.5351,周强,,,2016年11月30日,,,,,水富县,2016年11月30日
化德县,1509222016A00103,化德县地方税务局办公楼,长春大街北，服装公司东,0.772000,0.772000,机关团体用地,划拨,,国家机构,一级,,,0.70,0.70,2016年08月01日,2017年03月01日,2017年12月31日,,,化德县人民政府,2016年11月30日
裕民县,6542252016A00375,裕民县单位干部职工集资建房建设项目（小高层住宅楼）（许生财等88人）,县发改委办公楼后,0.292500,0.292500,经济适用住房用地,划拨,,居民服务业,二级,4.3875,,1.00,1.00,2010年09月20日,2010年09月20日,2012年09月19日,,,裕民县发改委,2016年11月30日
瓦房店市,2102812016A00330-1,渤海大道一期工程,普湾新区炮台街道域内,23.701400,0.000000,公路用地,划拨,,道路运输业,四级,0.0000,,0.00,0.00,2016年11月30日,2017年12月01日,2020年11月30日,,,大连市人民政府,2016年11月30日
长丰县,3401212016B01665,加气站,岗集镇,0.098667,0.098667,其他普通商品住房用地,拍卖出让,40,零售业,十一级,507.6400,安徽利拓能源有限公司,1.00,0.50,2016年12月30日,2017年04月30日,2017年08月29日,,,长丰县,2016年11月30日
临沂市本级,3713002016A02652,代征道路,河东区东兴路中段西侧,0.094600,0.000000,街巷用地,划拨,,城市公共交通业,四级,0.0000,,,,,,,,,临沂市人民政府,2016年11月30日
