行政区,电子监管号,项目名称,项目位置,面积(公顷),土地来源,土地用途,供地方式,土地使用年限,行业分类,土地级别,成交价格(万元),土地使用权人,约定容积率下限,约定容积率上限,约定交地时间,约定开工时间,约定竣工时间,实际开工时间,实际竣工时间,批准单位,合同签订日期肇东市,2312822013B00506,鸿泰国际商贸城物业办公楼,新北外环路北建筑一公司西回民墓地东,0.243500,0.000000,其他商服用地,挂牌出让,40,房地产业,四级,56.7355,黑龙江鸿泰金成房地产开发有限公司,2.00,2.00,2013年06月30日,2013年06月30日,2015年06月30日,,,肇东市人民政府,2013年04月29日
长葛市,4110822013B01300,长葛市金鑫印刷材料有限公司2013-08#项目用地,溢水路南段北侧,4.283509,0.000000,工业用地,挂牌出让,50,印刷业和记录媒体的复制,二级,603.3772,长葛市金鑫印刷材料有限公司,1.00,,2013年06月19日,2013年12月19日,2016年06月19日,,,长葛市,2013年04月29日
肇东市,2312822013B00497,鸿泰国际商贸城农产品展示区A-1区,新北外环路北建筑一公司西回民墓地东,2.170100,0.000000,其他商服用地,挂牌出让,40,批发业,四级,501.2931,黑龙江鸿泰金成房地产开发有限公司,2.00,2.00,2013年06月30日,2013年06月30日,2015年06月30日,,,肇东市人民政府,2013年04月29日
泊头市,1309812013B00527,安洪波,王武镇后河村地西侧、通泊富路道路东侧,0.220900,0.000000,工业用地,挂牌出让,50,金属制品业,十二级,31.4783,安洪波,1.00,,2013年06月01日,2013年07月19日,2015年07月19日,,,泊头市人民政府,2013年04月29日
尉氏县,4102232013A00030,尉氏县技术教育中心,尉氏县鱼市街南侧,1.263500,0.000000,科教用地,划拨,,教育业,三级,0.0000,,0.60,1.00,2013年04月29日,2013年04月30日,2015年04月30日,,,尉氏县人民政府,2013年04月29日
长葛市,4110822013B00619,河南煜鑫苑置业有限公司2013-12#项目用地,107国道西侧,0.770999,0.000000,其他商服用地,挂牌出让,其他商服用地40年; 其他普通商品住房用地70,房地产业,二级,1309.1669,河南煜鑫苑置业有限公司,3.00,3.50,2013年06月19日,2013年12月19日,2016年06月19日,,,长葛市,2013年04月29日
肇东市,2312822013B00488,鸿泰国际商贸城农产品展示区D-1区,新北外环路北建筑一公司西回民墓地东,2.900800,0.000000,其他商服用地,挂牌出让,40,批发业,四级,562.7552,黑龙江鸿泰金成房地产开发有限公司,1.22,1.22,2013年06月30日,2013年06月30日,2015年06月30日,,,肇东市人民政府,2013年04月29日
84团,6605042013A00062,八十四团廉租房74号住宅楼,84团立国路以南、农贸市场以北,0.140900,0.140900,廉租住房用地,划拨,,房地产业,十四等级,2.1129,,1.63,1.63,2013年05月06日,2013年05月10日,2014年10月31日,,,农五师,2013年04月29日
京山县,4208212013B00184,纸制餐具生产,京山县永隆镇人民路,0.345810,0.345810,工业用地,挂牌出让,50,造纸及纸质品业,三级,34.0000,京山大昌商贸实业有限公司,0.00,0.80,2013年10月29日,2013年10月29日,2015年10月29日,,,京山县,2013年04月29日
扶风县,6103242013B00054,中小企业乳化基地,扶风机械加工园,3.795300,0.000000,工业用地,挂牌出让,50,房屋和土木工程业,一级,853.9500,扶风绛帐工业园开发有限公司,,1.00,2013年04月30日,2013年05月10日,2014年05月30日,,,扶风县,2013年04月29日
天门市,4290062013B00651,卓尔(天门)棉花交易中心投资发展有限公司,天门市小板镇艾台村、罗湖村、王场村,14.193853,0.000000,其他商服用地,挂牌出让,40,其他金融服务,十级,3979.0000,卓尔(天门)棉花交易中心投资发展有限公司,1.80,1.80,2013年09月30日,2013年12月30日,2015年12月30日,,,天门市,2013年04月29日
腾冲县,5305222013B00517,赵绍学城镇混合住宅用地,固东镇固东集镇,0.020860,0.020860,其他商服用地,协议出让,50,房地产业,一级,10.4767,赵绍学,1.00,2.20,2013年04月29日,2013年04月29日,2013年04月29日,,,腾冲县,2013年04月29日
泊头市,1309812013B00516,刘春长,泊头市一号干渠西、武港路南侧,0.129300,0.000000,工业用地,挂牌出让,50,木材加工及木、竹、藤、棕、草制品业,十二级,20.3648,刘春长,1.00,,2013年06月01日,2013年07月19日,2015年07月19日,,,泊头市人民政府,2013年04月29日
金州区,2102132013B00503,得胜居住区邻里中心,得胜居住区,3.603200,0.000000,批发零售用地,挂牌出让,40,零售业,未评估地区,3400.0000,大连得胜邻里物业管理有限公司,,1.00,2013年04月23日,2012年05月01日,2013年10月01日,,,大连市,2013年04月29日
澧县,4307232013B14036,周后元,澧阳镇多安桥居委会,0.014607,0.014607,其他普通商品住房用地,协议出让,40,居民服务业,一级,4.1309,周后元,1.00,1.07,2013年04月29日,1900年01月01日,1900年01月01日,,,澧县,2013年04月29日
京山县,4208212013B00151,面粉加工,京山县永隆镇张家岭村,1.301434,1.301434,工业用地,挂牌出让,50,食品制造业,未评估地区,125.0000,湖北天奇麦面有限公司,0.80,0.80,2013年10月29日,2013年10月29日,2015年10月29日,,,京山县,2013年04月29日
江口县,5222222013B00177-1,江口县太平乡寨抱村石家寨地块出让,江口县太平乡寨抱村石家寨,8.044700,0.000000,住宿餐饮用地,挂牌出让,40,住宿业,三级,1240.0000,江口县亚树旅游投资开发有限公司,0.00,1.20,2013年10月30日,2014年01月30日,2017年01月29日,,,铜仁市,2013年04月29日
关岭布依族苗族自治县,5204242013B00196,2005年关索新区被征地农户安置,关岭自治县关索镇大岩新区,0.009200,0.000000,中低价位、中小套型普通商品住房用地,协议出让,70,住宿业,三级,3.7536,陈光明,1.00,3.00,2013年05月21日,2013年05月22日,2016年05月22日,,,关岭布依族苗族自治县,2013年04月29日
腾冲县,5305222013B00529,杨天德城镇单一住宅用地,腾越镇火山社区邮电小区,0.012632,0.012632,其他普通商品住房用地,协议出让,70,房地产业,一级,35.3696,杨天德,1.50,1.80,2013年04月29日,2013年04月29日,2013年04月29日,,,腾冲县,2013年04月29日
泊头市,1309812013B00504,安淑英,泊头市一号干渠西、武港路南侧,0.182645,0.000000,工业用地,挂牌出让,50,通用设备制造业,十二级,28.7595,安淑英,1.00,,2013年06月01日,2013年07月19日,2015年07月19日,,,泊头市人民政府,2013年04月29日
京山县,4208212013B00161,军品试制中心,京山县新市镇幸福路东侧,2.906200,0.000000,工业用地,挂牌出让,50,纺织服装、鞋、帽制造业,四级,280.0000,湖北华尔靓实业集团有限公司,0.80,0.00,2013年10月29日,2013年10月29日,2015年10月29日,,,京山县,2013年04月29日
肇东市,2312822013B00355,年产植物养生饮料1000吨,哈大齐工业走廊肇东绿色产业园区,3.000000,0.000000,工业用地,挂牌出让,50,饮料制造业,二级,525.0000,肇东市渴乐养生饮品有限公司,1.10,,2013年05月30日,2013年05月30日,2015年05月30日,,,肇东市人民政府,2013年04月29日
关岭布依族苗族自治县,5204242013B00188,2005年关索新区被征地农户安置,关岭自治县关索镇大岩新区,0.009200,0.000000,中低价位、中小套型普通商品住房用地,协议出让,70,住宿业,三级,3.7536,胡从建,1.00,3.00,2013年05月20日,2013年05月21日,2016年05月20日,,,关岭布依族苗族自治县,2013年04月29日
南海区,4406052013A03437,南海垃圾焚烧发电一厂改扩建项目,南海区狮山镇狮山林场地段,3.489250,3.489250,公共设施用地,划拨,,国家机构,未评估地区,0.0000,,,1.00,2013年04月29日,2014年04月29日,2015年04月29日,,,南海区人民政府,2013年04月29日
关岭布依族苗族自治县,5204242013B00170,2005年关索新区被征地农户安置,关岭自治县关索镇大岩新区,0.009200,0.000000,中低价位、中小套型普通商品住房用地,协议出让,70,住宿业,三级,3.7536,卢明书,1.00,3.00,2013年05月16日,2013年05月20日,2016年05月19日,,,关岭布依族苗族自治县,2013年04月29日
伊川县,4103292013A00962,伊川县气象局建设项目,伊川县城关镇瑶湾村、荆山公园内,0.397000,0.000000,机关团体用地,划拨,,国家机构,六级,,,,0.50,2013年05月01日,2013年06月01日,2015年06月01日,,,伊川县人民政府,2013年04月29日
长葛市,4110822013B00657,长葛市枣园卫浴有限公司2013-09#项目用地,107国道西侧,0.605600,0.595122,工业用地,挂牌出让,50,金属制品业,三级,81.2434,长葛市枣园卫浴有限公司,1.00,,2013年06月19日,2013年12月19日,2016年06月19日,,,长葛市,2013年04月29日
泊头市,1309812013B00538,泊头市东方房地产开发有限公司,交河镇武港路北、老交河陵园东北侧,4.289321,4.289321,中低价位、中小套型普通商品住房用地,挂牌出让,70,房地产业,十二级,3860.4000,泊头市东方房地产开发有限公司,1.00,1.70,2013年07月01日,2013年07月19日,2016年07月19日,,,泊头市人民政府,2013年04月29日
泊头市,1309812013B00564,泊头天利包装制品有限公司,泊毛公路东侧、王水林北侧,0.636226,0.000000,工业用地,挂牌出让,50,通用设备制造业,十二级,85.8600,泊头天利包装制品有限公司,1.00,,2013年07月01日,2013年07月19日,2015年07月19日,,,泊头市人民政府,2013年04月29日
泊头市,1309812013B00558,泊头市鑫立源房地产开发有限公司,泊头余庄村道路东侧、空地南侧,1.077698,0.000000,其他商服用地,挂牌出让,40,房地产业,十二级,485.1000,泊头市鑫立源房地产开发有限公司,1.00,2.00,2013年07月01日,2013年07月19日,2016年07月19日,,,泊头市人民政府,2013年04月29日
长葛市,4110822013B00644,长葛市百禾房地产开发有限公司2013-14#项目用地,铁东路中段西侧,1.278200,1.017784,其他普通商品住房用地,挂牌出让,其他普通商品住房用地70年; 其他商服用地40,房地产业,二级,1545.4800,长葛市百合房地产开发有限公司,3.00,3.50,2013年06月19日,2013年12月19日,2016年06月19日,,,长葛市,2013年04月29日
泊头市,1309812013B00546,董桂华,泊镇张庄子供销社北侧、董桂华门市楼西侧,0.355986,0.355986,中低价位、中小套型普通商品住房用地,挂牌出让,70,房地产业,十二级,320.4000,董桂华,1.00,1.70,2013年06月01日,2013年07月19日,2016年07月19日,,,泊头市人民政府,2013年04月29日
无锡市本级,3202002013A01416,梅西路东侧地块前期开发项目,无锡新区梅西路东侧、群兴路南侧,2.284060,2.284060,空闲地,划拨,,中国共产党机关,未评估地区,0.0000,,0.00,0.00,2013年04月29日,2013年10月29日,2015年10月29日,,,无锡市人民政府,2013年04月29日
镶黄旗,1525282013B00136,商住楼,新宝拉格镇第六居民区文化广场北,0.552837,0.552837,其他普通商品住房用地,挂牌出让,70,住宿业,十五等级,66.3400,锡林郭勒盟房地产综合开发公司第二项目部,1.50,,2013年04月20日,2013年04月30日,2013年10月31日,,,镶黄旗,2013年04月29日
大丰市,3209822013B00640,江苏集盛矿产物流有限公司,港区二号港池东侧,9.607100,0.000000,仓储用地,挂牌出让,50,仓储业,未评估地区,1383.4300,江苏集盛矿产物流有限公司,0.70,,2013年10月29日,2013年10月29日,2014年10月29日,,,大丰市,2013年04月29日
大丰市,3209822013B00634,江苏恒通汇丰石油化工储运有限公司,港区南港路南侧,5.666900,0.000000,仓储用地,挂牌出让,50,仓储业,未评估地区,816.0400,江苏恒通汇丰石油化工储运有限公司,0.70,,2013年10月29日,2013年10月29日,2014年10月29日,,,大丰市,2013年04月29日
兴化市,3212812013B01158,江苏裕兴纺织有限公司,兴化市昭阳工业园四区、润阳路西侧,18.757910,0.000000,工业用地,挂牌出让,50,棉、化纤纺织及印染精加工,十一级,3126.5000,江苏裕兴纺织有限公司,0.80,,2013年05月19日,2013年07月19日,2014年07月19日,,,兴化市,2013年04月29日
沭阳县,3213222013B00867,沭阳县韩山镇明东机械厂,沭阳县韩山镇孤山南路西侧、324省道北侧（原无纺织厂）,0.507482,0.000000,工业用地,挂牌出让,50,木材加工及木、竹、藤、棕、草制品业,未评估地区,49.0000,沭阳县韩山镇明东机械厂,2.00,,2013年05月15日,2013年05月25日,2013年12月31日,,,沭阳县人民政府,2013年04月29日
响水县,3209212013B00187,江苏正兴电气有限公司,响水县经济开发区,2.372800,2.372800,工业用地,挂牌出让,50,其它,四级,327.0000,江苏正兴电气有限公司,0.70,0.00,2013年06月30日,2013年07月30日,2015年01月29日,,,响水县,2013年04月29日
大丰市,3209822013B00655,江苏泰丰物流有限公司,港区海港复河东侧,6.667000,0.000000,仓储用地,挂牌出让,50,仓储业,未评估地区,960.0500,江苏泰丰物流有限公司,0.70,,2013年10月29日,2013年10月29日,2014年10月29日,,,大丰市,2013年04月29日
太仓市,3205852013A01819,江苏海事局太仓监管救助综合基地和太仓船舶溢油应急设备库用房项目,浮桥镇浮桥村1、20组,2.723630,0.000000,公共设施用地,划拨,,公共设施管理业,四级,,,,1.00,2013年05月28日,2013年06月28日,2013年12月30日,,,太仓市人民政府,2013年04月29日
泰州市本级,3212002013A00282,泰州市大浦中心小学附属幼儿园,海陵区东进小区,0.781900,0.781900,科教用地,划拨,,教育业,四级,0.0000,,,0.95,2013年05月27日,2013年06月25日,2014年06月25日,,,泰州市国土资源局,2013年04月29日
