行政区,电子监管号,项目名称,项目位置,面积(公顷),土地来源,土地用途,供地方式,土地使用年限,行业分类,土地级别,成交价格(万元),土地使用权人,约定容积率下限,约定容积率上限,约定交地时间,约定开工时间,约定竣工时间,实际开工时间,实际竣工时间,批准单位,合同签订日期西山区,5301122013B11929,解智强,西昌路225号15幢1单元309号,0.001394,0.001394,其他普通商品住房用地,协议出让,70,房地产业,一级,0.7000,解智强,,,2013年09月15日,1900年01月01日,1900年01月01日,,,,2013年09月15日
广州市本级,4401002013B03359,二类居住用地,花都区新华街建设北路178号,2.818300,2.784700,其他普通商品住房用地,挂牌出让,70,房地产业,六级,47800.0000,广州绿地房地产开发有限公司,1.00,2.80,2014年03月15日,2015年03月15日,2018年03月15日,,,广州市,2013年09月15日
康平县,2101232013B00779,沈阳市康平道桥工程有限公司,康彰公路南,4.463710,0.826360,工业用地,挂牌出让,50,工程准备,未评估地区,575.0000,沈阳市康平道桥工程有限公司,0.50,0.00,2013年12月31日,2014年12月31日,2016年12月31日,,,康平县,2013年09月15日
平舆县,4117232013B02115,商业用地,平舆县平和路北侧,0.204504,0.204504,其他商服用地,挂牌出让,40,商务服务业,一级,63.6007,魏美丽,1.20,3.00,2013年10月31日,2014年03月31日,2015年08月31日,,,平舆县,2013年09月15日
杭锦后旗,1508262013A00282-1,杭锦后旗土地收购储备中心,陕坝镇北环路,5.055400,0.000000,公共设施用地,划拨,,中国共产党机关,二级,,,,,1900年01月01日,1900年01月01日,1900年01月01日,,,杭锦后旗人民政府,2013年09月15日
乌拉特前旗,1508232013B01186,燃料液化气充装项目,乌拉特前旗大佘太牧场南600米,0.340000,0.000000,批发零售用地,挂牌出让,40,燃气生产和供应业,十四等级,19.0000,乌拉特前旗建平燃料液化气有限责任公司,0.00,0.50,2013年09月19日,2013年12月13日,2016年12月12日,,,乌拉特前旗,2013年09月15日
宣化县,1307212013B00097,光华创世蓄冰空调设备制造项目,张家口市东山产业集聚区,3.332800,0.000000,工业用地,挂牌出让,50,其它,未评估地区,499.9200,张家口市光华创世科技有限公司,0.80,,2013年11月30日,2014年01月31日,2016年01月31日,,,宣化县,2013年09月15日
西山区,5301122013B11910,李飞阳,昆明市南坝223号E-15幢3-5号,0.000732,0.000732,其他普通商品住房用地,协议出让,70,房地产业,一级,0.3400,李飞阳,,,2013年09月15日,1900年01月01日,1900年01月01日,,,,2013年09月15日
西山区,5301122013B11901,沈石春,西山区普坪村昆明水泥厂新生活区29幢4单元713号,0.000924,0.000924,其他普通商品住房用地,协议出让,70,房地产业,一级,0.2750,沈石春,,,2013年09月15日,1900年01月01日,1900年01月01日,,,,2013年09月15日
晋城市本级,1405002013B00367,山西盛华房地产开发有限公司居住兼容商业服务业设施用地（2013-17）,泽州北路西，规划东大街南侧,1.529300,0.000000,其他普通商品住房用地,拍卖出让,其他商服用地40年; 其他普通商品住房用地70,房地产业,九级,4600.0000,山西盛华房地产开发有限公司,1.00,3.00,2013年12月08日,2014年06月08日,2017年06月08日,,,晋城市,2013年09月15日
零陵区,4311022013B09936,永州康乃馨养老产业投资置业有限公司,零陵区阳明大道东侧,3.571347,3.571347,其他普通商品住房用地,挂牌出让,其他商服用地40年; 其他普通商品住房用地70,社会福利业,七级,6000.0000,永州康乃馨养老产业投资置业有限公司,1.01,3.50,2013年10月01日,2014年09月01日,2017年09月01日,,,零陵区,2013年09月15日
西山区,5301122013B11891,于金生,春苑小区春明里16幢1单元602号,0.001335,0.001335,其他普通商品住房用地,协议出让,70,房地产业,一级,0.6350,于金生,,,2013年09月15日,1900年01月01日,1900年01月01日,,,,2013年09月15日
西山区,5301122013B11887,杨正美,昆明市春雨路349号（昆明电机厂生活区建设村8幢1单元408号,0.001137,0.001137,其他普通商品住房用地,协议出让,70,房地产业,一级,0.4000,杨正美,,,2013年09月15日,1900年01月01日,1900年01月01日,,,,2013年09月15日
西山区,5301122013B11872,曾颖,昆明市棕树营小区中心组团高层,0.000338,0.000338,其他普通商品住房用地,协议出让,70,房地产业,一级,0.5000,曾颖,,,2013年09月15日,1900年01月01日,1900年01月01日,,,,2013年09月15日
濉溪县,3406212013B00875,淮北杰鹏置业有限公司,濉溪濉芜现代产业园s202省道东、紫藤路南侧,7.371662,0.000000,批发零售用地,挂牌出让,40,批发业,四级,4300.0000,淮北杰鹏置业有限公司,,1.60,2013年12月15日,2014年02月15日,2016年02月15日,,,濉溪县,2013年09月15日
绥棱县,2312262013A00319,绥棱县职业技术学校新建综合实训楼,绥棱县职业技术学校东校院内,0.486600,0.486600,科教用地,划拨,,教育业,三级,0.0000,,0.00,1.00,2013年09月15日,2013年09月15日,2014年06月30日,,,绥棱县人民政府,2013年09月15日
绥化市本级,2312002013B00508,财富雅居棚户区改造,西长发镇内,0.361000,0.361000,其他普通商品住房用地,挂牌出让,其他商服用地40年; 其他普通商品住房用地70,房地产业,一级,48.0000,绥化润峰房地产开发有限公司,2.00,2.00,2013年10月01日,2013年10月01日,2015年10月01日,,,绥化市,2013年09月15日
安泽县,1410262013B00168,安泽县原商业局家属院改造,原商业局家属院,0.320000,0.320000,其他普通商品住房用地,挂牌出让,70,房地产业,十五等级,111.0000,安泽县宏凯房地产有限公司,,3.30,2013年10月30日,2013年10月31日,2016年10月30日,,,安泽县,2013年09月15日
富裕县,2302272013B00109,金属制造业,塔哈综合产业园A-01号地块,6.840000,0.000000,工业用地,挂牌出让,50,金属制品业,三级,670.3200,齐齐哈尔蓝天新型建材科技有限公司,0.70,,2013年09月30日,2013年10月01日,2015年09月30日,,,富裕县人民政府,2013年09月15日
杭锦后旗,1508262013A00290,杭锦后旗土地收购储备中心,陕坝镇团结街,8.098300,0.000000,公共设施用地,划拨,,中国共产党机关,一级,,,,,,,,,,杭锦后旗人民政府,2013年09月15日
额尔古纳市,1507842013B00976,铁矿石货场及辅助建筑设施用地,蒙兀室韦苏木,5.000020,3.327020,工业用地,挂牌出让,50,铁矿采选,二级,504.5300,额尔古纳西洋矿业有限公司,0.60,0.60,2013年10月15日,2013年10月21日,2014年10月20日,,,额尔古纳市,2013年09月15日
杭锦后旗,1508262013A00355,杭锦后旗土地收购储备中心,三道桥镇蒙海工业园区,8.947400,0.000000,公共设施用地,划拨,,中国共产党机关,未评估地区,,,,,,,,,,杭锦后旗人民政府,2013年09月15日
兴化市,3212812013B01474,俞光华、朱高平,兴化市安丰镇新北郊村、北环路北侧,1.385520,0.000000,住宿餐饮用地,挂牌出让,70,餐饮业,十一级,540.0000,俞光华、朱高平,0.00,2.23,2013年10月05日,2013年10月05日,2015年10月05日,,,兴化市,2013年09月15日
杭锦后旗,1508262013A00309,杭锦后旗土地收购储备中心,陕坝镇北环路,5.014600,0.000000,公共设施用地,划拨,,中国共产党机关,二级,,,,,,,,,,杭锦后旗人民政府,2013年09月15日
亭湖区,3209022013B00630,江苏中科重工股份有限公司,盐城市亭湖区南洋镇凤洋村民委员会二组、绍林村民委员会四组,2.333300,2.333300,工业用地,挂牌出让,50,通用设备制造业,九级,475.9932,江苏中科重工股份有限公司,0.80,1.40,2014年03月15日,2014年05月15日,2016年05月15日,,,盐城市人民政府,2013年09月15日
杭锦后旗,1508262013A00340,杭锦后旗土地收购储备中心,三道桥镇蒙海工业园区,9.043900,0.000000,公共设施用地,划拨,,中国共产党机关,未评估地区,,,,,,,,,,杭锦后旗人民政府,2013年09月15日
亭湖区,3209022013B00626,江苏中运物流有限公司,盐城市亭湖区新洋街道办事处龙桥村民委员会六、七组,3.918700,1.085000,仓储用地,挂牌出让,50,仓储业,九级,905.2197,江苏中运物流有限公司,0.80,1.60,2014年03月15日,2014年05月15日,2016年05月15日,,,盐城市人民政府,2013年09月15日
纳雍县,5224262013B00215-1,纳雍县2012年第六批次城镇建设用地1地块,纳雍县县城城东片区,3.342300,0.000000,中低价位、中小套型普通商品住房用地,挂牌出让,70,房地产业,一级,2673.8484,纳雍县开发投资置业有限公司,1.00,3.50,2014年03月15日,2014年05月15日,2017年05月15日,,,纳雍县,2013年09月15日
