行政区,电子监管号,项目名称,项目位置,面积(公顷),土地来源,土地用途,供地方式,土地使用年限,行业分类,土地级别,成交价格(万元),土地使用权人,约定容积率下限,约定容积率上限,约定交地时间,约定开工时间,约定竣工时间,实际开工时间,实际竣工时间,批准单位,合同签订日期昌吉市,6523012015B00449,昌吉市凯博建材有限责任公司,昌吉高新技术产业开发区,5.978049,0.000000,工业用地,挂牌出让,50,其它,二级,683.4850,昌吉市凯博建材有限责任公司,1.00,,2015年04月17日,2016年04月16日,2017年04月15日,,,昌吉高新技术产业开发区管委会,2015年04月01日
伊金霍洛旗,1506272015A01396,新可汗路以南硬化工程及附属工程,新可汗街以南、通格朗街以西,1.438500,1.438500,公园与绿地,划拨,,公共设施管理业,二级,0.0000,,0.00,0.00,2015年04月10日,2015年05月10日,2016年05月10日,,,伊金霍洛旗人民政府,2015年04月01日
苍溪县,5108242015B00862,划拨转出让,苍溪县陵江镇解放路西段,0.073350,0.001865,其他商服用地,协议出让,33,住宿业,十三等级,0.8952,苍溪县国有资产投资经营有限公司,1.60,1.60,2015年04月01日,2015年04月01日,2015年04月01日,,,苍溪县,2015年04月01日
洛阳市本级,4103002015B04117,洛阳大华重型机械有限公司,洛龙科技园区关林路以南、用地界以东,3.275335,0.000000,工业用地,挂牌出让,50,通用设备制造业,三级,1100.5124,洛阳大华重型机械有限公司,1.00,,2015年05月01日,2015年11月01日,2018年11月01日,,,洛阳市,2015年04月01日
威宁彝族回族苗族自治县,5224272015B00050,板底小集镇建设项目,威宁自治县板底乡,0.025360,0.025360,中低价位、中小套型普通商品住房用地,挂牌出让,中低价位、中小套型普通商品住房用地70年; 批发零售用地40,零售业,十五等级,14.1500,文富聪,1.00,2.50,2015年04月01日,2015年04月30日,2018年04月01日,,,威宁自治县,2015年04月01日
福贡县,5333232015B00038,福贡阳光医院,福贡县上帕镇,0.140841,0.140841,其他商服用地,拍卖出让,40,卫生,二级,18.5234,福贡阳光医院,,,1900年01月01日,1900年01月01日,1900年01月01日,,,,2015年04月01日
白碱滩区,6502042015B00049,工业用地KGB2015-021(石油加工、炼焦及核燃料加工业),石化工业园区西九街以东，南三路以北,5.524590,3.666849,工业用地,挂牌出让,50,石油加工、炼焦及核燃料加工业,四级,706.0000,新疆美叶油气能源储运有限公司,0.50,0.00,2015年04月01日,2015年08月15日,2016年08月15日,,,克拉玛依市白碱滩区,2015年04月01日
,,,,,,,,,,,,,,,,,,,,,
阆中市,5113812015B00245,水观001商住,阆中市水观镇永安路,0.716961,0.000000,其他普通商品住房用地,拍卖出让,40,房地产业,一级,310.0000,阆中市广厦房地产开发有限公司,1.00,2.70,2015年05月27日,2015年12月30日,2017年12月30日,,,阆中市,2015年04月01日
,,,,,,,,,,,,,,,,,,,,,
伊春市本级,2307002015A00098,食用菌示范基地,伊春林业学校院内,0.124800,0.124800,科教用地,划拨,,教育业,二级,,,0.74,0.74,2015年05月01日,2015年05月08日,2017年05月08日,,,伊春市人民政府,2015年04月01日
银川市本级,6401002015B02195,银川双兴昇工贸有限公司,金凤区工业集中区包兰铁路东侧、宝湖路林带北侧,0.479983,0.479983,工业用地,挂牌出让,50,租赁业,未评估地区,132.0000,银川双兴昇工贸有限公司,1.10,,2015年03月25日,2015年07月15日,2017年07月15日,,,银川市,2015年04月01日
永州市本级,4311002015A03559,永州市长丰工业园道路及安置小区,长丰大道以南、金水路以东、安置小区,0.004800,0.004800,经济适用住房用地,划拨,,住宿业,五级,0.0000,,1.00,3.00,2015年04月03日,2016年04月03日,2018年04月02日,,,永州市凤凰园经济开发区,2015年04月01日
沅陵县,4312222015B00369,湖南鼎铠城建开发有限公司,沅陵县七甲坪集镇,0.803000,0.000000,中低价位、中小套型普通商品住房用地,挂牌出让,中低价位、中小套型普通商品住房用地70年; 批发零售用地40,房地产业,三级,306.0000,湖南鼎铠城建开发有限公司,2.03,2.03,2015年04月30日,2015年05月30日,2018年05月30日,,,沅陵县人民政府,2015年04月01日
沅陵县,4312222015B00358,湖南鼎铠城建开发有限公司,沅陵县七甲坪集镇,1.175200,0.000000,中低价位、中小套型普通商品住房用地,挂牌出让,中低价位、中小套型普通商品住房用地70年; 批发零售用地40,房地产业,三级,486.0000,湖南鼎铠城建开发有限公司,2.37,2.37,2015年05月30日,2015年05月30日,2018年05月30日,,,沅陵县人民政府,2015年04月01日
威宁彝族回族苗族自治县,5224272015B00030,板底小集镇建设项目,威宁自治县板底乡,0.026700,0.026700,中低价位、中小套型普通商品住房用地,挂牌出让,批发零售用地40年; 中低价位、中小套型普通商品住房用地70,零售业,十五等级,14.8900,李海艳,1.00,2.50,2015年04月01日,2015年04月30日,2018年04月30日,,,威宁自治县,2015年04月01日
海林市,2310832015B00089-1,食用菌和坚果加工项目,华顺天然食品以西，北苑街以北与茂源米业交汇处,2.130080,0.000000,工业用地,挂牌出让,50,农副食品加工业,三级,408.9754,海林市营宝天然食品有限公司,1.20,,2015年06月30日,1900年01月01日,1900年01月01日,,,海林市,2015年04月01日
威宁彝族回族苗族自治县,5224272015B00023,板底小集镇建设项目,威宁自治县板底乡,0.006000,0.006000,中低价位、中小套型普通商品住房用地,挂牌出让,中低价位、中小套型普通商品住房用地70年; 批发零售用地40,零售业,十五等级,2.9000,孟天成,1.00,2.50,2015年04月01日,2015年04月30日,2018年04月01日,,,威宁自治县,2015年04月01日
蒲城县,6105262015B00078,唐明钢构工程有限公司,陈庄镇东鲁村,0.802400,0.000000,工业用地,挂牌出让,50,金属制品业,未评估地区,96.0000,蒲城县唐明钢构工程有限公司,0.80,0.80,2015年04月30日,2015年05月31日,2017年05月31日,,,蒲城县人民政府,2015年04月01日
沅陵县,4312222015B00346,湖南鼎铠城建开发有限公司,沅陵县七甲坪集镇,0.614600,0.000000,中低价位、中小套型普通商品住房用地,挂牌出让,中低价位、中小套型普通商品住房用地70年; 批发零售用地40,房地产业,三级,208.0000,湖南鼎铠城建开发有限公司,2.05,2.05,2015年04月30日,2015年05月30日,2018年05月30日,,,沅陵县人民政府,2015年04月01日
,,,,,,,,,,,,,,,,,,,,,
苍溪县,5108242015B00840,划拨转出让,苍溪县陵江镇狮子巷,0.003238,0.003238,其他商服用地,协议出让,33,住宿业,十三等级,2.5743,苍溪县国有资产投资经营有限公司,1.60,1.60,2015年04月01日,2015年04月01日,2015年04月01日,,,苍溪县,2015年04月01日
沅陵县,4312222015B00320,湖南鼎铠城建开发有限公司,沅陵县七甲坪集镇,0.984200,0.000000,中低价位、中小套型普通商品住房用地,挂牌出让,中低价位、中小套型普通商品住房用地70年; 批发零售用地40,房地产业,三级,368.0000,湖南鼎铠城建开发有限公司,1.98,1.98,2015年04月30日,2015年05月30日,2018年05月30日,,,沅陵县人民政府,2015年04月01日
华蓥市,5116812015B00067,木制品制造项目（思坦木业）,华蓥市广华工业新城内,1.671480,1.671480,工业用地,挂牌出让,50,木材加工及木、竹、藤、棕、草制品业,十四等级,140.5000,四川思坦木业有限公司,1.00,0.00,2015年05月04日,2015年05月09日,2016年05月08日,,,华蓥市,2015年04月01日
南漳县,4206242015B00791,个人建房,城关镇姚岗村,0.011790,0.000000,其他普通商品住房用地,挂牌出让,70,其他服务业,十三等级,3.7000,王俊昌,,,2015年04月16日,1900年01月01日,1900年01月01日,,,南漳县,2015年04月01日
沅陵县,4312222015B00310,湖南鼎铠城建开发有限公司,沅陵县七甲坪集镇,1.192400,0.000000,中低价位、中小套型普通商品住房用地,挂牌出让,中低价位、中小套型普通商品住房用地70年; 批发零售用地40,房地产业,三级,430.0000,湖南鼎铠城建开发有限公司,2.03,2.03,2015年04月30日,2015年05月30日,2018年05月30日,,,沅陵县人民政府,2015年04月01日
黄石市本级,4202002015B00110,黄石市花湖房地产开发公司住宅用地协议出让,湖滨大道1871号,0.005670,0.005670,其他普通商品住房用地,协议出让,70,房地产业,三级,6.6461,黄石市花湖房地产开发公司,,,1900年01月01日,1900年01月01日,1900年01月01日,,,黄石市国土资源局,2015年04月01日
永州市本级,4311002015A03540,永州市长丰工业园道路及安置小区,长丰大道以南、金水路以东、安置小区,0.009600,0.009600,经济适用住房用地,划拨,,住宿业,五级,0.0000,,1.00,3.00,2015年04月03日,2016年04月03日,2018年04月02日,,,永州市凤凰园经济开发区,2015年04月01日
沅陵县,4312222015B00305,湖南鼎铠城建开发有限公司,沅陵县七甲坪集镇,0.598600,0.000000,中低价位、中小套型普通商品住房用地,挂牌出让,中低价位、中小套型普通商品住房用地70年; 批发零售用地40,房地产业,三级,219.0000,湖南鼎铠城建开发有限公司,2.00,2.00,2015年04月30日,2015年05月30日,2018年05月30日,,,沅陵县人民政府,2015年04月01日
津南区,1201122015A00465,双港新家园非经营性公建4-2文化活动站工程,津南区双港新家园居住区4-2号地,0.080270,0.000000,文体娱乐用地,划拨,,文化艺术业,六级,,,,0.70,2015年04月01日,2016年04月01日,2018年04月01日,,,津南区人民政府,2015年04月01日
沅陵县,4312222015B00270,湖南鼎铠城建开发有限公司,沅陵县七甲坪集镇,0.129800,0.000000,中低价位、中小套型普通商品住房用地,挂牌出让,中低价位、中小套型普通商品住房用地70年; 批发零售用地40,房地产业,三级,48.0000,湖南鼎铠城建开发有限公司,2.00,2.00,2015年04月30日,2015年05月30日,2018年05月30日,,,沅陵县人民政府,2015年04月01日
和平县,4416242015B00012-2,和平县星华汽车服务,和平县阳明镇铁潭,0.485620,0.000000,仓储用地,挂牌出让,50,仓储业,二级,77.6100,和平县星华汽车服务有限公司,1.00,1.50,2015年06月30日,2016年06月30日,2019年12月31日,,,和平县,2015年04月01日
沅陵县,4312222015B00296,湖南鼎铠城建开发有限公司,沅陵县七甲坪集镇,0.518700,0.000000,中低价位、中小套型普通商品住房用地,挂牌出让,中低价位、中小套型普通商品住房用地70年; 批发零售用地40,房地产业,三级,175.0000,湖南鼎铠城建开发有限公司,2.00,2.00,2015年04月30日,2015年05月30日,2018年05月30日,,,沅陵县人民政府,2015年04月01日
文安县,1310262015B00052,文安县美能煤炭有限公司用地项目,文安新桥工业园区,0.522949,0.000000,工业用地,挂牌出让,50,零售业,十三等级,107.0000,文安县美能煤炭有限公司,1.00,0.00,2015年07月01日,2015年10月01日,2017年10月01日,,,文安县,2015年04月01日
芦溪县,3603232015B00124,华能电厂“上大压小”,芦溪工业园区,32.301900,0.000000,工业用地,挂牌出让,50,火力发电,十二级,4038.0000,华能案源发电有限责任公司,1.00,0.00,2015年04月22日,2015年10月12日,2017年10月11日,,,芦溪县,2015年04月01日
沅陵县,4312222015B00288,湖南鼎铠城建开发有限公司,沅陵县七甲坪集镇,0.672600,0.000000,中低价位、中小套型普通商品住房用地,挂牌出让,中低价位、中小套型普通商品住房用地70年; 批发零售用地40,房地产业,三级,227.0000,湖南鼎铠城建开发有限公司,1.98,1.98,2015年04月30日,2015年05月30日,2018年05月30日,,,沅陵县人民政府,2015年04月01日
永州市本级,4311002015A03535,永州市长丰工业园道路及安置小区,长丰大道以南、金水路以东、安置小区,0.004800,0.004800,经济适用住房用地,划拨,,住宿业,五级,0.0000,,1.00,3.00,2015年04月03日,2016年04月03日,2018年04月02日,,,永州市凤凰园经济开发区,2015年04月01日
文安县,1310262015B00060,河北德源农业科技有限公司用地项目,文安工业园区,0.459046,0.000000,其他商服用地,挂牌出让,40,农、林、牧、渔服务业,十三等级,216.0000,河北德源农业科技有限公司,1.00,2.00,2015年07月01日,2015年10月01日,2017年10月01日,,,文安县,2015年04月01日
江北区,5001052015B00117,房地产开发项目,江北区溉澜溪片区组团G分区G15/03、G16-1/03、G16-2/02、G16-3/03、G17-1/02号宗地,21.633500,21.633500,其他普通商品住房用地,挂牌出让,40,房地产业,三级,245482.0000,重庆创盈锦玺置业有限公司,1.00,2.34,2015年12月31日,2016年12月31日,2019年12月31日,,,重庆市,2015年04月01日
永州市本级,4311002015A03520,永州市长丰工业园道路及安置小区,长丰大道以南、金水路以东、安置小区,0.009600,0.009600,经济适用住房用地,划拨,,住宿业,五级,0.0000,,1.00,3.00,2015年04月03日,2016年04月03日,2018年04月02日,,,永州市凤凰园经济开发区,2015年04月01日
南漳县,4206242015B00787,个人建房,城关镇姚岗村,0.011790,0.000000,其他普通商品住房用地,挂牌出让,70,其他服务业,十三等级,3.7000,李荣,,,2015年04月16日,1900年01月01日,1900年01月01日,,,南漳县,2015年04月01日
温州市本级,3303002015B35164,浙江得业电机科技有限公司,温州经济技术开发金海园区D-09a-7地块,1.569471,0.000000,工业用地,挂牌出让,50,通用设备制造业,七级,1062.0000,浙江得业电机科技有限公司,0.80,2.60,2015年04月01日,2016年03月31日,2018年03月31日,,,温州市,2015年04月01日
苍溪县,5108242015B00855,划拨转出让,苍溪县陵江镇人民东路,0.003217,0.003217,其他商服用地,协议出让,33,住宿业,十三等级,1.5442,苍溪县国有资产投资经营有限公司,1.60,1.60,2015年04月01日,2015年04月01日,2015年04月01日,,,苍溪县,2015年04月01日
威宁彝族回族苗族自治县,5224272015B00100,板底小集镇建设项目,威宁自治县板底乡,0.004230,0.004230,中低价位、中小套型普通商品住房用地,挂牌出让,中低价位、中小套型普通商品住房用地70年; 批发零售用地40,零售业,十五等级,2.5300,罗孝祥,1.00,2.50,2015年04月01日,2015年04月30日,2018年04月01日,,,威宁自治县,2015年04月01日
永州市本级,4311002015A03514,永州市长丰工业园道路及安置小区,长丰大道以南、金水路以东、安置小区,0.009600,0.009600,经济适用住房用地,划拨,,住宿业,五级,0.0000,,1.00,3.00,2015年04月03日,2016年04月03日,2018年04月02日,,,永州市凤凰园经济开发区,2015年04月01日
随州市本级,4213002015B00135,湖北楚天药业有限责任公司,南郊马家榨社区,2.290000,0.000000,工业用地,挂牌出让,50,医药制造业,四级,379.0000,湖北楚天药业有限责任公司,1.00,,2015年05月31日,2016年05月30日,2018年05月30日,,,随州市,2015年04月01日
滁州市本级,3411002015B00235,滁州市密尼斯特高级时装有限公司,沙河镇工业集中区（焦巷路东侧、翰瑞服饰北侧）,1.921000,0.000000,工业用地,挂牌出让,50,纺织服装、鞋、帽制造业,四级,323.0000,滁州市密尼斯特高级时装有限公司,1.00,0.00,2015年04月11日,2015年07月12日,2016年07月12日,,,滁州市,2015年04月01日
永州市本级,4311002015A03505,永州市长丰工业园道路及安置小区,长丰大道以南、金水路以东、安置小区,0.009600,0.009600,经济适用住房用地,划拨,,住宿业,五级,0.0000,,1.00,3.00,2015年04月03日,2016年04月03日,2018年04月02日,,,永州市凤凰园经济开发区,2015年04月01日
蒲城县,6105262015B00060,唐明钢构工程有限公司,陈庄镇东鲁村,1.062000,0.000000,工业用地,挂牌出让,50,金属制品业,未评估地区,124.0000,蒲城唐明钢构工程有限公司,0.80,0.80,2015年04月30日,2015年05月31日,2017年05月31日,,,蒲城县,2015年04月01日
,,,,,,,,,,,,,,,,,,,,,
东阳市,3307832015B00319-1,东阳市云禾置业有限公司,红椿巷区域A12、A13地块,1.367400,0.000000,其他商服用地,拍卖出让,40,餐饮业,四级,16000.0000,东阳市云禾置业有限公司,1.50,3.80,2015年06月10日,2015年10月10日,2017年04月10日,,,,2015年04月01日
银川市本级,6401002015B02182,宁夏众一砼业有限公司,金凤区综合产业园内，规划路林带西侧,0.741986,0.741986,工业用地,挂牌出让,50,砖瓦、石材及其他建筑材料制造,未评估地区,224.0000,宁夏众一砼业有限公司,0.80,,2015年03月19日,2015年09月30日,2017年09月30日,,,银川市,2015年04月01日
永州市本级,4311002015A03490,永州市长丰工业园道路及安置小区,长丰大道以南、金水路以东、安置小区,0.009600,0.009600,经济适用住房用地,划拨,,住宿业,五级,0.0000,,1.00,3.00,2015年04月03日,2016年04月03日,2018年04月02日,,,永州市凤凰园经济开发区,2015年04月01日
塘沽区,1201072015B00395,津滨临（挂）G2014-13,天津临港经济区,6.800310,6.800310,工业用地,挂牌出让,50,石油加工、炼焦及核燃料加工业,一级,5190.0000,龙蟠润滑新材料（天津）有限公司,0.50,0.00,2015年04月08日,2015年10月01日,2018年10月01日,,,,2015年04月01日
,,,,,,,,,,,,,,,,,,,,,
华蓥市,5116812015B00045,手机整机及配件生产线（高科德）,华蓥市广华工业新城,4.168860,4.168860,工业用地,挂牌出让,50,通讯设备、计算机及其他电子设备制造业,十四等级,350.5000,华蓥市高科德电子科技有限公司,1.00,0.00,2015年05月04日,2015年05月09日,2016年05月08日,,,华蓥市,2015年04月01日
韶关市本级,4402002014B01357-1,韶关市工业西路冷水坑地块,韶关市武江区工业西路冷水坑,1.802400,0.000000,其他商服用地,挂牌出让,40,房地产业,三级,2918.5000,韶关市坤泽房地产开发有限公司,,1.80,2014年04月10日,2016年04月09日,2019年04月08日,,,韶关市,2015年04月01日
华蓥市,5116812015B00053,手机整机及配件生产线（高科龙）,华蓥市广华工业新城内,1.989680,1.989680,工业用地,挂牌出让,50,通讯设备、计算机及其他电子设备制造业,十四等级,167.5000,华蓥市高科龙电子科技有限公司,1.00,0.00,2015年05月04日,2015年05月09日,2016年05月08日,,,华蓥市,2015年04月01日
威宁彝族回族苗族自治县,5224272015B00099,板底小集镇建设项目,威宁自治县板底乡,0.006000,0.006000,中低价位、中小套型普通商品住房用地,挂牌出让,中低价位、中小套型普通商品住房用地70年; 批发零售用地40,零售业,十五等级,2.6000,文建华,1.00,2.50,2015年04月01日,2015年04月30日,2018年04月01日,,,威宁自治县,2015年04月01日
新田县,4311282015B00247,新田县城投房地产开发有限公司,新田县秀峰街与工农路交叉口东北角,0.666000,0.666000,其他普通商品住房用地,挂牌出让,70,房地产业,十三等级,806.0000,新田县城投房地产开发有限公司,1.00,10.00,2015年03月27日,2016年03月27日,2018年03月27日,,,新田县,2015年04月01日
曲阜市,3708812015B00136,曲阜顺和房地产开发有限公司建设用地,西临红庙村用地；东临红庙村、曲阜顺和房地产开发有限公司用地,0.241500,0.000000,其他普通商品住房用地,挂牌出让,70,房地产业,二级,530.0000,曲阜顺和房地产开发有限公司,1.00,3.20,2015年04月01日,2016年03月31日,2019年03月30日,,,曲阜市,2015年04月01日
磁县,1304272015B00148,金辉小区二期,磁县友谊大街西侧，107国道东侧（金三角）,0.598470,0.598470,其他商服用地,协议出让,40,房地产业,十三等级,6.9645,邯郸市山辰房地产开发有限公司,0.00,0.94,2015年04月30日,2016年03月10日,2019年02月10日,,,磁县人民政府,2015年04月01日
武汉市本级,4201002015B00829,武汉衡泰置业有限公司武汉火车站西广场南侧商服用地,武汉火车站西广场南侧,2.272454,2.272454,住宿餐饮用地,挂牌出让,40,房地产业,五级,13200.0000,武汉衡泰置业有限公司,1.90,1.90,2015年04月01日,2016年01月01日,2018年12月31日,,,武汉市,2015年04月01日
太原市本级,1401002015B00209,关于太原北营远恒房地产开发有限公司城中村改造项目（规划地块三）部分划拨国有土地使用权公开转让（挂牌方式）出让给太原万科新都心房地产开发有限公司,位于小店区北营社区，太原铁路局以东，北营社区以南，以西，以北,2.643263,2.643263,其他商服用地,挂牌出让,40,房地产业,三级,19420.0000,太原万科新都心房地产开发有限公司,3.00,3.00,2015年04月01日,2016年03月31日,2019年03月30日,,,太原市人民政府,2015年04月01日
从江县,5226332015A00114,西山镇小学补办用地手续,从江县西山镇徒寨村东侧,1.079000,1.079000,科教用地,划拨,,教育业,十五等级,,,,0.90,2015年04月01日,1900年01月01日,1900年01月01日,,,从江县人民政府,2015年04月01日
津南区,1201122015A00457,双港新家园非经营性公建3-4文化活动站工程,津南区双港新家园居住区3-4号地,0.100010,0.000000,文体娱乐用地,划拨,,文化艺术业,六级,,,,0.70,2015年04月01日,2016年04月01日,2018年04月01日,,,津南区人民政府,2015年04月01日
永州市本级,4311002015A03482,永州市长丰工业园道路及安置小区,长丰大道以南、金水路以东、安置小区,0.009600,0.009600,经济适用住房用地,划拨,,住宿业,五级,0.0000,,1.00,3.00,2015年04月03日,2016年04月03日,2018年04月02日,,,永州市凤凰园经济开发区,2015年04月01日
阜南县,3412252015A00156,冷庙养老中心二期项目,鹿城镇冷庙村东侧、县民政局西侧。,0.436100,0.000000,医卫慈善用地,划拨,,社会保障业,未评估地区,65.4000,,,1.60,2015年04月13日,2015年04月14日,2016年04月01日,,,安徽省阜南县人民政府,2015年04月01日
昌吉市,6523012015B00420,新疆光生源电力技术有限公司,昌吉高新技术产业开发区,3.333869,0.000000,工业用地,挂牌出让,50,其它,一级,435.8600,新疆光生源电力技术有限公司,0.70,,2015年04月17日,2016年04月16日,2017年04月15日,,,昌吉高新技术产业开发区管委会,2015年04月01日
城步苗族自治县,4305292015B00172,云马林场家属区翻修,儒林镇云马林场家属区内,0.070460,0.070460,其他普通商品住房用地,协议出让,70,房地产业,三级,24.9450,刘锋  田建军 杨德忠 陈代群 （谢忠意、肖安慧） （谢忠伟、吴巧） 曾维华 刘子淳,1.00,2.00,1900年01月01日,1900年01月01日,1900年01月01日,,,城步苗族自治县,2015年04月01日
永州市本级,4311002015A03476,永州市长丰工业园道路及安置小区,长丰大道以南、金水路以东、安置小区,0.004800,0.004800,经济适用住房用地,划拨,,住宿业,五级,0.0000,,1.00,3.00,2015年04月03日,2016年04月03日,2018年04月02日,,,永州市凤凰园经济开发区,2015年04月01日
彰武县,2109222015B00209,康大置地回迁楼项目,彰武镇建华村,0.414700,0.000000,中低价位、中小套型普通商品住房用地,挂牌出让,70,房地产业,一级,435.4350,辽宁康大置地有限公司,1.00,2.00,2015年04月16日,2015年05月10日,2015年10月31日,,,彰武县人民政府,2015年04月01日
威宁彝族回族苗族自治县,5224272015B00081,板底小集镇建设项目,威宁自治县板底乡,0.006000,0.006000,中低价位、中小套型普通商品住房用地,挂牌出让,批发零售用地40年; 中低价位、中小套型普通商品住房用地70,零售业,十五等级,2.6000,陈美,1.00,2.50,2015年04月01日,2015年04月30日,2018年04月01日,,,威宁自治县,2015年04月01日
,,,,,,,,,,,,,,,,,,,,,
轮台县,6528222015A00188,中石油塔里木油田分公司2011年滚动开发工程,轮台县轮南油田范围内,6.356600,0.000000,工业用地,划拨,,石油和天然气开采业,一级,0.0000,,0.40,0.00,2015年04月02日,2015年04月03日,2017年04月03日,,,中华人民共和国国土资源部,2015年04月01日
莱芜市本级,3712002015B00720,年产1万套智能防盗门,朱江路以西、银行街以北,1.326000,0.000000,工业用地,挂牌出让,50,家具制造业,五级,280.0000,莱芜市嬴城建设开发有限公司,1.00,,2015年04月01日,2016年04月01日,2018年04月01日,,,莱芜市,2015年04月01日
,,,,,,,,,,,,,,,,,,,,,
永州市本级,4311002015A03466,永州市长丰工业园道路及安置小区,长丰大道以南、金水路以东、安置小区,0.004800,0.004800,经济适用住房用地,划拨,,住宿业,五级,0.0000,,1.00,3.00,2015年04月03日,2016年04月03日,2018年04月02日,,,永州市凤凰园经济开发区,2015年04月01日
腾冲县,5305222015B00195,腾冲县福德生物资源开发有限公司,腾冲县北海乡打苴村,3.110100,0.000000,工业用地,挂牌出让,50,畜牧业,四级,1166.2875,腾冲县福德生物资源开发有限公司,0.70,1.20,2015年04月01日,2016年04月01日,2017年04月01日,,,腾冲县,2015年04月01日
拜泉县,2302312015A00062,龙泉镇中心幼儿园,拜泉县龙泉镇中学院内,0.274700,0.274700,科教用地,划拨,,教育业,四级,0.0000,,0.50,1.00,2015年07月01日,2016年04月01日,2018年04月01日,,,拜泉县人民政府,2015年04月01日
