行政区,电子监管号,项目名称,项目位置,面积(公顷),土地来源,土地用途,供地方式,土地使用年限,行业分类,土地级别,成交价格(万元),土地使用权人,约定容积率下限,约定容积率上限,约定交地时间,约定开工时间,约定竣工时间,实际开工时间,实际竣工时间,批准单位,合同签订日期惠州市本级,4413002015B12151,惠州市环宇旅游有限公司企业改制用地划拨补办出让,惠州市南坛南路23号,0.013224,0.013224,公共设施用地,协议出让,50,其他服务业,一级,3.6426,惠州市环宇旅游有限公司,,,1900年01月01日,1900年01月01日,1900年01月01日,,,惠州市,2015年04月28日
益阳市本级,4309002015B02228,盛细毛国有划拨用地使用权出让,朝阳路,0.002517,0.002517,中低价位、中小套型普通商品住房用地,协议出让,70,房地产业,一级,0.2749,盛细毛,,,2015年04月28日,1900年01月01日,1900年01月01日,,,益阳市,2015年04月28日
苏家屯区,2101112015B00097,新建商业房地产项目,沈阳市苏家屯区雪莲街西四环路北,6.032200,0.000000,批发零售用地,拍卖出让,40,房地产业,一级,9398.1676,沈阳华翔发展置业有限公司,1.00,1.90,2014年08月25日,2015年08月25日,2018年08月24日,,,沈阳市,2015年04月28日
绥宁县,4305272015B02632,张诗文住宅用地,绥宁县长铺镇长铺街,0.021350,0.021350,其他普通商品住房用地,协议出让,70,房地产业,二级,10.1600,张诗文,0.00,2.26,,,,,,绥宁县,2015年04月28日
蔡甸区,4201142015B00107,武汉市宏利兴业科技有限公司,大集街国利村、银燕村,4.038600,0.000000,工业用地,挂牌出让,50,专用设备制造业,一级,1395.0000,武汉市宏利兴业科技有限公司,1.00,2.50,2015年05月30日,2015年07月30日,2016年07月30日,,,武汉市蔡甸区,2015年04月28日
柞水县,6110262015B00052,柞水县下梁镇沙坪社区八组徐家大院国有建设用地使用权出让,柞水县下梁镇沙坪社区八组徐家大院,4.389100,0.000000,其他商服用地,挂牌出让,40,农业,十四等级,1850.0000,陕西汇生源生态农业有限公司,,3.00,2015年04月28日,2016年04月28日,2018年04月27日,,,柞水县,2015年04月28日
城阳区,3702142015B00403,青岛优佳生态农业开发有限公司处年产500套水处理设备项目,城阳区夏庄街道空港路北侧、中经二路东侧,0.771000,0.000000,工业用地,挂牌出让,50,农业,三级,228.2160,青岛优佳生态农业开发有限公司,1.00,,2015年04月28日,2016年04月27日,2018年04月26日,,,青岛市,2015年04月28日
大庆市本级,2306002015A00214,大庆客运西站站前南广场景观绿化工程,大庆客运西站站前南广场东侧,3.613630,3.613630,公园与绿地,划拨,,公共设施管理业,七级,0.0000,,0.00,0.00,2015年05月28日,2015年10月28日,2017年05月28日,,,大庆市人民政府,2015年04月28日
从江县,5226332015B00221,城投公司二桥头（西）商住广场综合用地,从江县丙妹镇二桥西桥头,0.177337,0.177337,中低价位、中小套型普通商品住房用地,挂牌出让,其他商服用地40年; 中低价位、中小套型普通商品住房用地70年; 文体娱乐用地50,其他服务业,十五等级,105.0000,从江县城投房地产开发有限责任公司,1.00,4.60,2015年04月30日,2015年05月31日,2015年12月31日,,,从江县,2015年04月28日
牡丹江市本级,2310002015B00040,年产10万吨新型建材生产基地,对俄经济园区规划二路以东，东西六路以南,10.079480,0.000000,工业用地,挂牌出让,50,塑料制品业,三级,3302.0000,牡丹江市中安塑胶有限责任公司,1.00,1.40,2015年04月28日,2015年06月28日,2018年06月28日,,,牡丹江市,2015年04月28日
合江分局,2392042015B00567,萝北县腾星木业有限责任公司木材加工项目,鹤北林业局局址三委顺和街南侧双尚路中段,1.400000,1.400000,工业用地,挂牌出让,30,林业,二级,88.2000,萝北县腾星木业有限责任公司,0.00,0.91,2015年04月28日,2015年04月28日,2016年04月28日,,,黑龙江省,2015年04月28日
苍溪县,5108242015B01208,住宅转商服,苍溪县岐坪镇场,0.006101,0.000664,其他商服用地,协议出让,20,住宿业,十三等级,0.0200,谭九红,1.50,1.50,2015年04月28日,2015年04月28日,2015年04月28日,,,苍溪县,2015年04月28日
吴忠市本级,6403002015A01177,金积镇新镇区公交停车场项目,金积镇新镇区政通路南侧、金积街西侧,0.455800,0.455800,公共设施用地,划拨,,国家机构,未评估地区,,,,1.00,2015年04月21日,2015年04月30日,2016年04月30日,,,吴忠市人民政府,2015年04月28日
惠州市本级,4413002015A12185-1,村集体留用地,大亚湾区霞涌晓联石化大道东侧地段,2.898800,0.000000,其他普通商品住房用地,划拨,,基层群众自治组织,二级,,,1.00,,2015年04月28日,2016年04月28日,2018年04月28日,,,惠州市国土资源局,2015年04月28日
犍为县,5111232015A00125,犍为县方舟新城区北侧农贸市场建设工程,犍为县玉津镇瑞雪村1组,0.233600,0.000000,公共设施用地,划拨,,居民服务业,一级,0.0000,,0.00,2.00,2015年06月30日,2015年12月31日,2016年12月31日,,,犍为县人民政府,2015年04月28日
顺德区,4406062015B85907-1,龙江邓建朗住宅用地,龙江镇坦西居委会二期新村C62地块,0.008000,0.008000,其他普通商品住房用地,协议出让,70,房地产业,三级,1.8641,邓建朗,0.00,0.00,1900年01月01日,1900年01月01日,1900年01月01日,,,顺德区,2015年04月28日
小河区,5201142015A00035,贵阳市交通技工学校扩建工程项目,贵阳经济技术开发区洛解村,1.540768,0.023768,科教用地,划拨,,教育业,二级,89.2042,,0.00,1.50,2015年07月28日,2015年10月29日,2017年10月30日,,,贵阳市人民政府,2015年04月28日
犍为县,5111232015A00110,城市基础设施建设用地,犍为县玉津镇瑞雪村1、2、3、9、10组,9.924600,0.000000,街巷用地,划拨,,公共设施管理业,一级,0.0000,,0.00,0.00,2015年12月31日,2016年12月31日,2019年12月31日,,,犍为县人民政府,2015年04月28日
哈尔滨市本级,2301002015B21147,工业,高新区迎宾路集中区昆仑路、东湖路及洪湖路围合用地内,2.912715,0.000000,工业用地,挂牌出让,50,农副食品加工业,八级,1465.0000,东方乐福国际生物科技有限公司,1.20,0.00,2015年05月14日,2016年05月13日,2019年05月12日,,,哈尔滨市,2015年04月28日
慈溪市,3302822015A00599,长河镇“农房两改”沧田农民公寓,长河镇沧田村,1.511200,1.511200,经济适用住房用地,划拨,,社会福利业,四级,196.4560,,1.00,2.40,2015年05月13日,2015年10月28日,2017年10月28日,,,慈溪市人民政府,2015年04月28日
镇海区,3302112015A00129,物流枢纽港海天路生态公园项目,招宝山街道海天路北侧、威海路东侧,1.887900,1.887900,公园与绿地,划拨,,公共设施管理业,六级,424.7775,,0.00,0.05,2015年05月08日,2016年04月28日,2018年04月28日,,,宁波市人民政府,2015年04月28日
龙游县,3308252015B00046-1,龙游县国土资源局M99地块出让,浙江龙游工业园区北斗大道以南，阜财路以西,1.726780,1.456100,工业用地,挂牌出让,50,棉、化纤纺织及印染精加工,十三等级,518.1000,龙游春泥数码印花有限公司,1.00,0.00,2015年05月07日,2016年05月06日,2018年05月06日,,,龙游县,2015年04月28日
安县,5107242015B00544,包装油生产项目,安县花荄镇花兴路北侧,3.598291,0.000000,工业用地,挂牌出让,50,农副食品加工业,一级,647.7000,四川陈氏菜籽王油脂有限公司,1.00,0.00,2015年05月30日,2016年04月30日,2019年04月30日,,,安县,2015年04月28日
利津县,3705222015A00214,利津县客运总站项目,规划津十路西侧、规划大桥路北侧,3.014281,0.000000,公路用地,划拨,,城市公共交通业,未评估地区,0.0000,,,0.50,2015年05月05日,2015年06月05日,2016年06月04日,,,利津县人民政府,2015年04月28日
宽甸满族自治县,2106242015B00212,宽甸昌德房地产开发有限公司,东关街道9街坊昌德湖畔嘉园20-22#楼一、二层南2号,0.014180,0.014180,其他商服用地,协议出让,40,房地产业,十三等级,3.4032,宽甸昌德房地产开发有限公司,,1.79,1900年01月01日,1900年01月01日,1900年01月01日,,,宽甸满族自治县,2015年04月28日
利津县,3705222015A00209,凤凰城街道中心幼儿园项目,规划津九路西侧，大桥路西延线南侧,0.313158,0.000000,科教用地,划拨,,教育业,未评估地区,0.0000,,,0.70,2015年05月05日,2015年06月05日,2016年06月04日,,,利津县人民政府,2015年04月28日
利津县,3705222015A00191,凤凰城街道中心幼儿园项目,规划津九路西侧，大桥路西延线南侧,0.390583,0.000000,科教用地,划拨,,教育业,未评估地区,0.0000,,,0.70,2015年05月05日,2015年06月05日,2016年06月04日,,,利津县人民政府,2015年04月28日
利津县,3705222015A00185,凤凰城街道中心学校项目,规划津九路西侧，大桥路西延线以北,3.710250,0.000000,科教用地,划拨,,教育业,未评估地区,0.0000,,,0.80,2015年05月05日,2015年06月05日,2016年06月04日,,,利津县人民政府,2015年04月28日
宽甸满族自治县,2106242015B00220,宽甸昌德房地产开发有限公司门市,东关街道9街坊昌德湖畔嘉园18-20#楼一、二层南7号,0.007158,0.007158,其他商服用地,协议出让,40,房地产业,十三等级,1.7900,宽甸昌德房地产开发有限公司,,1.79,1900年01月01日,1900年01月01日,1900年01月01日,,,宽甸满族自治县,2015年04月28日
门头沟区,1101092015A00017,门头沟区门头沟新城MC00-0017-6005等地块（S1线区域组团02地块中间地块）商业金融及医疗卫生项目中医疗卫生用地,门头沟新城17街区（石龙街区）,0.465012,0.000000,医卫慈善用地,划拨,,房地产业,八级,0.0000,,,1.60,2015年04月28日,2016年04月28日,2019年04月28日,,,北京市门头沟区人民政府,2015年04月28日
梁山县,3708322015A00149,梁山县人民检察院预防职务犯罪警示教育基地建设项目(杨营),东、北均邻杨营镇人民政府，南邻公明路，西邻文化路,0.053100,0.051280,公共设施用地,划拨,,公共设施管理业,十三等级,0.0000,,,1.17,2015年04月28日,1900年01月01日,1900年01月01日,,,梁山县人民政府,2015年04月28日
宽甸满族自治县,2106242015B00237,宽甸昌德房地产开发有限公司门市,东关街道9街坊昌德湖畔嘉园20-22#楼一层南5号,0.004267,0.004267,其他商服用地,协议出让,40,房地产业,十三等级,1.0668,宽甸昌德房地产开发有限公司,,1.79,1900年01月01日,1900年01月01日,1900年01月01日,,,宽甸满族自治县,2015年04月28日
清远市本级,4418002015A02177,欧瑞锋征地拆迁安置用地,清远市B11号区炒沙新村58号,0.008000,0.008000,其他普通商品住房用地,划拨,,房地产业,八级,0.0000,,1.00,1.43,2015年04月28日,2016年04月28日,2018年04月28日,,,清远市国土资源局,2015年04月28日
清远市本级,4418002015A02167,汤彩颜、朱海山征地拆迁安置用地,清远市B11号区炒沙新村137号,0.008000,0.008000,其他普通商品住房用地,划拨,,房地产业,八级,0.0000,,1.00,1.43,2015年04月28日,2016年04月28日,2018年04月28日,,,清远市国土资源局,2015年04月28日
清远市本级,4418002015A02154,欧金全征地拆迁安置用地,清远市B11号区炒沙新村29号,0.008000,0.008000,其他普通商品住房用地,划拨,,房地产业,八级,0.0000,,1.00,1.43,2015年04月28日,2016年04月28日,2018年04月28日,,,清远市国土资源局,2015年04月28日
清远市本级,4418002015A02148,欧灿洪征地拆迁安置用地,清远市B11号区炒沙新村37号,0.008000,0.008000,其他普通商品住房用地,划拨,,房地产业,八级,0.0000,,1.00,1.43,2015年04月28日,2016年04月28日,2018年04月28日,,,清远市国土资源局,2015年04月28日
乌鲁木齐市本级,6501002015A06941,急救中心,中环路以东,0.060173,0.060173,医卫慈善用地,划拨,,卫生,未评估地区,0.0000,,1.00,2.00,2015年04月28日,2015年05月28日,2016年05月28日,,,乌鲁木齐市国土资源局,2015年04月28日
清远市本级,4418002015A02133,欧炳森、欧雄杰征地拆迁安置用地,清远市B11号区炒沙新村72号,0.008000,0.008000,其他普通商品住房用地,划拨,,房地产业,八级,0.0000,,1.00,1.43,2015年04月28日,2016年04月28日,2018年04月28日,,,清远市国土资源局,2015年04月28日
清远市本级,4418002015A02122,梁月桂、朱伟健征地拆迁安置用地,清远市B11号区炒沙新村191号,0.008000,0.008000,其他普通商品住房用地,划拨,,房地产业,八级,0.0000,,1.00,1.43,2015年04月28日,2016年04月28日,2018年04月28日,,,清远市国土资源局,2015年04月28日
贵阳市本级,5201002015A05355,贵安新区百马路道路工程,花溪区、清镇市、乌当区,96.108700,0.000000,公路用地,划拨,,道路运输业,未评估地区,,,,,1900年01月01日,1900年01月01日,1900年01月01日,,,国务院,2015年04月28日
贵阳市本级,5201002015A05347,贵安新区清杨路道路工程,清镇市、花溪区,85.434500,0.000000,公路用地,划拨,,道路运输业,未评估地区,,,,,1900年01月01日,1900年01月01日,1900年01月01日,,,国务院,2015年04月28日
贵阳市本级,5201002015A05339,贵安新区贵安路一期及联络线道路工程,花溪区,92.092900,0.000000,公路用地,划拨,,道路运输业,未评估地区,,,,,1900年01月01日,1900年01月01日,1900年01月01日,,,国务院,2015年04月28日
清远市本级,4418002015A02104,欧灿强征地拆迁安置用地,清远市B11号区炒沙新村54号,0.008000,0.008000,其他普通商品住房用地,划拨,,房地产业,八级,0.0000,,1.00,1.43,2015年04月28日,2016年04月28日,2018年04月28日,,,清远市国土资源局,2015年04月28日
清远市本级,4418002015A02090,欧灿强征地拆迁安置用地,清远市B11号区炒沙新村52号,0.008000,0.008000,其他普通商品住房用地,划拨,,房地产业,八级,0.0000,,1.00,1.43,2015年04月28日,2016年04月28日,2018年04月28日,,,清远市国土资源局,2015年04月28日
清远市本级,4418002015A02080,欧鉴洪征地拆迁安置用地,清远市B11号区炒沙新村200号,0.008000,0.008000,其他普通商品住房用地,划拨,,房地产业,八级,0.0000,,1.00,1.43,2015年04月28日,2016年04月28日,2018年04月28日,,,清远市国土资源局,2015年04月28日
清远市本级,4418002015A02072,朱炳灿、朱伟健征地拆迁安置用地,清远市B11号区炒沙新村192号,0.008000,0.008000,其他普通商品住房用地,划拨,,房地产业,八级,0.0000,,1.00,1.43,2015年04月28日,2016年04月28日,2018年04月28日,,,清远市国土资源局,2015年04月28日
清远市本级,4418002015A02068,欧广佳征地拆迁安置用地,清远市B11号区炒沙新村201号,0.008000,0.008000,其他普通商品住房用地,划拨,,房地产业,八级,0.0000,,1.00,1.43,2015年04月28日,2016年04月28日,2018年04月28日,,,清远市国土资源局,2015年04月28日
清远市本级,4418002015A02055,谭少维征地拆迁安置用地,清远市B11号区炒沙新村156号,0.008000,0.008000,其他普通商品住房用地,划拨,,房地产业,八级,0.0000,,1.00,1.43,2015年04月28日,2016年04月28日,2018年04月28日,,,清远市国土资源局,2015年04月28日
清远市本级,4418002015A02048,谢子锋征地拆迁安置用地,清远市B11号区炒沙新村159号,0.008000,0.008000,其他普通商品住房用地,划拨,,房地产业,八级,0.0000,,1.00,1.43,2015年04月28日,2016年04月28日,2018年04月28日,,,清远市国土资源局,2015年04月28日
清远市本级,4418002015A02039,谢勇杰征地拆迁安置用地,清远市B11号区炒沙新村196号,0.008000,0.008000,其他普通商品住房用地,划拨,,房地产业,八级,0.0000,,1.00,1.43,2015年04月28日,2016年04月28日,2018年04月28日,,,清远市国土资源局,2015年04月28日
清远市本级,4418002015A02026,陈满全征地拆迁安置用地,清远市B11号区炒沙新村183号,0.008000,0.008000,其他普通商品住房用地,划拨,,房地产业,八级,0.0000,,1.00,1.43,2015年04月28日,2016年04月28日,2018年04月28日,,,清远市国土资源局,2015年04月28日
清远市本级,4418002015A02014,谢瑞波征地拆迁安置用地,清远市B11号区炒沙新村164号,0.008000,0.008000,其他普通商品住房用地,划拨,,房地产业,八级,0.0000,,1.00,1.43,2015年04月28日,2016年04月28日,2018年04月28日,,,清远市国土资源局,2015年04月28日
清远市本级,4418002015A02002,阮顺好征地拆迁安置用地,清远市B11号区炒沙新村143号,0.008000,0.008000,其他普通商品住房用地,划拨,,房地产业,八级,0.0000,,1.00,1.43,2015年04月28日,2016年04月28日,2018年04月28日,,,清远市国土资源局,2015年04月28日
清远市本级,4418002015A01993,何金凤、欧南狄征地拆迁安置用地,清远市B11号区炒沙新村69号,0.008000,0.008000,其他普通商品住房用地,划拨,,房地产业,八级,0.0000,,1.00,1.43,2015年04月28日,2016年04月28日,2018年04月28日,,,清远市国土资源局,2015年04月28日
清远市本级,4418002015A01985,谢京华、谢志明征地拆迁安置用地,清远市B11号区炒沙新村92号,0.008000,0.008000,其他普通商品住房用地,划拨,,房地产业,八级,0.0000,,1.00,1.43,2015年04月28日,2016年04月28日,2018年04月28日,,,清远市国土资源局,2015年04月28日
乌鲁木齐市本级,6501002015A07088,综合教学楼,天山区新民路178号,0.086119,0.086119,科教用地,划拨,,教育业,未评估地区,,,1.00,2.00,2015年04月28日,2015年04月28日,2016年04月28日,,,乌鲁木齐市国土资源局,2015年04月28日
清远市本级,4418002015A01975,欧文冲征地拆迁安置用地,清远市B11号区炒沙新村231号,0.008000,0.008000,其他普通商品住房用地,划拨,,房地产业,八级,0.0000,,1.00,1.43,2015年04月28日,2016年04月28日,2018年04月28日,,,清远市国土资源局,2015年04月28日
清远市本级,4418002015A01965,谢京华、谢志冲征地拆迁安置用地,清远市B11号区炒沙新村93号,0.008000,0.008000,其他普通商品住房用地,划拨,,房地产业,八级,0.0000,,1.00,1.43,2015年04月28日,2016年04月28日,2018年04月28日,,,清远市国土资源局,2015年04月28日
都匀市,5227012015B00420,贵州大隆药业有限责任公司,都匀经济开发区匀东镇大坪社区东冲,4.680800,0.000000,工业用地,挂牌出让,50,医药制造业,十三等级,1002.0000,贵州大隆药业有限责任公司,1.00,,2015年05月24日,2015年11月23日,2016年11月23日,,,,2015年04月28日
和静县,6528272015B00166,红枣深加工项目,和静县金泉制造加工新兴产业区内,5.466200,0.000000,工业用地,挂牌出让,50,食品制造业,未评估地区,114.7902,新疆鼎商盛世商贸有限公司,1.00,,2015年04月28日,2015年04月28日,2017年04月28日,,,和静县,2015年04月28日
清远市本级,4418002015A01956,朱汝明征地拆迁安置用地,清远市B11号区炒沙新村95号,0.008000,0.008000,其他普通商品住房用地,划拨,,房地产业,八级,0.0000,,1.00,1.43,2015年04月28日,2016年04月28日,2018年04月28日,,,清远市国土资源局,2015年04月28日
瑞金市,3607812015B00122,龙珠湖周边开发用地S3地块商业开发,象湖镇七彩大道西侧,0.389200,0.113400,其他商服用地,挂牌出让,40,房地产业,三级,1220.0000,瑞金市宏信达置业有限公司,1.20,1.50,2015年06月28日,2015年08月28日,2017年08月28日,,,瑞金市,2015年04月28日
兴和县,1509242015A00060,兴和县公安局指挥中心业务技术用房用地,兴达路东、北环路北,2.600000,0.000000,机关团体用地,划拨,,国家机构,十五等级,0.0000,,0.00,0.80,2015年04月29日,2015年05月01日,2015年06月30日,,,兴和县人民政府,2015年04月28日
清远市本级,4418002015A01941,张焕娣征地拆迁安置用地,清远市B11号区炒沙新村96号,0.008000,0.008000,其他普通商品住房用地,划拨,,房地产业,八级,0.0000,,1.00,1.43,2015年04月28日,2016年04月28日,2018年04月28日,,,清远市国土资源局,2015年04月28日
清远市本级,4418002015A01936,谢金荣征地拆迁安置用地,清远市B11号区炒沙新村14号,0.008000,0.008000,其他普通商品住房用地,划拨,,房地产业,八级,0.0000,,1.00,1.43,2015年04月28日,2016年04月28日,2018年04月28日,,,清远市国土资源局,2015年04月28日
清远市本级,4418002015A01927,谢天桂征地拆迁安置用地,清远市B11号区炒沙新村91号,0.008000,0.008000,其他普通商品住房用地,划拨,,房地产业,八级,0.0000,,1.00,1.43,2015年04月28日,2016年04月28日,2018年04月28日,,,清远市国土资源局,2015年04月28日
清远市本级,4418002015A01915,欧树坚、欧志坚征地拆迁安置用地,清远市B11号区炒沙新村232号,0.008000,0.008000,其他普通商品住房用地,划拨,,房地产业,八级,0.0000,,1.00,1.43,2015年04月28日,2016年04月28日,2018年04月28日,,,清远市国土资源局,2015年04月28日
梓潼县,5107252015B00696,私房,文昌镇中和街西段,0.001905,0.001905,其他普通商品住房用地,协议出让,70,住宿业,二级,0.8582,岳明浩 王雪琼,0.00,0.00,2015年04月02日,1900年01月01日,1900年01月01日,,,梓潼县,2015年04月28日
清远市本级,4418002015A01903,欧振华、欧灿明征地拆迁安置用地,清远市B11号区炒沙新村174号,0.008000,0.008000,其他普通商品住房用地,划拨,,房地产业,八级,0.0000,,1.00,1.43,2015年04月28日,2016年04月28日,2018年04月28日,,,清远市国土资源局,2015年04月28日
红塔区,5304022015A00061,红龙路道路改扩建一期工程,红塔区红龙路,2.259600,2.259600,街巷用地,划拨,,公共设施管理业,一级,1235.9999,,,,2015年04月30日,2016年04月30日,2018年04月30日,,,玉溪市人民政府,2015年04月28日
都匀市,5227012015B00410,贵州归兰山饮业有限公司,都匀经济开发区匀匀东镇洛邦社区白泥田,1.970900,0.000000,工业用地,挂牌出让,50,批发业,十三等级,422.0000,贵州归兰山饮业有限公司,1.00,,2015年05月24日,1900年01月01日,1900年01月01日,,,,2015年04月28日
长寿区,5001152015A00345,新建长寿经开区危化品综合应急管理中心及武警特勤消防二站项目,晏家街道,1.857000,1.857000,公共设施用地,划拨,,公共设施管理业,十级,4406.0250,,,,2015年05月04日,2015年11月04日,2017年11月04日,,,重庆市长寿区人民政府,2015年04月28日
田东县,4510222015B00140,张萍,田东县平马镇油城路长兴巷75号,0.006000,0.006000,其他普通商品住房用地,协议出让,70,房地产业,二级,5.2080,张萍,1.00,5.00,2015年04月28日,2016年04月28日,2017年04月28日,,,田东县,2015年04月28日
清远市本级,4418002015A01895,欧振华、欧志亮征地拆迁安置用地,清远市B11号区炒沙新村175号,0.008000,0.008000,其他普通商品住房用地,划拨,,房地产业,八级,0.0000,,1.00,1.43,2015年04月28日,2016年04月28日,2018年04月28日,,,清远市国土资源局,2015年04月28日
宜昌市本级,4205002015B01669,宜昌国闰房地产有限公司一宗位于共谊一路北侧（共勤村二组）居住项目用地,共谊一路北侧（共勤村二组）,0.476106,0.476106,其他普通商品住房用地,协议出让,48,房地产业,三级,0.0000,宜昌国闰房地产有限公司,1.00,2.28,2015年03月01日,2015年09月30日,2018年10月01日,,,宜昌市,2015年04月28日
龙州县,4514232015A00386,吴丽华安置用地,龙州镇朝阳小学后地块C区,0.008000,0.008000,其他普通商品住房用地,划拨,,房地产业,一级,0.0000,,1.00,3.50,2015年05月18日,2016年04月30日,2018年04月30日,,,龙州县人民政府,2015年04月28日
清远市本级,4418002015A01885,欧富基、欧富祺、欧慧玲、欧惠婵征地拆迁安置用地,清远市B11号区炒沙新村48号,0.008000,0.008000,其他普通商品住房用地,划拨,,房地产业,八级,0.0000,,1.00,1.43,2015年04月28日,2016年04月28日,2018年04月28日,,,清远市国土资源局,2015年04月28日
建德市,3301822015B00297-1,杭州石祥建材有限公司,钦堂乡谢田村,1.666700,0.000000,工业用地,挂牌出让,50,砖瓦、石材及其他建筑材料制造,十二级,307.0000,杭州石祥建材有限公司,1.00,0.00,2015年07月16日,2015年10月28日,2017年04月28日,,,建德市,2015年04月28日
清远市本级,4418002015A01877,清城区洲心街三角村委会炒沙村民小组征地拆迁安置用地,清远市B11号区炒沙新村123号,0.008000,0.008000,其他普通商品住房用地,划拨,,房地产业,八级,0.0000,,1.00,1.43,2015年04月28日,2016年04月28日,2018年04月28日,,,清远市国土资源局,2015年04月28日
清远市本级,4418002015A01869,清城区洲心街三角村委会炒沙村民小组征地拆迁安置用地,清远市B11号区炒沙新村124号,0.008000,0.008000,其他普通商品住房用地,划拨,,房地产业,八级,0.0000,,1.00,1.43,2015年04月28日,2016年04月28日,2018年04月28日,,,清远市国土资源局,2015年04月28日
寿光市,3707832015B00606,采矿用地（盐田）,寿光市羊口镇羊田路以东、营子沟以北,16.035100,16.035100,采矿用地,协议出让,50,其他采矿业,二级,1667.6504,寿光市宏景城镇建设投资有限公司,0.00,0.00,2015年04月28日,1900年01月01日,1900年01月01日,,,寿光市,2015年04月28日
寿光市,3707832015B00617,采矿用地（盐田）,寿光市羊口镇羊田路以东、营子沟以北,12.493400,12.493400,采矿用地,协议出让,50,其他采矿业,二级,1299.3136,寿光市宏景城镇建设投资有限公司,0.00,0.00,2015年04月28日,1900年01月01日,1900年01月01日,,,寿光市,2015年04月28日
